product_id,product_name,brand_id,brand_name,loves_count,rating,reviews,size,variation_type,variation_value,variation_desc,ingredients,price_usd,value_price_usd,sale_price_usd,limited_edition,new,online_only,out_of_stock,sephora_exclusive,highlights,primary_category,secondary_category,tertiary_category,child_count,child_max_price,child_min_price
P448733,"Hydrating Recovery Shampoo for Dry, Damaged & Colored Hair",6304,Virtue,7785,4.183,153.0,8 oz/ 240 mL,Size,8 oz/ 240 mL,,,40.0,,,0,0,1,0,0,"['Good for: Damage', 'Vegan', 'Good for: Color Care', 'Without Parabens', 'Without Sulfates SLS & SLES']",Hair,Shampoo & Conditioner,Shampoo,2,74.0,16.0
P476419,Aglow Golden Priming Oil,6216,lilah b.,4902,4.6207,58.0,1 oz / 30 mL,Size,1 oz / 30 mL,,"['Prunus Amygdalus Dulcis (Sweet Almond) Oil, Rosa Damascena Flower Water, Mica, Polyglyceryl-4 Oleate, Tocopherol, Pentylene Glycol, Polyglyceryl-6 Oleate, Polyhydroxystearic Acid, Quaternium-90 Bentonite, Caprylic/Capric Triglyceride, Calophyllum Inophyllum Seed Oil, Simmondsia Chinensis (Jojoba) Seed Oil, Sodium Chloride, Undecane, Water, Lavandula Angustifolia (Lavender) Oil, Butylene Glycol, Tridecane, Phenoxyethanol, Vitis Vinifera (Grape) Fruit Extract, Dimethicone, Aluminum Hydroxide, Maltodextrin, Camellia Sinensis Leaf Extract, Camellia Sinensis Leaf Powder, Citric Acid, Tocopherol, [+/-: Iron Oxides (CI 77491, CI 77492, CI 77499), Titanium Dioxide (CI 77891)].']",68.0,,34.0,0,0,0,1,0,"['Vegan', 'Radiant Finish', 'Good for: Dullness/Uneven Texture', 'Hydrating', 'Clean at Sephora', 'Cruelty-Free']",Makeup,Face,Face Primer,1,25.0,12.5
P456992,Superdefense SPF 25 Fatigue + 1st Signs of Age Multi-Correcting Cream,1254,CLINIQUE,3096,3.8824,17.0,1.7 oz/ 50 mL,Type,Combination + Oily Skin,,"['Water\\Aqua\\Eau, Ethylhexyl Salicylate, Homosalate, Butyloctyl Salicylate, Dimethicone, Polyester-8, Butyl Methoxydibenzoylmethane, Cetearyl Alcohol, Glyceryl Stearate, Peg-100 Stearate, Shea Butter Ethyl Esters, Butylene Glycol, Petrolatum, Styrene/Acrylates Copolymer, Glycerin, Niacinamide, Trehalose, Vp/Eicosene Copolymer, Daucus Carota Sativa (Carrot) Root Extract, Brassica Oleracea Gemmifera (Brussels Sprouts) Extract, Vaccinium Macrocarpon (Cranberry) Fruit Extract, Resveratrol, Brassica Oleracea Italica (Broccoli) Extract, Acetyl Carnitine HCL, Vaccinium Angustifolium (Blueberry) Fruit Extract, Salicylic Acid, Brassica Oleracea Acephala (Kale) Leaf Extract, Creatine, Spinacia Oleracea (Spinach) Leaf Extract, Cucumis Sativus (Cucumber) Fruit Extract, Lactobacillus Ferment, Adenosine Phosphate, Hordeum Vulgare (Barley) Extract\\Extrait D’orge, Sigesbeckia Orientalis (St. Paul Wort) Extract, Albizia Julibrissin Bark Extract, Arabidopsis Thaliana Extract, Plankton Extract, Isohexadecane, Oryza Sativa (Rice) Bran Extract, Potassium Cetyl Phosphate, Tocopheryl Acetate, Caffeine, Ethylhexylglycerin, Algae Extract, Micrococcus Lysate, Ergothioneine, Sodium Hyaluronate, 7-Dehydrocholesterol, Caprylyl Glycol, Biosaccharide Gum-4, Hydrogenated Palm Glycerides, Acrylates/C10-30 Alkyl Acrylate Crosspolymer, Propylene Glycol Dicaprate, Peg-8 Laurate, Helianthus Annuus (Sunflower) Seedcake, Polyethylene, Yeast Extract\\Faex\\Extrait De Levure, Tromethamine, Dimethiconol, Sodium Rna, Polysorbate 80, Lecithin, Sea Whip Extract, Xanthan Gum, Acrylamide/Sodium Acryloyldimethyltaurate Copolymer, Tetrahexyldecyl Ascorbate, Propylene Glycol Caprylate, Phytic Acid, Disodium Edta, Bht, Phenoxyethanol, Mica, Titanium Dioxide (Ci 77891).']",56.0,,,0,0,0,1,0,,Skincare,Moisturizers,Moisturizers,0,,
P441884,Tinted Face Oil Comfy Skin Tint,6279,Kosas,112124,3.6687,1781.0,1.0 oz/ 30 mL,Color,Tone 01,light with cool undertones,"['Coco-Caprylate/Caprate, Octyldodecanol, Simmondsia Chinensis (Jojoba) Seed Oil, Persea Gratissima (Avocado) Oil, Silica, Mica, Oryza Sativa (Rice) Bran Extract, Camellia Oleifera Seed Oil, Kaolin, Limnanthes Alba (Meadowfoam) Seed Oil, Rosa Canina Fruit Oil; Helianthus Annuus (Sunflower) Extract, Rosmarinus Officinalis (Rosemary) Leaf Extract, Rubus Idaeus (Raspberry) Seed Oil, Tocopherol, [+/ -: Titanium Dioxide (CI 77891), Iron Oxide (CI 77492), Iron Oxide (CI 77491), Iron Oxide (CI 77499)]']",42.0,,,0,0,0,0,0,"['Liquid Formula', 'allure 2019 Best of Beauty Award Winner', 'Community Favorite', 'Clean + Planet Positive', 'Satin Finish', 'Medium Coverage']",Makeup,Face,Foundation,11,42.0,42.0
P482709,Cheek Clapper 3D Blush Trio Palette,6326,ONE/SIZE by Patrick Starrr,95820,4.7403,335.0,,Color,Attention Seeker,,,38.0,,,0,1,0,0,0,"['Vegan', 'Pressed Powder Formula', 'Natural Finish', 'Cream Formula', 'Long-wearing', 'Cruelty-Free']",Makeup,Cheek,Blush,4,38.0,19.0
P501168,Triple Bond Complex Leave-in Hair Treatment,5936,Living Proof,21343,4.3859,622.0,1.5 oz / 45 mL,Size,1.5 oz / 45 mL,,"['Water/Eau/Aqua, Cetyl Alcohol, Glyceryl Stearate, Isodecyl Oleate, Isopentyldiol, Dioctyldodecyl Dodecanedioate, Sodium Phytate, Phytosteryl/Octyldodecyl Lauroyl Glutamate, Olea Europaea (Olive) Leaf Extract, Helianthus Annuus (Sunflower) Seed Wax, Jojoba Esters, Linoleamidopropyl Dimethylamine Dimer Dilinoleate, C10-18 Triglycerides, Ricinus Communis (Castor) Seed Oil, Glyceryl Ricinoleate, Cyclodextrin, Propanediol, Glycerin, Pentylene Glycol, Ceteth-20, Steareth-20, PEG-75 Stearate, Polyglycerin-3, Hydroxypropyl Methylcellulose, Cyamopsis Tetragonoloba (Guar) Gum, Hydroxyethylcellulose, Xanthan Gum, Caesalpinia Spinosa Gum, Fragrance/Parfum, Citric Acid, Sodium Hydroxide, Gluconic Acid, Hydroxyacetophenone, Sodium Benzoate, Linalool, Hexyl Cinnamal, Citronellol, Citral, Limonene.']",45.0,,,0,0,0,0,0,"['Good for: Damage', 'Heat Protection', 'Without Silicones', 'Without Sulfates SLS & SLES', 'Cruelty-Free']",Hair,Hair Styling & Treatments,Leave-In Conditioner,1,20.0,20.0
P504044,Pro-Retinol Megamoisture Face Cream,5922,Josie Maran,3498,4.7518,278.0,1.7 oz / 50 mL,Size,1.7 oz / 50 mL,,"['Aqua (Water), Caprylic/Capric Triglyceride, Triethylhexanoin, Glycerin, Solanum Tuberosum (Potato) Pulp Extract, Squalane, Dicapryl Succinate, C12-16 Alcohols, Octyldodecyl PCA, C14-22 Alcohols, Behenyl Behenate, Carthamus Tinctorius (Safflower) Oleosomes, Helianthus Annuus (Sunflower) Seed Oil Unsaponifiables, Dunaliella Salina (Pink Algae) Extract, Argania Spinosa (Argan) Kernel Oil, Algin, Beta-Carotene, Quercetin, Sodium Hyaluronate, Tocopherol, Tocopheryl Acetate, Aloe Barbadensis Leaf Juice, Butyrospermum Parkii (Shea) Butter, Bisabolol, Citrullus Lanatus (Watermelon) Seed Oil, Cucumis Sativus (Cucumber) Fruit Water, Alpha-Glucan Oligosaccharide, Helianthus Annuus (Sunflower) Seed Oil, Olea Europaea (Olive) Fruit Oil, Mangifera Indica (Mango) Pulp Extract, Musa Sapientum (Banana) Pulp Extract, Spondias Mombin Pulp Extract, Symphytum Officinale Leaf Extract, Biosaccharide Gum-1, Biosaccharide Gum-4, Palmitic Acid, C12-20 Alkyl Glucoside, Propanediol, Polyhydroxystearic Acid, Ethylhexylglycerin, Hydrogenated Lecithin, Lecithin, Sodium Phytate, Sucrose Palmitate, Alkanna Tinctoria Root Extract, Euphorbia Cerifera (Candelilla) Wax, Furcellaran, Phenoxyethanol, Caprylhydroxamic Acid, Phenethyl Alcohol, Glyceryl Linoleate, Gluconic Acid, Potassium Sorbate, Benzyl Alcohol, Sodium Benzoate, Citric Acid, Alcohol.']",54.0,,,0,0,1,0,0,"['Vegan', 'Plumping', 'Clean at Sephora', 'Retinol', 'Good for: Anti-Aging', 'Fragrance Free']",Skincare,Moisturizers,Moisturizers,0,,
P502212,SinglePass Curl ¾” Professional Curling Iron,5780,T3,1522,4.9216,51.0,,,,,,169.99,,,0,0,1,0,0,"['Good for: Volume', 'All Hair Types', 'Curl-Enhancing', 'Good for: Frizz', 'Coily Hair', 'Curly Hair']",Hair,Tools,Curling Irons,0,,
P387906,Audacious Lipstick,3976,NARS,330693,4.6191,2032.0,0.14 oz/ 4 g,Color,Mona,mahogany,"['Ricinus Communis (Castor) Seed Oil, Bis-Diglyceryl Polyacyladipate-2, Ethylhexyl Palmitate, Isononyl Isononanoate, Euphorbia Cerifera (Candelilla) Wax, Ozokerite, Hydrogenated Polycyclopentadiene, Butyrospermum Parkii (Shea) Butter, Microcrystalline Wax/Cera Microcristallina, Cetearyl Alcohol, Isopropyl Myristate, Ceteareth-20, Silica, Cetearyl Ethylhexanoate, Polyethylene, Copernicia Cerifera (Carnauba) Wax, Isopropyl Titanium Triisostearate, Caprylyl Glycol, Stearalkonium Hectorite, Phenoxyethanol, Coprinus Comatus (Mushroom) Extract, Polyhydroxystearic Acid, Lecithin, Calophyllum Inophyllum Seed Oil, Simethicone, Tocopheryl Acetate, Sorbitan Isostearate, Hexylene Glycol, Dextrin, Water, Propylene Carbonate, Hydrogenated Phosphatidylcholine, Lysolecithin, Portulaca Pilosa Extract, Tocopherol, Sucrose Cocoate, Ascorbyl Palmitate, Palmitoyl Tripeptide-38, Disodium Edta, [+/- (May Contain): Mica, Titanium Dioxide (Ci 77891), Iron Oxides (Ci 77491), Iron Oxides (Ci 77492), Iron Oxides (Ci 77499), Blue 1 Lake (Ci 42090), Red 28 (Ci 45410), Red 33 Lake (Ci 17200), Red 6 Lake (Ci 15850), Red 7 Lake (Ci 15850), Yellow 5 Lake (Ci 19140), Yellow 6 Lake (Ci 15985)].']",34.0,,,0,0,0,0,0,,Makeup,Lip,Lipstick,9,34.0,34.0
P395117,Double Header Shampoo + Conditioner,3297,Jack Black,2172,4.1875,16.0,16 oz,Size,16 oz,,"['Water, Disodium Laureth Sulfosuccinate, Sodium Methyl Cocoyl Taurate, Cocamide MEA, Cocamidopropyl Hydroxysultaine, PEG-7 Glyceryl Cocoate, Amodimethicone, Sodium Lauryl Sulfoacetate,  Sodium Lauroyl Sarcosinate, Decyl Glucoside, Lauryl Glucoside, Glycerin,  Coconut Oil Glycereth-8 Esters, Dimethicone, Shea Butter Glycereth-8 Esters, Cocos Nucifera (Coconut) Water, Citrus Grandis (Grapefruit) Peel Oil*, Camellia Sinensis Leaf Extract*, Macrocystis Pyrifera (Kelp) Extract*, Ocimum Basilicum (Basil) Leaf Extract*, Cocos Nucifera (Coconut) Oil, Oryza Sativa (Rice) Extract, Hydrolyzed Lupine Protein, Oryza Sativa (Rice) Seed Protein, Salvia Lavandulaefolia (Sage) Leaf Oil, Phytic Acid, Creatine, Mentha Piperita (Peppermint) Oil, Panthenol, Citric Acid, Ethylhexylglycerin, Glycol Distearate, Acrylates Copolymer, Cetrimonium Chloride, Polyquaternium-10, Trideceth-12, Polyquaternium-7, C11-15 Pareth-7, Laureth-23, PEG-150 Distearate,  Laureth-4, Sodium Phytate, Laureth-9, Dipropylene Glycol, Cystine Bis-PG-Propyl Silanetriol, Sodium Hydroxide, BHT, Phenoxyethanol, Chlorphenesin, Potassium Sorbate, Sodium Benzoate, Benzyl Alcohol, Limonene, Linalool.']",34.0,,,0,0,0,0,0,,Men,Hair,Shampoo & Conditioner,0,,
P455341,Classic Body Organic Sunscreen Spray SPF 70 Peach Blossom,7091,COOLA,8003,4.2692,52.0,6.0 oz/ 177 mL,Size,6.0 oz/ 177 mL,,"['Alcohol (ORGANIC), Bisabolol (ORGANIC), Brassica Campestris (Rapeseed) Seed Oil, Butyloctyl Salicylate, Camelina Sativa Seed Oil, Carthamus Tinctorius (Safflower) Seed Oil (ORGANIC), Cocos Nucifera (Coconut) Oil, Decanal, Ethyl Ferulate, Ethyl Hexanoate, Ethylhexyl Methoxycrylene, Gamma-Nonalactone, Gamma-Undecalactone, Glycerin, Heliotropine, Hexyl Acetate, Limnanthes Alba (Meadowfoam) Seed Oil, Mauritia Flexuosa (Buriti) Fruit Oil (ORGANIC), Opuntia Ficus-Indica Flower Extract, Polyester-8, Prunus Persica (Peach) Flower Extract, Rubus Idaeus (Raspberry) Seed Oil (ORGANIC), Triethyl Citrate, VA/Butyl Maleate/Isobornyl Acrylate Copolymer, Water.']",28.0,,,0,0,1,0,0,"['Liquid Formula', 'Clean at Sephora', 'Hydrating', 'Reef Safe SPF', 'SPF']",Skincare,Sunscreen,Body Sunscreen,0,,
P501404,Rapid Repair Hair Mask,6372,BondiBoost,6772,4.9937,158.0,8.45 oz / 250 mL,Type,,,"['Aloe Barbadensis (Aloe Vera) Leaf Juice, Cetearyl Alcohol, Behentrimonium Chloride, Glycerin, Coco-Caprylate, Polyquaternium-10, Butyrospermum Parkii (Shea) Butter, Propanediol, Hydroxypropyl Guar Hydroxypropyltrimonium Chloride, Argania Spinosa (Argan) Kernel Oil, Panthenol (Pro Vitamin B5), Hydrolyzed Quinoa, Olea Europaea (Olive) Fruit Oil, Prunus Amygdalus Dulcis (Sweet Almond) Oil, Vitis Vinifera (Grape) Seed Oil, Caprylic/Capric Triglyceride, Queensland Nut (Macadamia Ternifolia) Seed Oil, Lavandula Angustifolia (Lavender) Flower Oil, Equisetum Arvense (Horsetail) Leaf Extract, Hydrolyzed Jojoba Esters, Terminalia Ferdinandiana (Kakadu Plum) Fruit Extract, Lycium Barbarum (Goji Berry) Fruit Extract, Coffea Robusta (Green Coffee) Seed Extract, Rosmarinus Officinalis (Rosemary) Leaf Extract, Cucumis Sativus (Cucumber) Fruit Extract, Hydrolyzed Brazil Nut Protein, Fragrance, Pentylene Glycol, Caprylyl Glycol, Ethylhexylglycerin, Citric Acid.']",29.95,,,0,1,1,0,0,"['Good for: Damage', 'Vegan', 'Good for: Color Care', 'Hydrating', 'Clean at Sephora', 'Good for: Dryness']",Hair,Hair Styling & Treatments,Hair Masks,0,,
P469088,Fulvic Acid Brightening Cleanser,6285,The INKEY List,38263,4.4203,345.0,5 oz/ 150 mL,Size,5 oz/ 150 mL,,"['Water (Aqua/Eau), Coco-Glucoside, Glycerin, Butylene Glycol, Xanthan Gum, Phenoxyethanol, Benzyl Alcohol, Aloe Barbadensis Leaf Juice, Caprylic/Capric Triglyceride, Peat, Glycyrrhiza Glabra (Licorice) Root Extract, PEG-200 Hydrogenated Glyceryl Palmate, PEG-7 Glyceryl Cocoate, Disodium EDTA, Helianthus Annuus (Sunflower) Seed Oil, Prunus Amygdalus Dulcis (Sweet Almond) Oil, Dehydroacetic Acid, Terminalia Ferdinandiana Fruit Extract, Potassium Sorbate.']",11.99,,,0,0,0,0,1,"['Good for: Dullness/Uneven Texture', 'Good for: Dark Circles', 'Clean at Sephora', 'Cruelty-Free']",Skincare,Cleansers,Face Wash & Cleansers,1,5.99,5.99
P445441,Smooth Paddle Brush,5780,T3,7599,3.6,15.0,,,,,,35.0,,,0,0,1,0,0,,Hair,Tools,Brushes & Combs,0,,
P500467,Mini Sleep Stone Solid Body Moisturizer,6499,Kate McLeod,2769,4.7826,92.0,1 oz / 30 g,Size,1 oz / 30 g,,"['Theobroma Cacao (Cocoa) Seed Butter, Prunus Amygdalus Dulcis (Sweet Almond) Oil, Prunus Armeniaca (Apricot) Kernel Oil, Persea Gratissima (Avocado) Oil, Cocos Nucifera (Fractionated Coconut) Oil, Lavandula Angustifolia (Lavender) Oil, Chamomilla Recutita (Matricaria) Oil.']",12.0,,,0,0,1,0,0,"['Vegan', 'Refill Available', 'Clean + Planet Positive', 'Hydrating', 'Good for: Dryness', 'Cruelty-Free']",Mini Size,Bath & Body,,0,,
P504220,tartelette energy Amazonian clay palette,5648,tarte,3602,4.3333,6.0,,Color,,,"['Positive:', 'Mica, Octyldodecyl Stearoyl Stearate, Bis-Diglyceryl Polyacyladipate-2, Dimethicone, Pentaerythrityl Tetraisostearate, Kaolin, Phenoxyethanol, Silica, Ethylhexylglycerin, Tin Oxide, Tocopherol, Titanium Dioxide (Ci 77891), Iron Oxides (Ci 77491, Ci 77492, Ci 77499), Red 40 Lake (Ci 16035).', 'Energized:', 'Mica, Synthetic Fluorphlogopite, Octyldodecyl Stearoyl Stearate, Dimethicone, Pentaerythrityl Tetraisostearate, Kaolin, Phenoxyethanol, Silica, Ethylhexylglycerin, Tin Oxide, Tocopherol, Iron Oxides (Ci 77491), Titanium Dioxide (Ci 77891).', 'Dynamic:', 'Talc, Mica, Boron Nitride, Diisostearyl Malate, Dimethicone, Dimethicone/Vinyl Dimethicone Crosspolymer, Pentaerythrityl Tetraisostearate, Silica, Kaolin, Phenoxyethanol, Ethylhexylglycerin, Tocopherol, Yellow 5 Lake (Ci 19140), Iron Oxides (Ci 77491, Ci 77499), Red 40 Lake (Ci 16035).', 'Magnetic:', 'Mica, Talc, Boron Nitride, Diisostearyl Malate, Dimethicone, Dimethicone/Vinyl Dimethicone Crosspolymer, Pentaerythrityl Tetraisostearate, Silica, Kaolin, Phenoxyethanol, Ethylhexylglycerin, Tocopherol. (+/-): Titanium Dioxide (Ci 77891), Red 40 Lake (Ci 16035), Manganese Violet (Ci 77742), Ultramarines (Ci 77007), Iron Oxides (Ci 77491, Ci 77499).', 'Creativity:', 'Mica, Octyldodecyl Stearoyl Stearate, Calcium Sodium Borosilicate, Bis-Diglyceryl Polyacyladipate-2, Dimethicone, Pentaerythrityl Tetraisostearate, Synthetic Fluorphlogopite, Kaolin, Phenoxyethanol, Silica, Ethylhexylglycerin, Tin Oxide, Tocopherol, Iron Oxides (Ci 77491), Titanium Dioxide (Ci 77891).', 'Power:', 'Mica, Talc, Boron Nitride, Diisostearyl Malate, Dimethicone, Dimethicone/Vinyl Dimethicone Crosspolymer, Pentaerythrityl Tetraisostearate, Silica, Kaolin, Phenoxyethanol, Ethylhexylglycerin, Tocopherol. (+/-): Titanium Dioxide (Ci 77891), Red 40 Lake (Ci 16035), Manganese Violet (Ci 77742), Ultramarines (Ci 77007), Iron Oxides (Ci 77491, Ci 77499).']",25.0,,,1,0,0,0,0,"['Vegan', 'Pressed Powder Formula', 'Long-wearing', 'Gluten Free', 'Cruelty-Free']",Makeup,Eye,Eye Palettes,1,45.0,45.0
P504600,Mini GRO Dry Shampoo for Thinning Hair,6365,Vegamour,505,4.3356,450.0,1.8 oz / 51g,Size,1.8 oz / 51g,,"['Isobutane, Oryza Sativa (Rice) Starch, Denatured Alcohol, Hydrated Aluminum (Kaolin) Silicate, Citrus Aurantium Bergamia (Bergamot) Fruit Oil, Distearyldimonium Chloride, Cetrimonium Chloride, Glycerin,  Water (Aqua), Trifolium Pratense (Clover) Extract']",18.0,,,0,1,0,0,1,"['Vegan', 'Good for: Volume', 'Clean at Sephora', 'Good for: Hair Thinning', 'Without Sulfates SLS & SLES', 'Good for: Oily Scalp']",Hair,Mini Size,,0,,
P505615,Ultra Facial Cleanser Home & Away Bundle,6218,Kiehl's Since 1851,9,,,,,,,"['Water, Sodium Laureth Sulfate, Decyl Glucoside, Glycerin, Cocamidopropyl Betaine, Disodium Cocoamphodiacetate, Acrylates Copolymer, PEG-200 Hydrogenated Glyceryl Palmate, Lauryl Glucoside, Sodium Chloride, Pentylene Glycol, Triethanolamine, Phenoxyethanol, PEG-7 Glyceryl Cocoate, Distearyl Ether, Behenyl Alcohol, Methylparaben, Laureth-2, Propylparaben, Sodium Methylparaben, Squalane, Prunus Amygdalus Dulcis Oil/Sweet Almond Oil, Prunus Armeniaca Kernel Oil/Apricot Kernel Oil, Tocopherol, Ascorbyl Glucoside, Persea Gratissima Oil/Avocado Oil, Sodium Hydroxide, Citric Acid.']",26.0,40.0,,1,1,1,0,0,"['Clean at Sephora', 'Without Parabens', 'Best for Dry, Combo, Normal Skin']",Skincare,Value & Gift Sets,,0,,
P504421,Overnight Hydrating Mask,3902,SEPHORA COLLECTION,5527,4.8268,231.0,1.69 oz / 50 mL,Size,1.69 oz / 50 mL,,"['Hyaluronic and Polyglutamic Acids: From natural origin derived from wheat and corn and soybeans; moisturizes the skin.', 'Aqua (Water), Helianthus Annuus (Sunflower) Seed Oil, Glycerin, Betaine, Methylpropanediol, Polyacrylate Crosspolymer-6, 1,2-Hexanediol, Simmondsia Chinensis (Jojoba) Seed Oil, Carbomer, Glyceryl Caprylate, Sodium Hyaluronate, Sodium Hydroxide, Sodium Phytate, O-Cymen-5-Ol, Tocopherol, Polyglutamic Acid.']",16.0,,,0,1,0,0,1,"['Vegan', 'Hyaluronic Acid', 'Best for Dry Skin', 'Good for: Loss of firmness', 'Clean + Planet Positive']",Skincare,Masks,Face Masks,0,,
P411396,Superhero Elastic Stretch Volumizing and Lengthening Mascara,6175,IT Cosmetics,43644,3.7452,1656.0,0.30 oz/ 9 g,Color,Super Black,,"['Aqua/Water/Eau, Copernicia Cerifera Cera/Carnauba Wax/Cire De Carnauba, Cyclopentasiloxane, Oryza Sativa Cera/Rice Bran Wax, Hydrogenated Olive Oil Stearyl Esters, Alcohol Denat., Stearic Acid, Palmitic Acid, Triethanolamine, Acacia Senegal Gum, Euphorbia Cerifera Cera/Candelilla Wax, Propylene Glycol, Phenoxyethanol, Vp/Va Copolymer, Aminomethyl Propanediol, Isopropyl Alcohol, Polyvinyl Alcohol, Chlorphenesin, Ethylhexylglycerin, Tocopheryl Acetate, Biotin, Glycerin, T-Butyl Alcohol, Butylene Glycol, Hydrolyzed Collagen, Carbomer, Sodium Lactate, Polysorbate 20, Palmitoyl Tripeptide-1, Palmitoyl Tetrapeptide-7, [+/-: Ci 77499/Iron Oxides].']",26.0,,,0,0,0,0,0,"['Volumizing', 'Collagen', 'Without Phthalates', 'Lengthening', 'Without Parabens', 'Without Sulfates SLS & SLES']",Makeup,Eye,Mascara,1,15.0,15.0
P478734,Ébène Fumé Eau de Parfum,5869,TOM FORD,8992,4.2469,1142.0,1.7 oz/ 50 mL,Size + Concentration + Formulation,1.7 oz/ 50 mL,,"['Alcohol Denat., Water/Aqua/Eau, Fragrance (Parfum), Limonene, Alpha-Isomethyl Ionone, Benzyl Benzoate, Linalool, Citral, Benzyl Cinnamate, Butyl Methoxydibenzoylmethane, Ethylhexyl Salicylate, Ethylhexyl Methoxycinnamate, Pentaerythrityl Tetra-Di-T-Butyl Hydroxyhydrocinnamate, Bht, Yellow 5 (Ci 19140), Red 4 (Ci 14700), Ext. Violet 2 (Ci 60730) <ILN49398>.']",295.0,,,0,0,0,0,0,"['Unisex/ Genderless Scent', 'Layerable Scent', 'Woody & Earthy Scent']",Fragrance,Women,Perfume,3,400.0,75.0
P377178,Rapid Collagen Infusion,4164,Murad,10417,4.128,125.0,1 oz,,,,"['Water, Isodecyl Neopentanoate, Polymethylsilsesquioxane, Glycerin, Pentylene Glycol, Neopentyl Glycol Diethylhexanoate, Cetyl Ethylhexanoate, Stearic Acid, Cetearyl Olivate, Dimethicone/Bis-Isobutyl PPG-20 Crosspolymer, Sorbitan Olivate, Butylene Glycol, Honey, Urea, Yeast Amino Acids, Trehalose, Inositol, Taurine, Betaine, Caprylic/Capric Triglyceride, Alaria Esculenta Extract, Palmitoyl Tripeptide-5, Codium Tomentosum Extract, Hydrogenated Olive Oil, Olive Fruit Oil, Olive Oil Unsaponifiables, Sodium Hyaluronate, Collagen Amino Acids, Watermelon Fruit Extract, Apple Fruit Extract, Lentil Fruit Extract,  Tocopheryl Acetate, Sodium PCA, Sodium Lactate, Zinc Gluconate, Ascorbic Acid, Chitosan, Propyl Gallate, Polysorbate 20, Acrylates/C10-30 Alkyl Acrylate Crosspolymer, Aminomethyl Propanol, Trisodium Ethylenediamine Disuccinate, Disodium EDTA, Phenoxyethanol, Caprylyl Glycol, Chlorphenesin, Linalool, Anthemis Nobilis Flower Extract, Anthemis Nobilis Flower Oil, Lavender Oil.']",89.0,,,0,0,0,0,0,,Skincare,Treatments,Face Serums,0,,
P449168,Coco Cabana Body Cream - With New Coconut Scent and Plush Moisture Mini,6145,Sol de Janeiro,26523,3.1165,352.0,2.5 oz/ 75 mL,Size,2.5 oz/ 75 mL,,"['Aqua (Water/Eau), Propanediol (Fermented Sugar/Sucre Fermenté), Dodecane, Caprylic/Capric Triglyceride, Saccharide Isomerate, Citric Acid, Sodium Citrate, Parfum (Fragrance), Hydroxyethyl Acrylate/Sodium Acryloyldimethyl Taurate Copolymer, Cocos Nucifera (Coconut/Noix de Coco) Oil, Theobroma Grandiflorum (Cupuaçu) Seed Butter, Euterpe Oleracea (Açaí/Açaï) Fruit Oil, Zingiber Officinale (Ginger/Gingembre) Root Extract, Glycerin, Sodium Phytate, Bisabolol, Sodium Carboxymethyl Beta-Glucan, Panthenol, Sodium Hyaluronate, Acrylates/C10-30 Alkyl Acrylate Crosspolymer, Phenoxyethanol, Ethylhexylglycerin, Benzyl Benzoate, Sodium Hydroxide.']",22.0,,,0,0,0,1,1,"['Warm &Spicy Scent', 'Best for Dry Skin', 'Without Mineral Oil', 'Without Parabens', 'Cruelty-Free']",Bath & Body,Mini Size,,0,,
P379945,Sumptuous Extreme Lash Multiplying Volume Mascara,6089,Estée Lauder,8747,4.2789,190.0,0.27 oz/ 8 mL,Color,Extreme Black,true black,"['Water, Stearic Acid, Myrica Cerifera (Bayberry) Fruit Wax, Sucrose Polybehenate, Polyisobutene, Polyvinyl Acetate, Paraffin, Aminomethyl Propanediol, Isostearic Acid, Panthenol, Pantethine, Copernicia Cerifera (Carnauba) Wax/ Copernicia Cerifera Cera /Cire De Carnauba, Kaolin, Hydroxyethylcellulose, Cholesterol, Hydrogenated Olive Oil, Ptfe, Vp/Eicosene Copolymer, Olea Europaea (Olive) Fruit Oil, Olea Europaea (Olive) Oil Unsaponifiables, Sodium Polyacrylate, Rosmarinus Officinalis (Rosemary) Leaf Extract, Simethicone, Polyester-5, Pvp, Silica, Caprylyl Glycol, Hexylene Glycol, Nylon-6, Laureth-4, Polyethylene Terephthalate, Nylon-66, Synthetic Fluorphlogopite, Chlorphenesin, Phenoxyethanol,  [+/- Mica, Titanium Dioxide (Ci 77891), Iron Oxides (Ci 77491), Iron Oxides (Ci 77492), Iron Oxides (Ci 77499), Black 2 (Ci 77266), Ferric Ferrocyanide (Ci 77510), Blue 1 Lake (Ci 42090), Ultramarines (Ci 77007), Blue 1 (Ci 42090), Yellow 5 (Ci 19140), Yellow 5 Lake (Ci 19140), Chromium Oxide Greens (Ci 77288), Chromium Hydroxide Green (Ci 77289), Carmine (Ci 75470), Bismuth Oxychloride (Ci 77163)] <ILN43549>.']",30.0,,,0,0,1,0,0,"['Lengthening', 'Volumizing', 'Curling']",Makeup,Eye,Mascara,0,,
P393633,Chubby Stick Sculpting Contour,1254,CLINIQUE,33726,3.7737,243.0,0.21 oz/ 6 g,Color,,,"['Isodecyl Isononanoate, Polyethylene, Propylene Glycol Dicaprylate/Dicaprate, Hdi/Trimethylol Hexyllactone Crosspolymer, Euphorbia Cerifera (Candelilla) Wax/Candelilla Cera/Cire De Candelilla, Bis-Diglyceryl Polyacyladipate-2, Diisopropyl Dimer Dilinoleate, Ozokerite, Squalane, Ceresin, Hydrogenated Polyisobutene, Silica, Caprylyl Glycol, Tocopheryl Acetate, Octyldodecanol, Phytosteryl Isostearate, Lauroyl Lysine, Lecithin, Synthetic Beeswax, Alumina, Lauryl Pca, Ethylene/Propylene/Styrene Copolymer, Oryzanol, Tin Oxide, Disteardimonium Hectorite, Propylene Carbonate, Synthetic Fluorphlogopite, Butylene/Ethylene/Styrene Copolymer,  [+/- Mica, Titanium Dioxide (Ci 77891), Iron Oxides (Ci 77491), Iron Oxides (Ci 77492), Manganese Violet (Ci 77742), Ferric Ferrocyanide (Ci 77510), Iron Oxides (Ci 77499), Yellow 5 Lake (Ci 19140), Chromium Oxide Greens (Ci 77288), Chromium Hydroxide Green (Ci 77289), Ultramarines (Ci 77007), Blue 1 Lake (Ci 42090), Bismuth Oxychloride (Ci 77163), Carmine (Ci 75470)] <ILN41142>.']",29.0,,,0,0,0,0,0,,Makeup,Face,Contour,0,,
P99809,Amazonian Clay Waterproof Bronzer,5648,tarte,34847,4.6236,1145.0,0.32 oz/ 9 g,Color,Park Ave Princess,highly pearled light yellow gold,"['Synthetic Fluorphlogopite, Zinc Stearate, Polymethyl Methacrylate, Corn Starch, Trimethylolpropane Triisostearate, Dimethicone, Triethylhexanoin, Trimethylsiloxysilicate, Avena Sativa (Oat) Kernel Flour, Phenoxyethanol, Vitis Vinifera (Grape) Seed Extract, Tocopheryl Acetate, Ascorbyl Palmitate, Tocopherol, Mica. (+/-): Iron Oxides (CI 77499, CI 77492, CI 77491), Manganese Violet (CI 77742), Titanium Dioxide (CI 77891), Tin Oxide (CI 77861).']",32.0,,,0,0,0,0,0,"['Vegan', 'Natural Finish', 'Long-wearing', 'Waterproof', 'Oil Free', 'Without Parabens']",Makeup,Cheek,Bronzer,0,,
P501029,Retinol Fast-Release Wrinkle Reducing Night Serum,6218,Kiehl's Since 1851,8391,4.5163,614.0,1 oz  / 30 mL,Size,1 oz  / 30 mL,,"['Serum:', 'Aqua / Water, Glycerin, Propanediol, Butylene Glycol, Glycereth-26, Panthenol, 1,2-Hexanediol, Polyglycerin-3, C12-14 Pareth-12, Phenoxyethanol, Caprylyl Glycol, Ammonium Acryloyldimethyltaurate/Vp Copolymer, Betaine, Xanthan Gum, Ethylhexylglycerin, Adenosine, Carbomer, Glyceryl Acrylate/Acrylic Acid Copolymer, Tromethamine, Glycereth-25 Pca Isostearate, T-Butyl Alcohol, Tocopherol.', 'Retinol Powder:', 'Cellulose Acetate Butyrate, Tricaprylin, Retinol, Pentaerythrityl Tetra-Di-T-Butyl Hydroxyhydrocinnamate, Silica Silylate, Silica, Magnesium Stearate.']",85.0,,,0,0,0,0,0,"['Without Mineral Oil', 'Clean at Sephora', 'Good for: Anti-Aging', 'Fragrance Free', 'Without Parabens', 'Without Silicones']",Skincare,Treatments,Face Serums,0,,
