product_id,product_name,brand_id,brand_name,loves_count,rating,reviews,size,variation_type,variation_value,variation_desc,ingredients,price_usd,value_price_usd,sale_price_usd,limited_edition,new,online_only,out_of_stock,sephora_exclusive,highlights,primary_category,secondary_category,tertiary_category,child_count,child_max_price,child_min_price
P410400,U.F.O. Salicylic Acid BHA Acne Treatment Face Oil,6073,Sunday Riley,123202,4.135,2281.0,1.18 oz/ 35 mL,Size,1.18 oz/ 35 mL,,"['Silybum Marianum (Milk Thistle) Seed Oil, Nigella Sativa (Black Cumin) Seed Oil, Cucumis Sativus (Cucumber) Seed Oil,  Diisopropyl Sebacate, Punica Granatum (Pomegranate) Seed Oil, Vaccinium Macrocarpon (Cranberry) Seed Oil, Dimethyl Isosorbide,  Linum Usitatissimum  (Flax) Seed Oil, Caprylic/Capric Triglycerides, Ethyl Linoleate, Hexylresorcinol, Glycyrrhiza Glabra (Licorice) Root Extract, Salicylic Acid, Prunus Armeniaca (Apricot) Kernel Oil, Chamomilla Recutita Flower Oil, Citrus Aurantium Amara (Neroli) Flower Oil, Melaleuca Alternifolia (Tea Tree) Leaf Oil, Helianthus Annuus Seed Oil, Rosmarinus Officinalis (Rosemary) Leaf Extract,  Citrus Paradisii (Grapefruit) Peel Oil, Melia Azadirachta (Neem) Leaf Extract, Melia Azadirachta (Neem) Flower Extract, Coccinia Indica Fruit Extract, Amino Esters-1, Amber Leaf Extract, Solanum Melongena (Eggplant) Fruit Extract, Aloe Barbadensis Flower Extract, Lawsonia Inermis (Henna) Extract, Ocimum Sanctum Leaf Extract, Ocimum Basilicum (Basil) Leaf Extract, Curcuma Longa (Turmeric) Root Extract, Corallina Officinalis Extract, Simmondsia Chinensis (Jojoba) Seed Oil, Pearl Powder, Moringa Pterygosperma Seed Oil.']",80.0,,,0,0,0,0,0,"['Best for Oily, Combo, Normal Skin', 'Good for: Acne/Blemishes', 'Good for: Pores', 'Salicylic Acid', 'Cruelty-Free', 'Community Favorite']",Skincare,Moisturizers,Face Oils,1,40.0,40.0
P440505,Goddess Cleansing Ritual Duo,6236,Charlotte Tilbury,7741,4.4545,22.0,,,,,"['Citrus Oil Radiance Cleanse:', 'Caprylic/Capric Triglyceride, Coconut Alkanes, Glycerin, C13-15 Alkane, Water, Coco-Caprylate/Caprate, Sucrose Laurate, Citrullus Lanatus (Watermelon) Seed Oil, Plukenetia Volubilis Seed Oil, Ascorbyl Tetraisopalmitate, Fragrance, Platonia Insignis Seed Butter, Sucrose Stearate, Citrus Aurantium Bergamia (Bergamot) Peel Oil, Helianthus Annuus (Sunflower) Seed Oil, Tocopherol, Citrus Limon (Lemon) Peel Oil, Sucrose Palmitate, Beta-Carotene, Daucus Carota Sativa (Carrot) Root Extract, Daucus Carota Sativa (Carrot) Seed Oil, Ascorbyl Palmitate, Citronellol, Geraniol, Limonene, Linalool.', 'Purifying Charcoal Cleanse:', 'Water, Glycerin, Sodium Cocoyl Glycinate, Cocamidopropyl Betaine, Galactoarabinan, Decyl Glucoside, Citric Acid, Charcoal Powder, Niacinamide, Peat, Sodium Chloride, Sodium Citrate, Xanthan Gum, Fragrance, Sodium Benzoate, Potassium Sorbate, Citrus Aurantium Bergamia (Bergamot) Peel Oil, Citrus Limon (Lemon) Peel Oil, Phenoxyethanol, Citronellol, Geraniol, Limonene, Linalool.']",46.0,,,0,0,0,0,0,,Skincare,Value & Gift Sets,,0,,
P500718,Smart Clinical Repair Wrinkle Correcting Cream,1254,CLINIQUE,1237,4.178,1899.0,1.7 oz / 50 mL,Size,1.7 oz / 50 mL,,"['Water/Aqua/Eau, Glycerin, Isostearyl Neopentanoate, Butylene Glycol, Glyceryl Stearate, PEG-100 Stearate, Dimethicone, Cetearyl Alcohol, Acetyl Hexapeptide-8, Acetyl Octapeptide-3, Aminopropyl Ascorbyl Phosphate, Palmitoyl Tetrapeptide-7, Algae Extract, Sodium Hyaluronate, Palmitoyl Hexapeptide-12, Sigesbeckia Orientalis (St. Paul Wort) Extract, Whey Protein/Lactis Protein/Protéine Du Petit-Lait, Dipeptide Diaminobutyroyl Benzylamide Diacetate, Acetyl Glucosamine, Caffeine, Palmitoyl Tripeptide-1, Glycine Soja (Soybean) Seed Extract, Cetearyl Glucoside, Tocopheryl Acetate, Isohexadecane, Petrolatum, Caprylyl Glycol, Glycereth-26, Acrylates/C10-30 Alkyl Acrylate Crosspolymer, Tromethamine, Glyceryl Polymethacrylate, PEG-8, Polysorbate 20, Hexylene Glycol, Polysorbate 80, Carbomer, Acrylamide/Sodium Acryloyldimethyltaurate Copolymer, Sorbitan Oleate, Cetyl Alcohol, Sodium Citrate, Disodium EDTA, Phenoxyethanol, Potassium Sorbate, Sodium Benzoate.']",68.0,,,0,0,0,0,0,"['Hyaluronic Acid', 'Hydrating', 'Good for: Anti-Aging', 'Fragrance Free', 'Oil Free', 'Without Parabens']",Skincare,Moisturizers,Moisturizers,1,22.0,22.0
P4039,Perfecting Day Cream Broad Spectrum SPF 30 PA+++,4164,Murad,7792,4.1724,174.0,1.7 oz,,,,"['Water, Butylene Glycol, Pentylene Glycol, Glyceryl Stearate, PEG-100 Stearate, Diisopropyl Sebacate, Isodecyl Neopentanoate, Lauryl Lactate, Stearic Acid, Sorbitan Stearate, Urea, Yeast Amino Acids,Trehalose, Inositol, Taurine, Betaine, Phospholipids, Retinyl Palmitate, Tocopheryl Acetate, Ascorbyl Palmitate, Cetearyl Alcohol, Ceteareth-20, Citrus Medica Limonum (Lemon) Peel Extract, Calendula Officinalis Flower Extract, Glycolipids, Sodium Hyaluronate, Lecithin, Tocopherol, Hydrogen Peroxide, Dipotassium Glycyrrhizate, Punica Granatum Extract, Magnesium Ascorbyl Phosphate, Hydrolyzed Soy Flour, Avena Sativa (Oat) Kernel Protein, Palmitoyl Hydroxypropyltrimonium Amylopectin/Glycerin Crosspolymer, Vitis Vinifera (Grape) Seed Extract, Camellia Sinensis Leaf Extract, Oenothera Biennis (Evening Primrose) Oil, Borago Officinalis Seed Oil, Sodium PCA, Dimethicone, Propylene Glycol, Carbomer, Sclerotium Gum, Aminomethyl Propanol, Chlorphenesin, Phenoxyethanol, Methylparaben, Propylparaben, Disodium EDTA, Linalool, Lavandula Angustifolia (Lavender) Oil.']",65.0,,,0,0,0,0,0,,Skincare,Moisturizers,Moisturizers,0,,
P476737,Bio-Barrier Eye Crème,7020,Tata Harper,484,,,0.5 oz / 15 mL,Size,0.5 oz / 15 mL,,"['Calendula Officinalis Flower/Leaf/Stem Juice*, Caprylic/Capric Triglyceride, Cetearyl Olivate, Aqua/Water/Eau, Propanediol, Diglycerin, Glycerin, Butylene Glycol, Punica Granatum Sterols, Shea Butter Ethyl Esters, Butyrospermum Parkii (Shea) Butter*, Sorbitan Olivate, Helianthus Annuus (Sunflower) Seed Oil, Squalane, Sodium Hyaluronate, Ceramide NP, Ophiopogon Japonicus Root Extract, Bacillus Ferment, Glyceryl Glucoside, Rhododendron Ferrugineum Extract, Laminaria Digitata Extract, Pyrus Malus (Apple) Seed Oil, Ricinus Communis (Castor) Seed Oil, Cucumis Sativus (Cucumber) Seed Oil, Oenothera Biennis (Evening Primrose) Oil*, Vitis Vinifera (Grape) Seed Oil*, Simmondsia Chinensis (Jojoba) Seed Oil, Avena Sativa (Oat) Kernel Oil, Algae Extract, Borago Officinalis (Borage) Leaf Extract*, Calendula Officinalis (Calendula) Flower Extract*, Centella Asiatica Extract, Chamomilla Recutita (Matricaria) Flower Extract*, Chlorella Vulgaris Extract, Lavandula Angustifolia (Lavender) Extract*, Medicago Sativa (Alfalfa) Extract*, Piper Cubeba Fruit Extract, Polygonum Fagopyrum Seed Extract, Salvia Miltiorrhiza Root Extract, Magnolia Officinalis Bark Extract, Stevioside, Hydrolyzed Algin, Phytic Acid, Sclerotium Gum, Sea Water, Sucrose, Caprylyl Glycol, Cetyl Palmitate, Sorbitan Palmitate, Hydrogenated Vegetable Oil, Sodium Hydroxide, Maltodextrin, Glyceryl Caprylate.']",130.0,,,0,1,1,0,0,"['Good for: Loss of firmness', 'Clean + Planet Positive', 'Good for: Dark Circles', 'Good for: Anti-Aging', 'Fragrance Free', 'Hypoallergenic']",Skincare,Eye Care,Eye Creams & Treatments,0,,
P458220,Gentleman Boisee Eau de Parfum,1133,Givenchy,3065,4.6369,504.0,3.4 oz/ 100 mL,Size + Concentration + Formulation,3.4 oz/ 100 mL Eau de Parfum Spray,,"['Alcohol, Parfum (Fragrance), Aqua (Water), Ethylhexyl Methoxycinnamate, Limonene, Linalool, Coumarin, Butyl Methoxydibenzoylmethane, Butylene Glycol Dicaprylate/Dicaprate, Alpha-Isomethyl Ionone, Citronellol, Citral, Farnesol, Geraniol, Cinnamal, Bht, Ci 60730 (Ext. Violet 2).']",124.0,,,0,0,0,0,0,"['Warm &Spicy Scent', 'Woody & Earthy Scent']",Fragrance,Men,Cologne,1,101.0,101.0
P397517,Born This Way Natural Finish Longwear Liquid Foundation,4225,Too Faced,465412,4.0437,14882.0,1 oz/ 30 mL,Color,Brulee,rich tan with golden undertones,"['Water, Cyclopentasiloxane, Glycerin, Aluminum Starch Octenylsuccinate, Isododecane, Polyglyceryl-4 Isostearate, Cetyl PEG/PPG-10/1 Dimethicone, Hexyl Laurate, Dimethicone, Ethylhexyl Methoxycinnamate, Magnesium Sulfate, Diphenyl Dimethicone, Tribehenin, Triethoxycaprylylsilane, Disteardimonium Hectorite, Polysilicone-11, Propylene Carbonate, Tetrahexyldecyl Ascorbate, Cocos Nucifera Water, Ethylhexyl Palmitate, Rhododendron Ferrugineum Extract, Alcohol, Silica Dimethyl Silylate, Lecithin, Pistacia Lentiscus (Mastic) Gum, Butylene Glycol, Potassium Sorbate, Sodium Hyaluronate, EDTA, Caprylyl Glycol, Phenoxyethanol. May Contain (+/-): Titanium Dioxide (CI 77891), Iron Oxides (CI 77491, CI 77492, CI 77499).']",45.0,,,0,0,0,0,0,"['Vegan', 'Natural Finish', 'Community Favorite', 'Hydrating', 'Long-wearing', 'Medium Coverage']",Makeup,Face,Foundation,34,45.0,45.0
P472051,Invictus Victory,1071,Paco Rabanne,4060,4.9231,13.0,3.4 oz/ 100 mL,Size + Concentration + Formulation,3.4 oz/ 100 mL Eau De Parfum Spray,,"['Alcohol Denat., Parfum (Fragrance), Aqua (Water), Limonene, Linalool, Butyl Methoxydibenzoylmethane, Coumarin, Citronellol, Citral, Geraniol, Isoeugenol.']",120.0,,,0,0,0,0,0,,Fragrance,Men,Cologne,1,94.0,94.0
P445425,"SinglePass Curl 1"" Professional Curling Iron",5780,T3,12455,4.5185,27.0,1 inch,Color,,,,169.99,,,0,0,1,0,0,"['Good for: Volume', 'All Hair Types', 'Curl-Enhancing', 'Good for: Frizz', 'Coily Hair', 'Curly Hair']",Hair,Tools,Curling Irons,0,,
P480609,Vanish Airbrush Primer,5879,Hourglass,40639,4.6392,291.0,1 oz/ 30 mL,Size,1 oz/ 30 mL,,"['Dimethicone, Water/Aqua, Dimethicone/Vinyl Dimethicone Crosspolymer, Vinyl Dimethicone/Methicone Silsesquioxane Crosspolymer, Trimethylsiloxysilicate, Silica, Glycerin, Cetyl PEG/PPG-10/1 Dimethicone, Isododecane, Phenoxyethanol, Sodium Chloride, Dimethicone/PEG-10/15 Crosspolymer, Magnesium Sulfate, Sodium Benzoate, Disteardimonium Hectorite, C24-28 Alkyl Methicone, Propylene Carbonate, Dipropylene Glycol, Sodium Citrate, Tocopherol.']",58.0,,,0,0,0,0,0,"['Best for Dry, Combo, Normal Skin', 'Good for: Pores', 'Natural Finish']",Makeup,Face,Face Primer,0,,
P435107,Angie Perfume,8007,By Rosie Jane,1877,4.4808,52.0,0.25 oz/ 7.5 mL,Size + Concentration + Formulation,0.25 oz/ 7.5 mL,,"['Organic Cane Sugar Alcohol And Distilled Water, Jasminum Officinal (Jasmine) Flower Extract, Methyl Benzoate, Hyacinth Body, Cis-3-Hexenyl Acetate, Indole Pure, Ethyl Benzoate, Cedrol Methyl Ether, Benzyl Acetate,3-Hexenol, 3 Hexenyl Isobutyrate, Terpineol Alpha, Methyl Anthranilate, Geranyl Acetate Extra, Cyclamen Aldehyde, 3 Hexenyl Benzoate,3 Hexenyl Salicylate, Methyl Iso ,Eugenol, Linalyl Acetate, Gamma Octalactone, Phenethyl Alcohol, Iso E Super, Helional, 2-Methyl-3(1,7,7-Trimethylbicyclohept-2-Yloxy)-Propanol, Methyl Dihydrojasmonate, Isopropyl Myristate, Ethylene Brassylate.']",28.0,,,0,0,0,0,0,"['Vegan', 'Floral Scent', 'Clean + Planet Positive']",Fragrance,Women,Perfume,1,70.0,70.0
P444303,Mini Superhero Elastic Stretch Volumizing Mascara,6175,IT Cosmetics,6459,3.2209,86.0,0.17 oz/ 5 g,Color,Super Black,,"['Aqua/Water/Eau, Copernicia Cerifera Cera/Carnauba Wax/Cire De Carnauba, Cyclopentasiloxane, Oryza Sativa Cera/Rice Bran Wax, Hydrogenated Olive Oil Stearyl Esters, Alcohol Denat., Stearic Acid, Palmitic Acid, Triethanolamine, Acacia Senegal Gum, Euphorbia Cerifera Cera/Candelilla Wax, Propylene Glycol, Phenoxyethanol, Vp/Va Copolymer, Aminomethyl Propanediol, Isopropyl Alcohol, Polyvinyl Alcohol, Chlorphenesin, Ethylhexylglycerin, Tocopheryl Acetate, Biotin, Glycerin, T-Butyl Alcohol, Butylene Glycol, Hydrolyzed Collagen, Carbomer, Sodium Lactate, Polysorbate 20, Palmitoyl Tripeptide-1, Palmitoyl Tetrapeptide-7, [+/-: Ci 77499/Iron Oxides].']",15.0,,,0,0,0,0,0,"['Volumizing', 'Collagen', 'Without Phthalates', 'Lengthening', 'Without Parabens', 'Without Sulfates SLS & SLES']",Mini Size,Makeup,,0,,
P384778,Black Tea Firming and De-Puffing Eye Cream,4348,fresh,58657,3.8768,609.0,0.5 oz/ 15 mL,Size,0.5 oz/ 15 mL,,"['Water, Glycerin, Butylene Glycol, Squalane, Propylene Glycol Dicaprylate/Dicaprate, Caprylic/Capric Triglyceride, Methyl Methacrylate Crosspolymer, Pentylene Glycol, Steareth-21, Cetyl Alcohol, Stearyl Alcohol, C10-18 Triglycerides, Limnanthes Alba (Meadowfoam) Seed Oil, Saccharomyces Ferment Filtrate, Camellia Sinensis Leaf Extract, Avena Sativa (Oat) Kernel Extract, Morinda Citrifolia Fruit Juice, Saccharomyces Cerevisiae Extract, Litchi Chinensis Seed Extract, Rubus Fruticosus (Blackberry) Leaf Extract, Tocopheryl Acetate, Ascorbyl Tetraisopalmitate, Tocopherol, Biotin, Glyceryl Hydroxystearate, Steareth-2, Stearalkonium Hectorite, Sodium Polyacrylate, Fragrance, Dimethicone, Silica, Propylene Carbonate, Acrylates/C10-30 Alkyl Acrylate Crosspolymer, Sodium Hyaluronate, Maltodextrin, Tromethamine, Adenosine, CI 77891 (Titanium Dioxide), Biosaccharide Gum-2, Caramel, Hydroxyethylcellulose, Algin, BHT, Sodium Citrate, Tin Oxide, Acacia Senegal Gum, Citric Acid, Ethylhexylglycerin, Potassium Sorbate, Serine, Phenoxyethanol, Linalool.']",68.0,,,0,0,0,0,0,"['Clean at Sephora', 'Best for Dry, Combo, Normal Skin', 'Good for: Dark Circles', 'Hyaluronic Acid', 'Without Parabens', 'Without Sulfates SLS & SLES']",Skincare,Eye Care,Eye Creams & Treatments,0,,
P504184,Strand Defender Lightweight Strengthening Conditioner for Thinning Hair,6757,Nutrafol,1893,4.6791,187.0,8.1 oz / 240 mL,Size,8.1 oz / 240 mL,,"['Aqua (Water, Eau), Cetearyl Alcohol, Glycerin, Brassicamidopropyl Dimethylamine, Behentrimonium Chloride, Isopropyl Myristate, Orbignya Speciosa Kernel Oil, Aspergillus Ferment, Hydrolyzed Wheat Protein, Hippophae Rhamnoides Fruit Extract, Arginine, Ximenia Americana Seed Oil, Hydrogenated Soybean Oil, Oryza Sativa (Rice) Bran Extract, Cocos Nucifera (Coconut) Oil, Linum Usitatissimum (Linseed) Seed Oil, Helianthus Annuus (Sunflower) Extract, Rosmarinus Officinalis (Rosemary) Extract, Tocopherol, Lactic Acid, Tartaric Acid, Guar Hydroxypropyltrimonium Chloride, Hydroxypropylammonium Gluconate, Polyquaternium-73, Hydroxypropylgluconamide, Isopropyl Alcohol, Sodium Hydroxide, Tetrasodium Glutamate Diacetate, Sodium Benzoate, Potassium Sorbate, Benzyl Alcohol, Parfum (Fragrance), Citral, Geraniol, Limonene, Linalool.']",44.0,,,0,1,0,0,0,"['Vegan', 'Recyclable Packaging', 'Clean at Sephora', 'Good for: Hair Thinning', 'All Hair Types', 'Without Sulfates SLS & SLES']",Hair,Shampoo & Conditioner,Conditioner,0,,
P393317,10X Ultralight Speed Dryer,7086,Bio Ionic,7413,4.3143,140.0,,,,,,299.0,,,0,0,0,0,0,"['All Hair Types', 'Increases Shine', 'Good for: Frizz', 'Straight Hair', 'High Shine Finish']",Hair,Tools,Hair Dryers,0,,
P455560,Millennial Pinx Eyeshadow Palette,6287,Melt Cosmetics,13403,3.3956,91.0,,,,,"['Mica, Zinc Stearate, Silica, Dimethicone, Ethylhexyl Palmitate, Lauroyl Lysine, Zea Mays Starch, Alumina, Calcium Aluminium Borosilicate, Calcium Titanium Borosilicate, Phenoxyethanol, Calcium Sodium Borosilicate, Acrylates Copolymer, Triethoxycaprylysilane, Polyethylene, Hydrogenated Lecithin, Tin Oxide, Dimethicone Crosspolymer. May Contain: Titanium Dioxide Ci 77891, Iron Oxide Ci 77499, Iron Oxide Ci 77491, Iron Oxide Ci 77492, Red 40 Lake Ci 16035, Manganeses Violet Ci 77742, Blue 1 Lake Ci 42090, Ultramarines Ci 77007, Yellow 5 Lake Ci 19140, Carmine Ci 75470, Ferric Ferrocyanide Ci 77510.']",58.0,,40.0,0,0,0,0,1,,Makeup,Eye,Eye Palettes,0,,
P424989,THE BODY Illuminating Self-Tan Drops,6225,TAN-LUXE,22970,4.1959,194.0,1.69 oz/ 50 mL,Color,Light/Medium,,"['Water, Dihydroxyacetone, Alcohol Denat, (SD Alcohol 40-B), Glycerin, Rubus Idaeus (Raspberry) Seed Oil, Hydrolyzed Silk, Aloe Barbadensis (Aloe) Leaf Juice, Polysorbate 80, Erythrulose, Caramel, Xanthan Gum, Fragrance, Limonene, Geraniol, Hexyl Cinnamal, Benzyl Salicylate, Butylphenyl Methylpropional, Lecithin, Caffeine, Tocopheryl Acetate (Vitmain E Acetate), Palmitoyl Carnitine, Sodium Hydroxide, Benzoic Acid, Phenoxyethanol, Dehydroacetic Acid.']",60.0,,,0,0,0,0,0,"['Good for: Dullness/Uneven Texture', 'Good for: Loss of firmness', 'Hydrating', 'Customizable', 'Without Parabens', 'Cruelty-Free']",Skincare,Self Tanners,For Body,1,60.0,60.0
P483058,GOOPGLOW Flower Acids Resurfacing Toner,6309,goop,1797,4.6667,6.0,4 oz/ 120 mL,Size,4 oz/ 120 mL,,"['Aqua/Water/Eau, Glycerin, Propanediol, Citric Acid, Sodium Citrate, Aloe Barbadensis Leaf Juice, Hibiscus Sabdariffa Flower Extract, Hydrolyzed Opuntia Ficus-Indica Flower Extract, Sodium Hyaluronate, Tamarindus Indica Seed Polysaccharide, Hydrolyzed Gardenia Florida Extract, Gluconolactone, Calcium Gluconate, Maltodextrin, Caprylyl Glycol, 1,2-Hexanediol, Sodium Hydroxide, Sodium Benzoate, Potassium Sorbate, Sodium Gluconate.']",45.0,,,0,0,0,0,0,"['Vegan', 'Good for: Dullness/Uneven Texture', 'Hyaluronic Acid', 'Clean at Sephora', 'Best for Dry, Combo, Normal Skin', 'Gluten Free']",Skincare,Cleansers,Toners,0,,
P478021,Sleepover Retin-Oil Nighttime Treatment,8012,Naturally Serious,3771,4.7656,64.0,1 oz/ 30 mL,Size,1 oz/ 30 mL,,"['Helianthus Annuus (Sunflower) Seed Oil, Oryza Sativa (Rice) Bran Extract, Glycine Soja (Soybean) Oil, Caprylic/Capric Triglyceride, Rosa Canina Fruit Oil, Oenothera Biennis (Evening Primrose) Oil, Retinol, Salvia Hispanica Seed Oil, Perilla Ocymoides Seed Oil, Lupinus Albus Seed Extract, Arnica Montana Flower Extract, Glycerin, Coleus Barbatus Root Extract, Tocopherol, Leontopodium Alpinum Extract, Peucedanum Ostruthium Leaf Extract, Lycium Barbarum Fruit Extract, Punica Granatum Extract, Vitis Vinifera (Grape) Seed Extract, Aspalathus Linearis Leaf Extract, Water/Aqua/Eau, Leuconostoc/Radish Root Ferment Filtrate, Rosmarinus Officinalis (Rosemary) Leaf Extract, Pinus Cembra Wood Extract, Camellia Sinensis Leaf Extract, Daucus Carota Sativa (Carrot) Root Extract, Beta-Carotene, Polyglyceryl-10 Heptahydroxystearate, Phospholipids, Maltodextrin, Fragrance/Parfum.']",39.0,,,0,0,1,0,1,"['Good for: Anti-Aging', 'Good for: Dullness/Uneven Texture', 'Retinol', 'Vegan', 'Without Silicones', 'Good for: Dryness']",Skincare,Treatments,Face Serums,0,,
P429630,Good Girl Gone Bad by KILIAN Mini Spray Set,6240,KILIAN Paris,8587,4.6429,14.0,4 x 0.25 oz/ 7.5 mL,Size + Concentration + Formulation,4 x 0.25 oz/ 7.5 mL,,"['Alcohol Denat., Fragrance, Water, Citronellol, Linalool, Geraniol, Farnesol, Benzyl Benzoate, Limonene, Eugenol, Benzyl Alcohol/ Benzyl Salicylate, Isoeugenol, Citral, Hydroxycitronellal, Bht, Benzoic Acid.']",215.0,,,0,0,1,0,0,"['Unisex/ Genderless Scent', 'Floral Scent']",Fragrance,Women,Rollerballs & Travel Size,0,,
P472039,Curl Manifesto Sulfate-Free Shampoo for Curly Hair,6259,Kérastase,10091,4.452,250.0,8.5 oz/ 250 mL,Size,8.5 oz/ 250 mL,,"['Aqua/Water/Eau, Sodium C14-16 Olefin Sulfonate, Glycerin, Cocamide Mea, Cocamidopropyl Betaine, Glycol Distearate, Sodium Chloride, Sodium Lauroyl Sarcosinate, Hexylene Glycol, Citric Acid, Sodium Hydroxide, Sodium Benzoate, Coco, Betaine, Hydroxypropyl Guar Hydroxypropyltrimonium Chloride, Salicylic Acid, Carbomer, Benzyl Salicylate, Benzoic Acid, Linalool, Polyquaternium-7, Benzyl Alcohol, Mel Extract/Honey Extract, 2-Oleamido-1, 3-Octadecanediol, Parfum/Fragrance.']",40.0,,,0,0,0,0,1,"['Hydrating', 'Curl-Enhancing', 'Coily Hair', 'Good for: Dryness', 'Curly Hair', 'Without Sulfates SLS & SLES']",Hair,Shampoo & Conditioner,Shampoo,0,,
P504035,Mini BeamCream Smoothing Body Moisturizer with AHAs,5674,OLEHENRIKSEN,1034,4.0,1.0,1.7 oz / 50 mL,Size,1.7 oz / 50 mL,,"['Aqua/Water/Eau, Caprylic/Capric Triglyceride, Crambe Abyssinica Seed Oil, Cetyl Ethylhexanoate, Lactic Acid, Cetearyl Alcohol, Methylpropanediol, Propanediol, Steareth-21, Butyrospermum Parkii (Shea) Butter, Mangifera Indica (Mango) Seed Butter, Dimethicone, Potassium Hydroxide, Glycolic Acid, Sambucus Nigra Seed Oil, Vaccinium Vitis-Idaea Seed Oil, Caffeine, Carnitine, Polyglutamic Acid, Octadecenedioic Acid, Citrus Grandis (Grapefruit) Fruit Extract, Citrus Paradisi (Grapefruit) Fruit Extract, Citrus Sinensis (Orange) Fruit Extract, Citrus Limon (Lemon) Fruit Extract, Helianthus Annuus (Sunflower) Seed Oil, Glycerin, Tocopherol, Cetearyl Olivate, Sorbitan Olivate, Caprylyl Glycol, Polysorbate 60, Acrylates/C10-30 Alkyl Acrylate Crosspolymer, Potassium Cetyl Phosphate, Leuconostoc/Radish Root Ferment Filtrate, Hydroxyethyl Acrylate/Sodium Acryloyldimethyl Taurate Copolymer, Citrus Paradisi (Grapefruit) Peel Oil, Citrus Aurantium Dulcis (Orange) Peel Oil, Citrus Nobilis (Mandarin Orange) Peel Oil, Citrus Limon (Lemon) Peel Oil, Cymbopogon Citratus Leaf/Stem Oil, Pentaerythrityl Tetra-Di-T-Butyl Hydroxyhydrocinnamate, Ethylhexylglycerin, Glycine Soja (Soybean) Oil, Hydroxyacetophenone, Tromethamine, Limonene, Citral.']",20.0,,,0,1,1,0,1,"['Vegan', 'Good for: Dullness/Uneven Texture', 'Clean at Sephora', 'Good for: Anti-Aging', 'Good for: Dryness', 'Good for: Dark spots']",Bath & Body,Body Moisturizers,Body Lotions & Body Oils,0,,
P482718,Phloria Eau de Parfum,6252,PHLUR,2927,3.8857,35.0,1.7 oz/ 50 mL,Size + Concentration + Formulation,1.7 oz/ 50 mL,,"['Sugarcane Alcohol Denat., Fragrance/Parfum*, Water/Eau/Aqua.']",96.0,,,0,0,0,0,1,"['Floral Scent', 'Clean at Sephora', 'Cruelty-Free']",Fragrance,Women,Perfume,1,26.0,26.0
P440503,Lip Balm,8017,Mario Badescu,32609,4.2515,167.0,0.35 oz/ 10 g,Scent,Original,,"['Hydrogenated Polydecene, Cocoglycerides, Dimethicone, Brassica Glycerides, Persea Gratissima (Avocado) Oil, Glyceryl Behenate, Microcrystalline Cellulose, Polyhydroxystearic Acid, Ethylene/Propylene/Styrene Copolymer, Jojoba Esters, Helianthus Annuus (Sunflower) Seed Wax, Theobroma Cacao (Cocoa) Seed Butter, Prunus Amygdalus Dulcis (Sweet Almond) Oil, Silica Silylate, Silica, Cera Alba (Beeswax, Cire d’abeille), Chamomilla Recutita (Matricaria) Flower Extract, Raspberry Seed Oil /Tocopheryl Succinate Aminopropanediol Esters, Dimethicone Crosspolymer, Dimethicone/Vinyl Dimethicone Crosspolymer, Aloe Barbadensis Leaf Extract, Hydrogenated Olive Oil, Glyceryl Rosinate, Ricinus Communis Seed Oil, Hydrogenated Vegetable Oil, Acacia Decurrens Flower Cera, Tocopherol, Butylene/Ethylene/Styrene Copolymer, Euphorbia Cerifera Cera (Candelilla Wax), Polysorbate 80, Polyglycerin-3, Linoleic Acid, Hydrolyzed Corn Starch, Sucralose, Flavor, Tetrahexyldecyl Ascorbate, Linolenic Acid, Pentaerythrityl Tetra-di-t-butyl Hydroxyhydrocinnamate.']",8.0,,,0,0,0,0,0,,Skincare,Lip Balms & Treatments,,2,8.0,4.5
P504524,Milky Jelly Gentle Gel Face Cleanser,6751,Glossier,10558,4.0877,57.0,6 oz / 177 mL,Size,6 oz / 177 mL,,"['Water/Aqua/Eau, Rosa Damascena Flower Water, Glycerin, Propanediol, Isohexadecane, Acrylamide/Sodium Acryloyldimethyltaurate Copolymer, Sodium Hyaluronate, Panthenol, Allantoin, Symphytum Officinale Root Extract, Xylitylglucoside, Betaine, Anhydroxylitol, Xylitol, Ammonium Polyacryloyldimethyl Taurate, Ethylhexylglycerin, Polysorbate 80, Sorbitan Oleate, Benzoic Acid, Citric Acid, Sodium Hydroxide, Potassium Sorbate, Sodium Benzoate, Geraniol, Citronellol.']",19.0,,,0,1,0,0,1,"['Vegan', 'Hydrating', 'Clean at Sephora', 'Best for Dry, Combo, Normal Skin', 'Without Sulfates SLS & SLES', 'Cruelty-Free']",Skincare,Cleansers,Face Wash & Cleansers,0,,
P489310288,Pastel Obsessions Eyeshadow Palette,6106,HUDA BEAUTY,78520,3.4247,259.0,,Color,Lilac Obsessions,,"['Grape Matte (1), Violet Matte (9):', 'Mica, Zea Mays (Corn) Starch, Silica, Dimethicone, Magnesium Myristate, Trimethylsiloxysilicate, Phenoxyethanol, Triethoxycaprylylsilane, Caprylyl Glycol, Tocopheryl Acetate, Ethylhexylglycerin. [+/-Iron Oxides (Ci 77491), Iron Oxides (Ci 77492), Titanium Dioxide (Ci 77891), Carmine (Ci 75470), Red 40 Lake (Ci 16035), Ultramarines (Ci 77007), Manganese Violet (Ci 77742)].', 'Violet Shimmer (2), Lavender Shimmer (3), Coral Shimmer (4):', 'Calcium Sodium Borosilicate, Synthetic Fluorphlogopite, Dimethicone, Magnesium Myristate, Trimethylsiloxysilicate, Dimethicone/Vinyl Dimethicone Crosspolymer, Magnesium Stearate, Silica, Tin Oxide, Phenoxyethanol, Caprylyl Glycol, Tocopheryl Acetate, Ethylhexylglycerin [+/-Titanium Dioxide (Ci 77891), Carmine (Ci 75470), Iron Oxides (Ci 77491)].', 'Peach Violet Swirl (6):', 'Synthetic Fluorphlogopite, Calcium Sodium Borosilicate, Dimethicone, Magnesium Myristate, Trimethylsiloxysilicate, Dimethicone/Vinyl Dimethicone Crosspolymer, Magnesium Stearate, Silica, Phenoxyethanol, Tin Oxide, Caprylyl Glycol, Tocopheryl Acetate, Ethylhexylglycerin, Titanium Dioxide (Ci 77891), Carmine (Ci 75470).', 'Lavender Matte (7):', 'Mica, Zea Mays (Corn) Starch, Silica, Dimethicone, Magnesium Myristate, Trimethylsiloxysilicate, Tocopheryl Acetate, Caprylyl Glycol, Ethylhexylglycerin, Phenoxyethanol, Titanium Dioxide (Ci 77891), Carmine (Ci 75470), Ultramarines (Ci 77007).', 'Dusty rose matte (5), Peach Matte (8):', 'Mica, Zea Mays (Corn) Starch, Silica, Dimethicone, Magnesium Myristate, Trimethylsiloxysilicate, Phenoxyethanol, Triethoxycaprylylsilane, Caprylyl Glycol, Tocopheryl Acetate, Ethylhex.']",32.0,,,1,0,0,0,1,"['Matte Finish', 'Shimmer Finish', 'Metallic Finish']",Makeup,Eye,Eye Palettes,2,32.0,32.0
P483153,Wonderland Bloom Scent Diffuser,6300,Floral Street,402,3.0,1.0,3.4 oz/ 100 mL,Size + Concentration + Formulation,3.4 oz/ 100 mL  diffuser,,"['Beta-Pinene, Hexyl Salicylate, 4-Methoxy-Alpha-Methylbenzenepropanal, Coumarin.']",56.0,,,0,0,1,0,0,"['Vegan', 'Cruelty-Free', 'Sustainable Packaging', 'Without Parabens', 'Without Phthalates', 'Floral Scent']",Fragrance,Candles & Home Scents,Diffusers,0,,
