product_id,product_name,brand_id,brand_name,loves_count,rating,reviews,size,variation_type,variation_value,variation_desc,ingredients,price_usd,value_price_usd,sale_price_usd,limited_edition,new,online_only,out_of_stock,sephora_exclusive,highlights,primary_category,secondary_category,tertiary_category,child_count,child_max_price,child_min_price
P435109,Goji & Tarocco Orange Glass Jar Candle,6245,VOLUSPA,8096,4.5403,124.0,5.5 oz/ 156 g,Size + Concentration + Formulation,5.5 oz/ 156 g  1-wick Candle,,"['Coconut Oil 84836-98-6, Benzyl Alcohol 100-51-6, Limonene 5989-27-5, 2,4,6-Trimethyl-4-Phenyl-1,3- Dioxane 5182-36-5, Linalool 78-70-6, Terpineol Acetate 8007-35-0, Gamma Undecalactone 104-67-6, Ethylmethylphenylglycidate 77-83-8, Decanal 112-31-2, Citronellol 106-22-9, Geranyl Acetate 105-87-3, 2,6, Dimethyl-7-Octen-2-Ol 18479-58-8, Citral 5392-40-5, Octanal 124-13-0, 2,4-Dimethyl-3-Cyclohexene Carboxaldehyde 68039-49-6, 2-T-Butylcyclohexyl Acetate 88-41-5, Tetramethylacetyloctahydronaphthalenes 54464-57-2, 2-Ethyl-3-Hydroxy-4- Pyrone 1110651, Alpha-Terpineol 98-55-5, 3a,4,5,6,7,7a-Hexahydro-4,7- Methano-1(3)- Inden-6-Yl- Acetate 5413-60-5, Hexamethylindanopyran 1222-05-5, Hexyl Cinnamal 101-86-0, Dimethyl Phenethyl Butyrate 10094-34-5, Hexyl Acetate 142-92-7, Benzyl Acetate 140-11-4, Beta-Ionone 14901-07-6.']",20.0,,,0,0,0,0,0,['Fresh Scent'],Fragrance,Candles & Home Scents,Candles,2,78.0,32.0
P461607,"Mini Hydrate Sheer Shampoo for Fine, Dry, Color-Treated Hair",6330,Pureology,4786,4.4629,404.0,2 fl oz/ 50 mL,Size,2 fl oz/ 50 mL,,"['Aqua / Water / Eau, Sodium Cocoyl Isethionate, Disodium Laureth Sulfosuccinate, Sodium Lauryl Sulfoacetate, Cocamidopropyl Betaine, Sodium Lauroyl Sarcosinate, Glycol Distearate, Glycereth-26, Decyl Glucoside, Coconut Acid, Sodium Hydroxide, Ppg-5-Ceteth-20, Sodium Isethionate, Parfum / Fragrance, Sodium Chloride, Citric Acid, Coco-Betaine, Polyquaternium-7, Peg-55 Propylene Glycol Oleate, Propylene Glycol, Polyquaternium-10, Linalool, Carbomer, Benzoic Acid, Glycerin, Butylene Glycol, Limonene, Geraniol, Tocopherol, Salicylic Acid, Hydroxypropyltrimonium Hydrolyzed Wheat Protein, Helianthus Annuus Seed Extract / Sunflower Seed Extract, Benzyl Alcohol, Magnesium Nitrate, Sodium Benzoate, Benzophenone-4, Eucalyptus Globulus Leaf Extract, Methylchloroisothiazolinone, Phenoxyethanol, Magnesium Chloride, Methylisothiazolinone.']",11.0,,,0,0,1,0,0,"['Vegan', 'Good for: Color Care', 'All Hair Types', 'Good for: Dryness', 'Without Parabens', 'Without Sulfates SLS & SLES']",Hair,Shampoo & Conditioner,Shampoo,0,,
P458219,Watermelon Glow PHA + BHA Pore-Tight Toner,6189,Glow Recipe,252846,4.3728,3305.0,5.07 oz/ 150 mL,Size,5.07 oz/ 150 mL,,"['Opuntia Ficus-Indica (Cactus) Extract, Citrullus Lanatus (Watermelon) Fruit Extract, Glycerin, Hyaluronic Acid, Gluconolactone, Sodium Polyglutamate, Betaine Salicylate, Salix Alba (Willow) Bark Extract, Melaleuca Alternifolia (Tea Tree) Extract, Hibiscus Sabdariffa Flower Extract, Lactobacillus/Watermelon Fruit Ferment Extract, Cucumis Sativus (Cucumber) Fruit Extract, Saccharum Officinarum (Sugarcane) Extract, Glycyrrhiza Glabra (Licorice) Root Extract, Scutellaria Baicalensis Root Extract, Paeonia Suffruticosa Root Extract, Brassica Oleracea Capitata (Cabbage) Leaf Extract, Ipomoea Batatas Root Extract, Sorbitan Oleate, Levulinic Acid, Sodium Levulinate, Fragrance/Parfum.']",34.0,,,0,0,0,0,1,"['Hyaluronic Acid', 'Good for: Dullness/Uneven Texture', 'Clean + Planet Positive', 'Good for: Pores', 'Hydrating', 'Salicylic Acid']",Skincare,Cleansers,Toners,1,15.0,15.0
P472700,Rose Perfecto Lip Balm 24H Hydration,1133,Givenchy,41868,4.431,935.0,0.09 oz/ 2.8 g,Color,117 Chilling Brown,coffee toned nude,"['Polyglyceryl-2 Triisostearate, Hydrogenated Castor Oil Dimer Dilinoleate, Bis-Behenyl/Isostearyl/Phytosteryl Dimer Dilinoleyl Dimer Dilinoleate, Helianthus Annuus (Sunflower) Seed Wax, Octyldodecanol, Squalane, Cera Alba (Beeswax), Butyrospermum Parkii (Shea) Butter, Oryza Sativa (Rice) Bran Wax, Ethylhexyl Palmitate, Trimethylolpropane Triisostearate, Parfum (Fragrance), Butyrospermum Parkii (Shea) Butter Unsaponifiables, Menthoxypropanediol, Ascorbyl Tetraisopalmitate, Rosa Rubiginosa Seed Oil, Pentaerythrityl Tetra-Di-T-Butyl Hydroxyhydrocinnamate, Tocopherol, Ascorbyl Palmitate, Helianthus Annuus (Sunflower) Seed Oil, Schinus Terebinthifolius Seed Extract, Trihydroxystearin, Propyl Gallate, Sodium Hyaluronate, Glucomannan, [+/- : Ci 77891 (Titanium Dioxide), Ci 77491 - Ci 77492 - Ci 77499 (Iron Oxides), Ci 15850 (Red 7 - Red 7 Lake), Ci 42090 (Blue 1 Lake)].']",38.0,,,0,0,0,0,0,"['Hyaluronic Acid', 'High Shine Finish', 'Vitamin C', 'Hydrating', 'Without Phthalates', 'Without Sulfates SLS & SLES']",Makeup,Lip,Lip Balm & Treatment,9,38.0,38.0
P473267,Smart Clinical Repair Wrinkle Correcting Serum,1254,CLINIQUE,4293,4.194,1670.0,1 oz/ 30 mL,Size,1 oz/ 30 mL,,"['Water\\Aqua\\Eau, Dimethicone, Isododecane, Butylene Glycol, Glycerin, Polysilicone-11, Ascorbyl Glucoside, Sodium Hyaluronate, Tocopheryl Acetate, Squalane, Hypnea Musciformis (Algae) Extract, Gelidiella Acerosa Extract, Sigesbeckia Orientalis (St. Paul Wort) Extract, Helianthus Annuus (Sunflower) Seed Extract, Hordeum Vulgare (Barley) Extract\\Extrait D’orge, Triticum Vulgare (Wheat) Germ Extract, Cucumis Sativus (Cucumber) Fruit Extract, Caffeine, Acetyl Hexapeptide-8, Palmitoyl Tripeptide-1, Palmitoyl Tetrapeptide-7, Palmitoyl Hexapeptide-12, Peg-10 Dimethicone, Glycyrrhetinic Acid, Whey Protein\\Lactis Protein\\Protéine Du Petit-Lait, Isohexadecane, Propylene Glycol Dicaprate, Caprylyl Glycol, Hydroxypinacolone Retinoate, Acetyl Glucosamine, Cholesterol, Peg-8, Yeast Extract\\Faex\\Extrait De Levure, Peg-6, Dimethyl Isosorbide, Glyceryl Polymethacrylate, Polysorbate 20, Sodium Phosphate, Synthetic Fluorphlogopite, Polysorbate 80, Carbomer, Hexylene Glycol, Ammonium Acryloyldimethyltaurate/Vp Copolymer, Acrylamide/Sodium Acryloyldimethyltaurate Copolymer, Potassium Hydroxide, Tin Oxide, Disodium Phosphate, Citric Acid, Disodium Edta, Sodium Citrate, Phenoxyethanol, Potassium Sorbate, Titanium Dioxide (Ci 77891).']",71.0,,,0,0,0,0,0,"['Hyaluronic Acid', 'Good for: Anti-Aging', 'Retinol', 'Fragrance Free', 'Oil Free', 'Without Sulfates SLS & SLES']",Skincare,Treatments,Face Serums,2,175.0,99.0
P476689,INVITE ONLY AMBER | 23 & DÉJÀ VU WHITE FLOWER | 57 Double Rollerball,6745,KAYALI,6827,4.1667,18.0,2 x 5 mL,Size + Concentration + Formulation,2 x 5 mL,,"['Invite Only Amber | 23 Eau De Parfum Intense:', 'Alcohol Denat./Sd Alcohol 40-B, Fragrance/Parfum, Water/Aqua/Eau, Avobenzone/Butyl Methoxydibenzoylmethane, Alcohol, Tris (Tetramethylhydroxypiperidinol) Citrate, Alpha-Isomethyl Ionone, Benzyl Benzoate, Cinnamal, Cinnamyl Alcohol, Coumarin, Linalool, Citral, Citronellol, Eugenol, Farnesol, Geraniol, Limonene, Benzyl Alcohol, Red 4/Ci 14700, Blue 1/Ci 42090, Ext. Violet 2/Ci 60730.', 'Déja Vu White Flower | 57 Eau De Parfum:', 'Sd Alcohol 40-B/Alcohol Denat., Fragrance/Parfum, Water/Aqua/Eau, Avobenzone/Butyl Methoxydibenzoylmethane, Alcohol, Tris(Tetramethylhydroxypiperidinol) Citrate, Yellow 5/Ci 19140, Ext. Violet 2/Ci 60730, Red 4/Ci 14700, Citral, Citronellol, Eugenol, Farnesol, Geraniol, Hydroxycitronellal, Isoeugenol, Limonene, Linalool, Benzyl Alcohol, Benzyl Benzoate.']",27.0,,,1,0,1,0,1,"['Layerable Scent', 'Warm &Spicy Scent', 'Floral Scent', 'Cruelty-Free']",Fragrance,Women,Rollerballs & Travel Size,0,,
P407471,GrandeLIPS Hydrating Lip Plumper Gloss,6151,Grande Cosmetics,64769,3.7782,1443.0,0.084 oz/ 2.48 mL,Color,Clear,high clear gloss,"['Octyldodecanol, Polybutene, Silica Dimethyl Silylate, Pentaerythrityl Tetraisostearate, Ethylhexyl Palmitate, Flavor/Aroma, Cetearyl Ethylhexanoate, Quaternium-90 Bentonite, Menthoxypropanediol, Caprylyl Glycol, 1,2-Hexanediol, Methyl Nicotinate, Propylene Carbonate, Butylene Glycol, Sorbitan Isostearate, Saccharin, Sodium Chondroitin Sulfate, Caffeine, Niacin, Portulaca Pilosa Extract, Atelocollagen, Phenoxyethanol, Hexylene Glycol, Sodium Hyaluronate, Sucrose Cocoate, Palmitoyl Tripeptide-38, Benzyl Benzoate.']",27.0,,,0,0,0,1,0,"['High Shine Finish', 'Good for: Loss of firmness', 'Plumping', 'Hydrating', 'Without Parabens', 'Cruelty-Free']",Makeup,Lip,Lip Gloss,0,,
P470246,Calming Hydration Booster Serum,7100,ROSE Ingleton MD,2391,4.7143,21.0,1 oz/ 30 mL,Size,1 oz/ 30 mL,,"['Water (Aqua, Eau), Butylene Glycol, Niacinamide, Diheptyl Succinate, Capryloyl Glycerin/Sebacic Acid Copolymer, Glycerin, Hydroxyethyl Acrylate, Sodium Acryloyldimethyl Taurate Copolymer, Phenoxyethanol, Ethylhexylglycerin, Pentylene Glycol, Sea Whip Extract, Allontoin, Sodium Hyaluronate, Xanthan Gum, Chamomilla Recutita (Matricaria) Flower Extract, Palmitoyl Camellia Sinensis (White Tea) Extract, Camellia Sinensis (Green Tea) Extract, Vitis Vinifera (Grape) Seed Oil, Tocopheryl Acetate (Vitamin E), Tetrasodium Glutamate Diacetate, Vaccinium Myrtillus Fruit Extract, Saccharum Officinarum (Sugarcane) Extract, Acer Saccharum (Sugar Maple) Extract, Citrus Aurantium Dulcis (Orange) Fruit Extract, Citrus Limon (Lemon) Fruit Extract, Mica, Titanium Dioxide, Iron Oxide (CI 77491).']",70.0,,,0,0,1,0,0,"['Good for: Redness', 'Good for: Dryness', 'Hyaluronic Acid', 'Niacinamide', 'Fragrance Free', 'Black Owned at Sephora']",Skincare,Treatments,Face Serums,0,,
P444194,J'adore Huile Divine - Dry Silky Body & Hair Oil,1073,Dior,7089,4.0833,12.0,,,,,"['Propylene Glycol Dicaprylate/Dicaprate, Dimethicone, Isopropyl Palmitate, Parfum (Fragrance), Benzyl Salicylate, Prunus Armeniaca (Apricot) Kernel Oil, Hexyl Cinnamal, Hydroxycitronellal, Ethylhexyl Methoxycinnamate, Citronellol, Alpha-Isomethyl Ionone, Diethylamino Hydroxybenzoyl Hexyl Benzoate, Limonene, Geraniol, Bht, Linalool, Tocopherol, Eugenol, Benzyl Alcohol, Benzyl Benzoate, Solanum Lycopersicum (Tomato) Fruit/Leaf/Stem Extract, Citral, Helianthus Annuus (Sunflower) Seed Oil, Rosmarinus Officinalis (Rosemary) Leaf Extract.']",75.0,,,0,0,1,0,0,,Bath & Body,Body Moisturizers,Body Lotions & Body Oils,0,,
P503877,Superkind Refining Cleanser,7020,Tata Harper,689,5.0,1.0,4.1 oz / 125 mL,Size,4.1 oz / 125 mL,,"['Calendula Officinalis Flower/Leaf/Stem Juice*, Decyl Glucoside, Propanediol, Shea Butter Glycerides, Cetearyl Olivate, Oryza Sativa (Rice) Powder*, Sodium Lauroyl Lactylate, Diglycerin, Lactobacillus Ferment, Leuconostoc Ferment Filtrate, Aqua/Water/Eau, Sorbitan Olivate, Vaccinium Macrocarpon (Cranberry) Fruit Extract, Glycerin, Glycolipids, Centella Asiatica Extract, Saccharide Isomerate, Ricinus Communis (Castor) Seed Oil, Pinus Sylvestris Leaf Extract, Oenothera Biennis (Evening Primrose) Oil*, Pyrus Malus (Apple) Seed Oil, Simmondsia Chinensis (Jojoba) Seed Oil*, Squalane, Vitis Vinifera (Grape) Seed Oil*, Borago Officinalis (Borage) Leaf Extract*, Calendula Officinalis (Calendula) Flower Extract*, Chamomilla Recutita (Matricaria) Flower Extract*, Lavandula Angustifolia (Lavender) Extract*, Medicago Sativa (Alfalfa) Extract*, L (+) Lactic Acid, Sclerotium Gum, Helianthus Annuus (Sunflower) Seed Oil*, Phytic Acid, Sodium Hydroxide, Citric Acid, Sodium Citrate.']",88.0,,,0,0,1,0,0,"['Vegan', 'Good for: Dullness/Uneven Texture', 'Clean + Planet Positive', 'Fragrance Free', 'Oil Free', 'Hypoallergenic']",Skincare,Cleansers,Face Wash & Cleansers,0,,
P480610,Hello Results Baby-Smooth Glycolic Peel + Caring Oil,6175,IT Cosmetics,2199,4.5,6.0,1 oz/ 30 mL,Size,1 oz/ 30 mL,,"['Aqua/Water/Eau, Caprylic/Capric Triglyceride, Limnanthes Alba Seed Oil/Meadowfoam Seed Oil, Isononyl Isononanoate, Glycolic Acid, Propylene Glycol, Alcohol Denat., Glycerin, Sodium Hydroxide, Hydroxyethylpiperazine Ethane, Sulfonic Acid, Squalane, Citric Acid, Rgania Spinosa Kernel Oil, Parfum/Fragrance, Ascorbyl Glucoside, Benzyl Salicylate, Panthenol, Tocopherol, Benzyl Alcohol, Butylene Glycol, Vaccinium Myrtillus Fruit Extract, Xanthan Gum, Saccharum Officinarum Extract /Sugarcane Extract/Extrait De Canne A Sucre, Curcuma Longa Root Extract/Turmeric Root Extract, Citrus Aurantium Dulcis Fruit Extract/Orange Fruit Extract, Citrus Limon Fruit Extract/Lemon Fruit Extract, Acer Saccharum Extract/Sugar Maple Extract, CI 17200/Red 33, Helianthus Annuus Seed Oil/Sunflower Seed Oil, CI 40800/Beta-Carotene.']",59.0,,,0,0,1,0,0,"['Good for: Dullness/Uneven Texture', 'Hydrating', 'Good for: Anti-Aging', 'AHA/Glycolic Acid', 'Best for Dry, Combo, Normal Skin']",Skincare,Treatments,Facial Peels,0,,
P457653,Mini Retro Eyeshadow Palette,6184,Natasha Denona,40708,4.4227,220.0,,,,,"['Galaxia, Industrial, Pixie:', 'Calcium Sodium, Borosilicate, Talc, Octyldodecyl Stearoyl, Stearate, Diisostearyl Malate, Silica, Mica, Caprylyl Glycol, Ethylhexylglycerin, Tin Oxide, Ptfe, Zinc Stearate, Calcium Titanium, Borosilicate, Synthetic, Fluorphlogopite, Aluminum Calcium Sodium, Silicate, Calcium Aluminum, Borosilicate, Silica, Alumina.', 'Vintage Taupe:', 'Synthetic Fluorphlogopite, Zinc Stearate, Triethoxycaprylylsilane, Caprylyl Glycol, Dimethicone, Ethylhexylglycerin, Hdi/Trimethylol, Hexyllactone, Crosspolymer, Silica. May Contain ( +/-) : Titanium Dioxide Ci 77891, Iron Oxides Ci 77499, Iron Oxides Ci 77492, Iron Oxides Ci 77491, Ultramarines Ci 77007, Carmine Ci 75470. May Contain ( +/ -): Titanium Dioxide Ci 77891, Iron Oxides Ci 77491, Iron Oxides Ci 77492, Iron Oxides Ci 77499, Aluminum Powder Ci 77000, Carmine Ci 75470.']",27.0,,,0,0,0,0,0,"['Matte Finish', 'Metallic Finish']",Makeup,Mini Size,,0,,
P196524,Acne Solutions Cleansing Bar For Face and Body,1254,CLINIQUE,17889,4.3638,459.0,5.2 oz/ 147 g,Size,5.2 oz/ 147 g,,"['Sodium Palmate, Sodium Cocoate, Water, Palmitic Acid, Cocamidopropyl Dimethylamine, Glyceryl Stearate, Zea Mays (Corn) Starch, Hydrolyzed Corn Starch, Glycerin, Caffeine, Zinc Pca, Ppg-26/Dimer Dilinoleate Copolymer, Polyquaternium-67, Hydrolyzed Corn Starch Octenylsuccinate, Sodium Chloride, Tetrasodium Edta, Tetrasodium Etidronate, Chlorphenesin, Titanium Dioxide (Ci 77891) <ILN32953>.']",19.5,,,0,0,0,0,0,,Skincare,Cleansers,Face Wash & Cleansers,0,,
P409404,Mini Intenso Smoothing Hair Set for Thick Hair,6159,Rossano Ferretti Parma,952,3.8333,6.0,,,,,['Intenso Softening and Smoothing Shampoo:'],59.0,,,0,0,1,0,0,"['Good for: Frizz', 'Hydrating', 'Good for: Dryness', 'Vegan', 'Cruelty-Free', 'Clean at Sephora']",Hair,Value & Gift Sets,,0,,
P411049,Happy Birthday Gift Card,3902,SEPHORA COLLECTION,0,4.1176,17.0,,Type,$50,,,50.0,,,0,0,0,0,0,,Gifts,,,8,250.0,10.0
P450557,Mon Guerlain Eau de Parfum Intense,1132,GUERLAIN,7838,4.4783,23.0,3.4 oz/ 100 mL,Size + Concentration + Formulation,3.4 oz/ 100 mL,,"['Alcohol, Parfum (Fragrance), Aqua (Water), Linalool, Limonene, Hydroxycitronellal, Ethylhexyl Methoxycinnamate, Coumarin, Diethylamino Hydroxybenzoyl Hexyl Benzoate, Bht, Butyl Methoxydibenzoylmethane, Butylene Glycol Dicaprylate/Dicaprate, Citral, Geraniol, Citronellol, Benzyl Alcohol, Anise Alcohol, Farnesol, Tocopherol, CI 60730 (Ext. Violet 2), CI 19140 (Yellow 5), CI 17200 (Red 33).']",165.0,,,0,0,1,0,0,"['Warm &Spicy Scent', 'Floral Scent']",Fragrance,Women,Perfume,0,,
P472465,One-Two Punch Water-Activated 2-in-1 Hair Wash,7004,Drybar,1473,3.6667,6.0,2.8 oz/ 80 g,Size,2.8 oz/ 80 g,,"['Sodium Cocoyl Isethionate, Cocos Nucifera (Coconut) Fruit Extract, Citric Acid, Cellulose Gum, Guar Hydroxypropyltrimonium Chloride, Xanthan Gum, Aloe Barbadensis Leaf Juice, Fragaria Ananassa (Strawberry) Seed Oil, Panthenol, Camellia Sinensis Leaf Extract, Maltodextrin, Gluconolactone, Sodium Caseinate, Calcium Gluconate, Glycerin, Sodium Benzoate, Potassium Sorbate.']",23.0,,,0,0,0,0,0,"['Vegan', 'Loose Powder Formula', 'All Hair Types', 'Fragrance Free', 'Without Parabens']",Hair,Shampoo & Conditioner,Shampoo,0,,
P446604,Body Brush,6286,PATRICK TA,9275,3.2,20.0,,,,,,35.0,,,0,0,0,1,1,,Makeup,Brushes & Applicators,Face Brushes,0,,
P232907,Anti Bac Acne Clearing Lotion,5946,Kate Somerville,28025,4.4599,611.0,1.7 oz,Size,1.7 oz,,"['Benzoyl Peroxide 5%, Water/Aqua/Eau, PPG-2 Myristyl Ether Propionate, Argania Spinosa Kernel Extract, PEG-40 Sterate, Serenoa Serrulata Fruit Extract, Sesamum Indicum (Sesame) Seed Extract, Alcohol Denat., Sorbitan Stearate, Hydrogenated Methyl Abeitate, Methyl Methacrylate Crosspolymer, Carbomer, Glyceryl Stearate, Cetyl Alcohol, Tetrasodium EDTA, Hydrogenated Lecithin, Cholesterol, Ceramide NS, Ceramide NP, Oleic Acid, Palmitic Acid, Sodium Ascorbate, Sodium Hydroxide, EDTA, Ethyhexylglycerin, Phenoxyethanol. -Five Percent Benzoyl Peroxide: Helps diminish the look of blemishes.', 'Benzoyl Peroxide 5%, Water/Aqua/Eau, PPG-2 Myristyl Ether Propionate, Argania Spinosa Kernel Extract, PEG-40 Sterate, Serenoa Serrulata Fruit Extract, Sesamum Indicum (Sesame) Seed Extract, Alcohol Denat., Sorbitan Stearate, Hydrogenated Methyl Abeitate, Methyl Methacrylate Crosspolymer, Carbomer, Glyceryl Stearate, Cetyl Alcohol, Tetrasodium EDTA, Hydrogenated Lecithin, Cholesterol, Ceramide NS, Ceramide NP, Oleic Acid, Palmitic Acid, Sodium Ascorbate, Sodium Hydroxide, EDTA, Ethyhexylglycerin, Phenoxyethanol.']",56.0,,,0,0,0,0,0,"['Best for Oily, Combo, Normal Skin', 'Good for: Acne/Blemishes', 'Cruelty-Free']",Skincare,Treatments,Face Serums,0,,
P457439,Clarifying Lotion,3902,SEPHORA COLLECTION,5748,3.6207,29.0,0.50 oz/ 15 mL,,,,"['Aqua (Water), Alcohol Denat., CI 77947 (Zinc Oxide), Isopropyl Alcohol, Glycerin, Vaccinium Myrtillus Fruit Extract, Saccharum Officinarum (Sugar Cane) Extract, Salicylic Acid, Citrus Aurantium Dulcis (Orange) Fruit Extract, Citrus Limon (Lemon) Fruit Extract, CI 77288 (Chromium Oxide Greens), Sodium Hydroxide, Acer Saccharum (Sugar Maple) Extract.']",16.0,,,0,0,0,0,1,"['Vegan', 'Clean + Planet Positive']",Skincare,Treatments,Blemish & Acne Treatments,0,,
P482318,Gradual Tan Tinted Daily Firming Lotion,5626,St. Tropez,1397,2.75,16.0,6.7 oz/ 200 mL,Size,6.7 oz/ 200 mL,,"['Aqua (Water), Coco-Caprylate, Dihydroxyacetone, Caramel, Cetearyl Alcohol, Pentaerythrityl Distearate, Cetearyl Glucoside, Dimethicone, Glycerin, Ethoxydiglycol, Trimethylsiloxysilicate, Vitis Vinifera (Grape) Seed Oil, Alaria Esculenta Extract, Biosaccharide Gum-1, Rubus Idaeus (Raspberry) Seed Oil, Sodium Hyaluronate, Vaccinium Myrtillus Seed Oil, Tocopherol, Helianthus Annuus (Sunflower) Seed Oil, Caprylic/Capric Triglyceride, Capryloyl/Capryloyl Leucine Isosorbide Esters, Parfum (Fragrance), Ceteareth-20, Phenoxyethanol, Caprylyl Glycol,  Cellulose, Mica, Xanthan Gum, Isosorbide, Pentaerythrityl Tetra-Di-t-Butyl Hydroxyhydrocinnamate, Hexanediol, Hydroxyacetophenone, Benzyl Salicylate, Linalool, Coumarin, Limonene, Citronellol, CI 15985 (Yellow 6), CI 77891 (Titanium Dioxide), CI 14700 (Red 4), CI 42090 (Blue 1).']",29.0,,,0,0,1,0,0,"['Radiant Finish', 'Hyaluronic Acid', 'Good for: Loss of firmness', 'Hydrating', 'Clean at Sephora', 'Cruelty-Free']",Skincare,Self Tanners,For Body,0,,
P475122,Mini The Big Clean Longwear Volumizing + Lash Care Mascara,6279,Kosas,5853,3.1852,27.0,0.17oz/ 5 g,Size,0.17oz/ 5 g,,"['Aqua, Beeswax, CI 77499, Diisostearoyl Polyglyceryl-3 Dimer Dilinoleate, Pullulan, Copernicia Cerifera Cera, Sorbitol, Polyglyceryl-6 Distearate, Cetyl Alcohol, Glycerin, Ricinus Communis Seed Oil, Biotinoyl Tripeptide-1, Panthenol, Hydrolyzed Jojoba Esters, Acacia Senegal Gum, Trehalose, Citric Acid, Pentylene Glycol, Phenethyl Alcohol, Propanediol, Sodium Hydroxide, Potassium Sorbate, Sodium Benzoate.']",13.0,,,0,0,0,0,0,"['Volumizing', 'Clean + Planet Positive', 'Long-wearing', 'Good for: Hair Thinning', 'Lengthening', 'Curling']",Mini Size,Makeup,,0,,
P504427,Thickening Therapy Shampoo & Conditioner Duo,6372,BondiBoost,2687,4.7636,55.0,,,,,"['Thickening Therapy Shampoo:', 'Aloe Barbadensis (Aloe Vera) Leaf Juice, Sodium Methyl Cocoyl Taurate, Cocamidopropyl Betaine, Decyl Glucoside, Coco-Glucoside, Glyceryl Oleate, Propanediol, Hydrolyzed Quinoa, Hydrolyzed Jojoba Esters, Hydrolyzed Adansonia Digitata (Baobab) Seed Extract, Ceramide NG, Ricinus Communis (Castor) Oil, Caprylic/Capric Triglyceride, Argania Spinosa (Argan) Kernel Oil, Olea Europaea (Olive) Fruit Oil, Arginine, Hydrolyzed Marine Collagen, Rosmarinus Officinalis (Rosemary) Leaf Extract, Ascophyllum Nodosum (Seaweed) Extract, Amaranthus Caudatus Seed (Amaranth) Extract, Equisetum Arvense (Horsetail) Leaf Extract, Acanthopanax Senticosus Root (Ginseng) Extract, Sodium Hyaluronate, Niacinamine (Vitamin B3), Biotin, Polyquaternium-7, Polyquaternium-10, Potassium Sorbate, Pentylene Glycol, Caprylyl Glycol, Ethylhexylglycerin, Fragrance, Citric Acid.', 'Thickening Therapy Conditioner:', 'Aloe Barbadensis (Aloe Vera) Leaf Juice, Behentrimonium Chloride, Cetearyl Alcohol, Glycerin, Coco-Caprylate, Propanediol, Caprylic/Capric Triglyceride, Argania Spinosa (Argan) Kernel Oil, Simmondsia Chinensis (Jojoba) Seed Oil, Hydrolyzed Jojoba Esters, Panthenol (Pro Vitamin B5), Niacinamine (Vitamin B3), Sodium Hyaluronate, Ceramide NG, Ricinus Communis (Castor) Oil, Vitis Vinifera (Grape) Seed Oil, Macadamia Integrifolia (Macadamia) Seed Oil, Rosmarinus Officinalis (Rosemary) Leaf Extract, Hydrolyzed Quinoa, Hydrolyzed Adansonia Digitata (Baobab) Seed Extract, Biotin, Fragrance, Polyquaternium-7, Polyquaternium-10, Pentylene Glycol, Caprylyl Glycol, Ethylhexylglycerin, Citric Acid.']",49.95,59.5,,0,0,1,1,0,"['Vegan', 'Good for: Color Care', 'Good for: Volume', 'Clean at Sephora', 'Good for: Hair Thinning', 'Cruelty-Free']",Hair,Value & Gift Sets,,0,,
P457223,Detox Shampoo,6144,OUAI,129672,4.5259,1352.0,10 oz/ 300 mL,Size,10 oz/ 300 mL,,"['Aqua (Water, Eau), Sodium C14-16 Olefin Sulfonate, Sodium Lauroyl Methyl Isethionate, Cocamidopropyl Betaine, Decyl Glucoside, Acrylates Copolymer, Cocamide Mipa, Parfum (Fragrance), Polysorbate 20, Hydrolyzed Keratin,   Hydroxypropyl Guar Hydroxypropyltrimonium Chloride, Vinegar, Peg-150 Distearate,    Polyquaternium-7, Glycerin, Benzophenone-4, Sodium Chloride, Sodium Hydroxide,   Tetrasodium Edta, Trisodium Ethylenediamine Disuccinate, Isopropyl Alcohol,    Propylene Glycol, Citric Acid, Disodium Edta, Chlorphenesin, Sodium Benzoate, Phenoxyethanol, Potassium Sorbate, Linalool, Citronellol, Ci 14700 (Red 4), Ci 19140 (Yellow 5), Ci 61570 (Green 5)']",32.0,,,0,0,0,0,0,"['Floral Scent', 'All Hair Types', 'Without Sulfates SLS & SLES', 'Increases Shine', 'Good for: Oily Scalp', 'Cruelty-Free']",Hair,Shampoo & Conditioner,Shampoo,3,64.0,14.0
P500162,Skin Finish Water Based Loose Setting Powder,6363,REFY,6581,3.8947,19.0,,Color,1,light medium,"['Aqua/Water/Eau, Vinyl Dimethicone/Methicone Silsesquioxane Crosspolymer, Glycerin, Silica Silylate, Phenoxyethanol, Hydroxyacetophenone, Caprylyl Glycol, Triethoxycaprylylsilane [May Contain/Peut Contenir: Iron Oxides (CI 77491, CI 77492, CI 77499)].']",32.0,,,0,0,0,0,0,"['Vegan', 'Loose Powder Formula', 'Natural Finish', 'Good for: Pores', 'Cruelty-Free']",Makeup,Face,Setting Spray & Powder,1,32.0,32.0
P504706,NuFACE Effective Lip & Eye Attachment,6001,NuFACE,205,,,,,,,,160.0,,,0,1,0,0,0,"['Good for: Loss of firmness', 'Good for: Anti-Aging']",Skincare,High Tech Tools,Anti-Aging,0,,
P481174,Bitter Peach Lip Color Matte Lipstick,5869,TOM FORD,7598,4.6818,22.0,0.1 oz/ 2.96 mL,Color,Scarlet Rouge,warm red,"['Castor Oil, Di-Isostearyl Malate, Tri-Octyldodecyl Exemplary Tray Agent, Caprylic / Capric Triglyceride, Lanolin Oil, Candelilla Wax, Ozokerite, Octyldodecanol, Silica, Bis Di-Glyceryl Poly Adipate Acyl-2, Hydro Jeneyi Suited Polydecene, Polyethylene, Microcrystalline Wax, Fragrance, Tocopherol, Squalane, Wheat Germ Extract, Soybean Extract, Barley Extract, Coconut Seed Butter, Chamomile Flower Oil, Shea Butter , Cholesterol And Ceramide 3, Acrylate Copolymers, Linoleic Lake Acid, A Tree In Tok Chicago Frills Reel Silane, Calcium, Sodium Beam With Silicate, Calcium Aluminum Beam Silicate, Synthetic Fluorinated Sample Logo Graphite, Polyethylene Terephthalate, Barium Sulfate, Alumina, Vanillin, [+/- Mica, Titanium Dioxide, Red Iron Oxide, Yellow Iron Oxide, Black Iron Oxide, Blue No. 1 Lake, Carmine, Copper Powder, Red No. 201, Red 104 Arc (1) Lake, Lake Red No. 202, Red No. 226 Lake, Lake Red Lake No. 227, Yellow No. 4 Lake, Yellow No. 5].']",58.0,,,1,0,0,0,1,"['Cream Formula', 'Matte Finish']",Makeup,Lip,Lipstick,1,58.0,58.0
P459129,Peptide Eye Cream,6318,Dr. Lara Devgan Scientific Beauty,5462,4.8172,268.0,0.5 oz/ 15 mL,Size,0.5 oz/ 15 mL,,"['Water, Helianthus Annuus (Sunflower) Seed Oil, Glycerin, Dimethicone, Isopropyl Palmitate, Palmitoyl Tripeptide-1, Palmitoyl Tetrapeptide-7, Steareth-20, Chrysin, N-Hydroxysuccinimide, Butylene Glycol, Carbomer, Polysorbate 20, Glycol Distearate, Glyceryl Stearate, PEG-100 Stearate, Stearic Acid, Stearyl Alcohol, Phytonadione, Vitis Vinifera (Grape) Seed Oil, Persea Gratissima (Avocado) Oil, Tocopheryl Acetate, Allantoin, Titanium Dioxide, Tetrasodium EDTA, Triethanolamine, Phenoxyethanol, Ethylhexylglycerin.']",215.0,,,0,0,1,0,1,"['Good for: Dark Circles', 'Good for: Anti-Aging', 'Good for: Dullness/Uneven Texture', 'Hyaluronic Acid', 'Without Sulfates SLS & SLES', 'Cruelty-Free']",Skincare,Eye Care,Eye Creams & Treatments,0,,
