product_id,product_name,brand_id,brand_name,loves_count,rating,reviews,size,variation_type,variation_value,variation_desc,ingredients,price_usd,value_price_usd,sale_price_usd,limited_edition,new,online_only,out_of_stock,sephora_exclusive,highlights,primary_category,secondary_category,tertiary_category,child_count,child_max_price,child_min_price
P395905,Miss Dior Hair Mist,1073,Dior,26362,3.9818,55.0,1 oz/ 30 mL,Size,1 oz/ 30 mL,,"['Alcohol, Aqua (Water), Parfum (Fragrance), Triethyl Citrate, Peg-60 Hydrogenated Castor Oil, Ethylhexylglycerin, Ethylhexyl Methoxycinnamate, Limonene, Hydroxycitronellal, Butyl Methoxydibenzoylmethane, Ethylhexyl Salicylate, Hexyl Cinnamal, Linalool, Benzyl Salicylate, Alpha-Isomethyl Ionone, Citronellol, Bht, Isoeugenol, Geraniol, Citral, Tocopherol, Ci 14700 (Red 4), Ci 60730 (Ext. Violet 2), Ci 42090 (Blue 1).']",75.0,,,0,0,0,0,0,,Fragrance,Women,Body Mist & Hair Mist,0,,
P503240,Good Fortune Perfume Set,5979,Viktor&Rolf,3275,4.125,8.0,,,,,"['Alcohol, Parfum/Fragrance, Aqua/Water/Eau, Dipropylene Glycol, Limonene, Linalool, Benzyl Salicylate, Benzyl Alcohol, Butyl Methoxydibenzoylmethane, Hydroxycitronellal, Methyl Anthranilate, Citronellol, Alpha-Isomethyl Ionone, Coumarin, Geraniol, Isoeugenol, Benzyl Benzoate, Citral, Tris (Tetramethylhydroxypiperidinol) Citrate, Eugenol, Farnesol, Ci 60730/Ext. Violet 2, Ci 17200/Red 33.']",130.0,160.0,,1,0,0,0,0,"['Vegan', 'Floral Scent']",Fragrance,Value & Gift Sets,Perfume Gift Sets,0,,
P122866,Lash Building Primer,1254,CLINIQUE,24084,4.2907,774.0,,,,,"['Water, Copernicia Cerifera (Carnauba) Wax, Stearic Acid, Polybuten, Glyceryl Stearate, Oleic Acid, Aminomethyl Propanediol, Acrylates Copolymer, Panthenol, Glycerin, Ethylhexylglycerin, Hydroxyethylcellulose, Chlorphenesin, Sodium Dehydroacetate, Phenoxyethanol, Sorbic Acid.']",21.0,,,0,0,0,0,0,,Makeup,Eye,Mascara,0,,
P469083,Extra Mist-ical Shine Spray,6351,COLOR WOW,12304,4.1522,46.0,5 oz/ 162 mL,Size,5 oz/ 162 mL,,"['Hydrofluorocarbon 152A, Alcohol Denat., Cyclopentasiloxane, C12-15 Alkyl Benzoate, Phenyl Trimethicone, Glycerin, Hydrolyzed Verbascum Thapsus Flower, Phytantriol, Peg-12 Dimethicone, Panthenyl Ethylether, Fragrance (Parfum), Citric Acid, Sodiumbenzoate, Potassiumsorbate. FORMULA #312-0 SDS-IL-2096.']",29.0,,,0,0,0,0,0,"['High Shine Finish', 'Good for: Color Care', 'Heat Protection', 'Hydrating', 'All Hair Types', 'Good for: Dryness']",Hair,Hair Styling & Treatments,Hair Styling Products,0,,
P479969,Complete Hydration Hair Set,6469,JVN,10396,3.2826,92.0,,,,,"['Nurture Hydrating Shampoo:', 'Water/Aqua/Eau, Aloe Barbadensis Leaf Juice, Sodium Methyl Cocoyl Taurate, Lauryl Glucoside, Cocamidopropyl Hydroxysultaine, Coco-Glucoside, Hydrogenated Farnesene, Glycerin, Panthenol, Pyrus Malus (Apple) Fruit Extract, Glyceryl Oleate, Tristearyl Citrate, Sorbitan Oleate Decylglucoside Crosspolymer, Guar Hydroxypropyltrimonium Chloride, Sodium Gluconate, Sodium Levulinate, Sodium Chloride, Potassium Sorbate, Benzyl Alcohol, Citric Acid, Fragrance/Parfum, Coumarin, Limonene, Linalool.', 'Nurture Hydrating Conditioner:', 'Water/Aqua/Eau, Stearyl Alcohol, Cetyl Alcohol, Hydrogenated Farnesene, Brassicamidopropyl Dimethylamine, Cinnamidopropyltrimonium Chloride, Squalane, Cetearyl Olivate, Camellia Japonica Seed Oil, Glycerin, Sodium PCA, Arginine, Glycine, Alanine, Serine, Proline, Valine, Threonine, Isoleucine, Histidine, Phenylalanine, PCA, Tocopherol, Sodium Lactate, Sorbitan Olivate, Aspartic Acid, Sodium Gluconate, Ethylhexylglycerin, Benzyl Alcohol, Fragrance/Parfum, Coumarin, Limonene, Linalool.', 'Nurture Deep Moisture Mask:', 'Water/Aqua/Eau, Stearyl Alcohol, Cetyl Alcohol, Hydrogenated Farnesene*, Brassicamidopropyl Dimethylamine, Cinnamidopropyltrimonium Chloride, Squalane, Glycerin, Camellia Japonica Seed Oil, Hydroxypropyltrimonium Hydrolyzed Rice Protein, Apple Cider Vinegar, Panthenol, Cetearyl Olivate, Tocopherol, Sorbitan Olivate, Ethylhexylglycerin, Aspartic Acid, Leuconostoc/Radish Root Ferment Filtrate, Sodium Gluconate, Maltodextrin, Benzyl Alcohol, Fragrance/Parfum, Coumarin, Limonene, Linalool.', 'Complete Hydrating Air Dry Cream:', 'Water/Aqua/Eau, Squalane, Glycerin, Cinnamidopropyltrimonium Chloride, Acrylates/C10-30 Alkyl Acrylate Crosspolymer, Hydrogenated Farnesene, Salvia Hispanica Seed Extract, Linum Usitatissimum (Linseed) Seed Extract, Moringa Oleifera Seed Oil, Butyrospermum Parkii (Shea) Butter, Hydrolyzed Jojoba Esters, Sorbitan Oleate Decylglucoside Crosspolymer, Tocopherol, Maltodextrin/VP Copolymer, Potassium Sorbate, Ethylhexylglycerin, Benzyl Alcohol, Sodium Gluconate, Sodium Hydroxide, Fragrance/Parfum, Coumarin, Amyl Cinnamal, Citronellol, Hexyl Cinnamal, Hydroxycitronellal, Methyl Ionones, Eugenol, Linalool, Limonene.']",24.0,28.0,,0,0,0,0,0,"['Clean + Planet Positive', 'Hydrating', 'All Hair Types', 'Good for: Frizz', 'Good for: Dryness', 'Without Silicones']",Hair,Value & Gift Sets,,0,,
P422640,Ultimate Strength Hand Salve,6218,Kiehl's Since 1851,26686,4.6411,365.0,5 oz/ 150 mL,Size,5 oz/ 150 mL,,"['Aqua/Water, Glycerin, Caprylic/Capric/Myristic/Stearic', 'Triglyceride, Butylene Glycol, Hydrogenated', 'Olive Oil Stearyl Esters, Butyrospermum Parkii Butter/Shea', 'Butter, Aluminum Starch Octenylsuccinate, Cetearyl Alcohol,', 'PEG-75 Stearate, Glyceryl Stearate, Cetyl Alcohol, Bis-Diglyceryl', 'Polyacyladipate-2, Sesamum Indicum Seed Oil/Sesame Seed Oil,', 'Squalane, Dimethicone, Ceteth-20, Phenoxyethanol, Persea', 'Gratissima Oil/Avocado Oil, Steareth-20,', 'Ceteareth-20, Chlorphenesin, Tocopheryl Acetate,', 'PPG-5-Ceteth-20, Eucalyptus Globulus Leaf Oil,', 'Allantoin, Ethylhexylglycerin, Disodium EDTA,', 'Sodium Hydroxide, Limonene, Aloe Barbadensis', 'Leaf Juice Powder, Tocopherol, Citric Acid.']",32.0,,,0,0,0,0,0,"['Good for: Redness', 'Best for Dry Skin', 'Clean at Sephora', 'Good for: Dryness', 'Without Parabens']",Bath & Body,Body Moisturizers,Hand Cream & Foot Cream,1,22.0,22.0
P477812,Refillable Jumbo Magic Cream Moisturizer with Hyaluronic Acid,6236,Charlotte Tilbury,6696,3.75,4.0,5.0 oz/ 150 ml,Size,5.0 oz/ 150 ml,,"['Aqua/Water/Eau, C12-15 Alkyl Benzoate, Glyceryl Stearate Se, Butylene Glycol, Glycerin, Olus Oil/Vegetable Oil/Huile Végétale, Isononyl Isononanoate, Cetyl Alcohol, Ethylhexyl Palmitate, Cyclopentasiloxane, Dimethicone, Polyester-7, Phenoxyethanol, Neopentyl Glycol Diheptanoate, Butyrospermum Parkii (Shea) Butter, Steareth-21, Avena Sativa (Oat) Kernel Extract, Carbomer, Dimethiconol, Potassium Cetyl Phosphate, Chlorphenesin, Caprylyl Glycol, Xanthan Gum, Hydrolyzed Viola Tricolor Extract, Allantoin, Aloe Barbadensis (Aloe Vera) Leaf Juice, Disodium Edta, Tocopheryl Acetate, Camellia Oleifera Seed Oil, Rosa Canina Fruit Oil, Rosa Damascena (Rose) Extract, Sodium Hydroxide, Helianthus Annuus (Sunflower) Seed Oil, Michelia Alba Leaf Oil, Sodium Lactate, Coco-Glucoside, Peg-8, Ethylhexylglycerin, Sodium Hyaluronate, Tocopherol, Palmitoyl Tetrapeptide-7, Palmitoyl Tripeptide-1, Ascorbyl Palmitate, Plumeria Rubra Flower Extract, Ascorbic Acid, Citric Acid, Nicotiana Sylvestris Leaf Cell Culture, Linalool, Citronellol, Geraniol.']",260.0,,,0,0,1,0,0,"['Refill Available', 'Hyaluronic Acid', 'Good for: Anti-Aging', 'Good for: Dryness', 'Without Sulfates SLS & SLES']",Skincare,Moisturizers,Moisturizers,1,220.0,220.0
P504575,PRO ACV Healthy Gut Vegan Gummies with 100% Organic Apple Cider Vinegar and Probiotics,7050,HUM Nutrition,797,4.6607,168.0,60  / vegan gummies,Size,60  / vegan gummies,,"['Tapioca Syrup, Cane Sugar, Water, Pectin, Citric Acid, Medium Chain Triglycerides (MCT), Natural Flavors, Sodium Malate, Sunflower Lecithin, Organic Tapioca Starch, Vegetable Juice (Color).']",26.0,,,0,1,0,0,1,"['Vegan', 'Clean at Sephora', 'Without Phthalates', 'Without Parabens']",Skincare,Wellness,Beauty Supplements,0,,
P206900,Lash Power Mascara Long-Wearing Formula,1254,CLINIQUE,45752,4.3192,2243.0,,Color,Black Onyx,,"['Water\\Aqua\\Eau, Acrylates Copolymer, Kaolin, Copernicia Cerifera (Carnauba) Wax\\ Copernicia Cerifera Cera \\Cire De Carnauba, Peg-15 Glyceryl Stearate, Silica, Butylene Glycol, Beeswax\\Cera Alba\\Cire d’abeille, Alcohol, Hydrogenated Rapeseed Alcohol, Bentonite, Polyvinyl Alcohol, Sucrose Distearate, Stearic Acid, Simmondsia Chinensis (Jojoba) Seed Oil, Dimethicone, Simethicone, Vp/Va Copolymer, Nylon-66, Tocopherol, Aminomethyl Propanediol, Aminomethyl Propanol, Xanthan Gum, Chlorphenesin, Sodium Dehydroacetate, Phenoxyethanol, [+/- Iron Oxides (Ci 77491), Iron Oxides (Ci 77492), Iron Oxides (Ci 77499), Titanium Dioxide (Ci 77891), Carmine (Ci 75470), Yellow 5 Lake (Ci 19140), Blue 1 Lake (Ci 42090), Ultramarines (Ci 77007), Bismuth Oxychloride (Ci 77163), Chromium Oxide Greens (Ci 77288), Manganese Violet (Ci 77742), Chromium Hydroxide Green (Ci 77289)].']",23.0,,,0,0,0,0,0,,Makeup,Eye,Mascara,1,23.0,23.0
P418221,Organic Sunless Tan Anti-Aging Face Serum,7091,COOLA,16938,3.9744,156.0,1.7 oz/ 50 mL,Size,1.7 oz/ 50 mL,,"['Water (Aqua), Propanediol, Dihydroxyacetone, Glycerin, Aloe Barbadensis Leaf Juice Powder*, Heptyl Undecylenate, Argan Oil, Polyglyceryl-6 Esters, Centella Asiatica Meristem Cell Culture, Hydrolyzed Algin, Caprylic/Capric Glycerides Polyglycerin-10 Esters, Sodium Hyaluronate, Chlorella Vulgaris Extract, Hibiscus Sabdariffa Flower Extract*, Chamomilla Recutita (Matricaria) Flower Extract*, Ascorbyl Palmitate, Vitis Vinifera (Grape) Seed Oil*, Citrus Aurantium Bergamia (Bergamot) Fruit Oil*, Cetearyl Glucoside, Alcohol Denat.**, Maris Aqua, Polyglyceryl-4 Caprate, Cyamopsis Tetragonoloba (Guar) Gum, Xanthan Gum, Fragrance, Gluconolactone, Potassium Sorbate, Sodium Benzoate.']",54.0,,,0,0,0,0,0,"['Clean at Sephora', 'Hydrating', 'Hyaluronic Acid', 'Reef Safe SPF', 'Good for: Anti-Aging']",Skincare,Self Tanners,For Face,0,,
P457685,Sweet Pitti Deodorant Cream,7083,Drunk Elephant,28388,3.9091,902.0,2.0 oz/ 60 mL,Size,2.0 oz/ 60 mL,,"['Water/Aqua/Eau, Mandelic Acid, Maranta Arundinacea Root Powder, Caprylic/Capric Triglyceride, Isononyl Isononanoate, Glycerin, Tapioca Starch, Butyrospermum Parkii (Shea) Butter, Cetearyl Olivate, Cetearyl Alcohol, Cetyl Alcohol, Sorbitan Olivate, Sclerocarya Birrea Seed Oil, Adansonia Digitata Seed Oil, Schinziophyton Rautanenii Kernel Oil, Sclerotium Gum, Panthenol, Sodium Stearoyl Glutamate, Prunus Amygdalus Dulcis (Sweet Almond) Seed Extract, Hydroxyethylcellulose, Citric Acid, Caprylyl Glycol, Phenoxyethanol, Chlorphenesin, Sodium Hydroxide.']",16.0,,,0,0,0,0,0,"['Fragrance Free', 'Cruelty-Free', 'Vegan', 'Clean at Sephora']",Bath & Body,Body Care,Deodorant & Antiperspirant,0,,
P461947,Calendula Petal-Infused Calming Mask with Aloe Vera,6218,Kiehl's Since 1851,10799,4.5111,45.0,3.4 oz/ 100 mL,Size,3.4 oz/ 100 mL,,"['Aqua/Water, Aloe Barbadensis Leaf Juice, Glycerin, Propylene Glycol, Propanediol, 1,2-Hexanediol, Pentylene Glycol, Caprylic/Capric Triglyceride, Tridecyl Trimellitate, Hydroxyacetophenone, Hydroxyethyl Acrylate/Sodium Acryloyldimethyl Taurate Copolymer, Acrylates/C10-30 Alkyl Acrylate Crosspolymer, Polyacrylate Crosspolymer-6, Dimethicone, Isohexadecane, Calendula Officinalis Flower, Potassium Hydroxide, Carbomer, Centella Asiatica Extract, Squalane, Tocopherol, Disodium Edta, Calendula Officinalis Flower Extract, Polysorbate 60, Scutellaria Baicalensis Root Extract, Polygonum Cuspidatum Root Extract, Bisabolol, Glyceryl Polyacrylate, Hedera Helix Extract - Ivy Leaf/Stem Extract, Sorbitan Isostearate, Glycyrrhiza Glabra Root Extract/Licorice Root Extract, Camellia Sinensis Leaf Extract, Chamomilla Recutita Flower Extract/Matricaria Flower Extract, Rosmarinus Officinalis Leaf Extract/Rosemary Leaf Extract, Potassium Sorbate, Sodium Benzoate, Zingiber Officinale Root Extract/Ginger Root Extract.']",47.0,,,0,0,0,0,0,"['Good for: Redness', 'Clean at Sephora', 'Good for: Dryness', 'Without Parabens', 'Without Sulfates SLS & SLES']",Skincare,Masks,Face Masks,0,,
P469152,Reusable Makeup Sponge Case,3902,SEPHORA COLLECTION,18828,4.6,25.0,,,,,,8.0,,,0,0,0,0,1,,Makeup,Brushes & Applicators,Sponges & Applicators,0,,
P464244,Vitamin C Brightening Toner,6334,Dr. Zenovia Skincare,3840,4.5981,107.0,4 oz/ 120 mL,Size,4 oz/ 120 mL,,"['Purified Water, Methyl Gluceth-20, Sodium PCA, Hamamelis Virginiana (Witch Hazel) Extract, Chamomilla Recutita (Matricaria) Flower Extract, Camellia Sinensis (Green Tea) Leaf Extract, Camellia Sinensis (Green Tea) Polyphenols, Camellia Sinensis (White Tea) Leaf Extract, Symphytum Officinale (Comfrey) Extract, Cucumis Sativus (Cucumber) Fruit Extract, Punica Granatum Sterols, Genistein, Aloe Barbadensis Leaf Juice, Tocopherol Acetate, Resveratrol, Bakuchiol, Sea Salt, Ascorbic Acid, Panthenol, Lavandula Angustifolia (Lavender) Oil, Glycerin, Polysorbate 20, Sodium Benzoate, Disodium EDTA, Phenoxyethanol.']",38.0,,,0,0,1,0,1,"['Best for Oily, Combo, Normal Skin', 'Good for: Pores', 'Good for: Dullness/Uneven Texture', 'Good for: Dark spots', 'Vitamin C', 'Cruelty-Free']",Skincare,Cleansers,Toners,0,,
P458730,Refresh Scented Candle,3902,SEPHORA COLLECTION,2650,3.5,12.0,8 oz/ 226 g,Size,8 oz/ 226 g,,,18.0,,9.0,0,0,0,0,1,,Fragrance,Candles & Home Scents,Candles,0,,
P427318,Oily Scalp Treatment,6182,Moroccanoil,9291,4.5046,216.0,1.5 oz/ 45 mL,Size,1.5 oz/ 45 mL,,"['Aqua/Water/Eau, Propanediol, Argan Oil Polyglyceryl-6 Esters, C12-15 Pareth-12, Butylene Glycol, Argania Spinosa (Argan) Kernel Oil, Lavandula Hybrida Oil, Zingiber Officinale Root Oil, Apigenin, Oleanolic Acid, Biotinoyl Tripeptide-1, Sodium Cocoyl Hydrolyzed Wheat Protein, Xanthan Gum, PPG-26-Buteth-26, Propylene Glycol, PEG-40 Hydrogenated Castor Oil, Citric Acid, Sodium Chloride, Coconut Acid, Hydrolyzed Wheat Protein, Chlorphenesin, Imidazolidinyl Urea, CI 19140 (Yellow 5), CI 16035 (Red 40), Linalool.']",40.0,,,0,0,0,0,0,"['All Hair Types', 'Good for: Oily Scalp']",Hair,Hair Styling & Treatments,Scalp Treatments,0,,
P473726,Smoothing Cleanser,3902,SEPHORA COLLECTION,10098,4.638,163.0,4.22 oz/ 125 mL,,,,"['Aqua (Water), Coco-Glucoside, Glycerin, Cocamidopropyl Betaine, Vaccinium Myrtillus Fruit Extract, Xanthan Gum, Saccharum Officinarum (Sugarcane) Extract, Sodium Hydroxide, Salicylic Acid, Sodium Chloride, Sodium Benzoate, Chondrus Crispus (Carrageenan) Extract, Citrus Aurantium Dulcis (Orange) Fruit Extract, Citrus Limon (Lemon) Fruit Extract, Potassium Sorbate, Acer Saccharum (Sugar Maple) Extract, Aloe Barbadensis Leaf Juice Powder, Anthemis Nobilis Flower Extract, Citric Acid.']",12.0,,,0,0,0,0,1,"['Good for: Dullness/Uneven Texture', 'Good for: Pores', 'Clean + Planet Positive', 'AHA/Glycolic Acid', 'Salicylic Acid', 'Best for Oily, Combo, Normal Skin']",Skincare,Cleansers,Face Wash & Cleansers,0,,
P432242,Blackhead Solutions 7 Day Deep Pore Cleanse & Face Scrub,1254,CLINIQUE,24438,4.1125,569.0,4.2 oz/ 125 mL,Size,4.2 oz/ 125 mL,,"['Water, Kaolin, Glycerin, Butylene Glycol, Magnesium Aluminum Silicate, Glyceryl Stearate, Peg-100 Stearate, Silica, Sodium Lauroyl Sarcosinate, Allyl Methacrylates Crosspolymer, Gentiana Lutea (Gentian) Root Extract, Laminaria Saccharina Extract, Sucrose, Acetyl Glucosamine, Caprylyl Glycol, 1,2-Hexanediol, Tocopheryl Acetate, Sodium Hydroxide, Xanthan Gum, Disodium Edta, Phenoxyethanol, Titanium Dioxide (Ci 77891), Blue 1 (Ci 42090), Yellow 5 (Ci 19140).']",26.5,,,0,0,0,0,0,,Skincare,Cleansers,Exfoliators,0,,
P479496,Potentialiste Hydrating & Soothing Scalp Serum,6259,Kérastase,0,,,3.04 oz/ 90 mL,Size,3.04 oz/ 90 mL,,"['Aqua/Water/Eau, Alcohol Denat., Bifida Ferment Lysate, Ascorbyl Glucoside, Aminomethyl Propanol, Peg-40 Hydrogenated Castor Oil, Carbomer, Mannose, Polysorbate 21, Alpha-Glucan Oligosaccharide, Phenoxyethanol, Glycerin, Pentylene Glycol, Polymnia Sonchifolia Root Juice, Faex Extract/Yeast Extract/Extrait De Levure, Sodium Benzoate, Maltodextrin, Limonene, Geraniol, Hexyl Cinnamal, Benzyl Benzoate, Benzyl Alcohol, Lactobacillus, Linalool, Citral, Parfum/Fragrance. C258427/1.']",58.0,,,0,0,0,0,1,"['Unisex/ Genderless Scent', 'Hydrating', 'Fresh Scent', 'All Hair Types', 'Good for: Flaky/Dry Scalp', 'Good for: Oily Scalp']",Hair,Hair Styling & Treatments,Scalp Treatments,0,,
P404797,Matte Cream Bronzer Stick,6134,MILK MAKEUP,221334,3.9843,1658.0,0.19 oz / 5.7 g,Color,Blitzed,deep bronze,"['Ricinus Communis (Castor) Seed Oil, C12-15 Alkyl Benzoate, Helianthus Annuus (Sunflower) Seed Oil, Helianthus Annuus (Sunflower) Seed Wax, Coconut Alkanes, Silica, Candelilla Cera/Euphorbia Cerifera (Candelilla) Wax/Cire de Candelilla, Kaolin, Mangifera Indica (Mango) Seed Butter, Citrus Aurantium Dulcis (Orange) Peel Wax, Prunus Armeniaca (Apricot) Kernel Oil, Coco-Caprylate/Caprate, Bis-Stearyl Dimethicone, Fragrance (Parfum), Hydrogenated Vegetable Oil/Huile Végétale Hydrogénée, Isopropyl Titanium Triisostearate, Tocopheryl Acetate, Sorbitan Tristearate, Iron Oxides (CI 77491, CI 77492, CI 77499).']",24.0,,,0,1,0,0,1,"['Vegan', 'Cream Formula', 'Clean at Sephora', 'Matte Finish', 'Without Parabens', 'Cruelty-Free']",Makeup,Cheek,Bronzer,4,24.0,24.0
P454828,Sunkissed Hibiscus Eau de Parfum Travel Spray,7025,NEST New York,12472,4.2291,275.0,0.27 oz/ 8 mL,Size + Concentration + Formulation,0.27 oz/ 8 mL,,"['Alcohol Denat., Fragrance (Parfum), Water/Aqua/Eau, Ethylhexyl Methoxycinnamate, Butyl Methoxydibenzoylmethane, Ethylhexyl Salicylate.']",30.0,,,0,0,0,0,0,,Fragrance,Women,Rollerballs & Travel Size,0,,
P500310,Frizz Block Humidity Proof Smoothing Spray,6304,Virtue,3051,4.675,40.0,5 oz / 150 mL,Size,5 oz / 150 mL,,"['Aqua (Water, Eau), Disiloxane, Propanediol, Glycerin, Saccharomyces Cerevisiae Extract, Dicaprylyl Ether, Keratin, Panthenol, Caesalpinia Spinosa Fruit Extract, Helianthus Annuus (Sunflower) Sprout Extract, Oryza Sativa (Rice) Bran Extract, Helianthus Annuus (Sunflower) Seed Oil, Salvia Hispanica Seed Extract, Tocopherol, Xylitol, Trehalose, Rosmarinus Officinalis (Rosemary) Leaf Extract, Camellia Sinensis Leaf Extract, Oryza Sativa (Rice) Seed Protein, Oryza Sativa (Rice) Extract, Decyl Glucoside, Parfum (Fragrance), Glyceryl Oleate, Ethylhexylglycerin, Leuconostoc/Radish Root Ferment Filtrate, Sodium Dilauramidoglutamide Lysine, Sodium Phytate, Galactoarabinan, Maltodextrin, Phytic Acid, Gluconolactone, Caprylyl Glycol, Calcium Gluconate, Phenoxyethanol, Citric Acid, Benzoic Acid, Sodium Hydroxide, Sodium Phosphate, Sodium Benzoate, Linalool.']",44.0,,,0,0,1,0,0,"['Good for: Damage', 'Good for: Color Care', 'Heat Protection', 'Good for: Frizz', 'UV Protection', 'Alcohol Free']",Hair,Hair Styling & Treatments,Hair Styling Products,0,,
P431168,No.09 Vallée de Farney Eau de Parfum,6250,Maison Louis Marie,4445,4.5217,23.0,1.7 oz/ 50 mL,Size,1.7 oz/ 50 mL,,"['Rose Hibiscus Coconut Water Hydrating Face Mist:', 'Water, Aloe Barbadensis Leaf Water, Rosa Damascena Flower Water, Hamamelis Virginiana (Witch Hazel) Flower Water, Leuconostoc/Radish Root Ferment Filterate, Hibiscus Sabdariffa Flower Extract, Cocos Nucifera (Coconut) Water, Melia Azadirachta Flower Extract, Coccinia Indica Fruit Extract (Neer Sikkappu Red).', 'Prism Exfoliating Glow Potion:', 'Aloe Barbadensis (Aloe Vera) Leaf Juice, Sodium Hyaluronate, Rosa Damascena (Rose) Flower Water, Glycerin, Malus Fructus (Apple) Extract, Leuconostoc/Radish Root Ferment Filtrate, Populus Tremuloides (Aspen) Bark Extract, Salix Nigra (Willow) Bark Extract, Terminalia Ferdinandiana Fruit Extract (Kakadu Plum), Vaccinium Myrtillus, (Bilberry) Extract, Saccharum Officinarum (Sugar Cane) Extract, Acer Saccharum (Sugar Maple) Extract, Citrus Aurantium Dulcis (Orange) Fruit Extract, Citrus Limon (Lemon) Fruit Extract.', 'Pink Cloud Rosewater Moisture Créme:', 'Water, Aloe Barbadensis (Aloe Vera) Leaf Juice, Helianthus Annuus (Sunflower) Seed Oil, Isoamyl Laurate, Rosa Damascena (Rose) Flower Water, Glyceryl Stearate Citrate, Cetearyl Alcohol, Glyceryl Caprylate, Populus Tremuloides (Aspen) Bark Extract, Aleurites Moluccana (Kukui) Nut Oil, Propanediol, Myrothamnus Flabellifolia Extract, Ascorbic Acid, Citric Acid, Glycerin, Cetearyl Alcohol, Cocos Nucifera (Coconut) Extract, Butyrospermum Parkii (Shea) Nut Butter, Oryza Sativa (Rice) Seed Extract, Camellia Sinensis (White Tea) Leaf Extract, Sodium Hyaluronate, Melia Azadirachta Flower Extract, Corallina Officinalis Extract, Coccinia Indica Fruit Extract, Melia Azadirachta Leaf Extract, Solanum Melongena (Eggplant) Fruit Extract, Aloe Barbadensis Flower Extract, Ocimum Sanctum Leaf Extract, Curcuma Longa (Turmeric) Root Extract, Rosmarinus Officinalis (Rosemary) Leaf Extract, Sclerotium Gum, Rosa Damascena (Rose) Flower Oil, Xanthan Gum, Sodium Phytate, Alcohol, Sodium Anisate.']",93.0,,,0,0,0,0,0,"['Woody & Earthy Scent', 'Clean + Planet Positive', 'Vegan', 'Without Phthalates']",Fragrance,Women,Perfume,0,,
P501018,LOVEFEST BURNING CHERRY | 48,6745,KAYALI,37609,3.8703,424.0,3.4 oz / 100 mL,Size + Concentration + Formulation,3.4 oz / 100 mL eau de parfum spray,,"['Sd Alcohol 40-B/Alcohol Denat., Fragrance/Parfum, Water/Aqua/Eau, Citral, Citronellol, Coumarin, Eugenol, Geraniol, Hydroxycitronellal, Isoeugenol, Limonene, Linalool, Anise Alcohol, Benzyl Alcohol, Benzyl Benzoate, Benzyl Cinnamate, Benzyl Salicylate. 70%']",125.0,,,0,0,0,0,1,"['Vegan', 'Unisex/ Genderless Scent', 'Layerable Scent', 'Warm &Spicy Scent', 'Woody & Earthy Scent', 'Cruelty-Free']",Fragrance,Women,Perfume,2,89.0,25.0
P404358,Reserve - Rain,5673,CLEAN RESERVE,13370,4.2595,131.0,3.4 oz/ 100 mL,Size + Concentration + Formulation,3.4 oz/ 100 mL,,"['Alcohol Denat., Fragrance, Water, glycerin, Aloe Barbadensis Leaf Juice, Phenoxyethanol, Hydroxycitronellal, Butylphenyl Methylpropional, Citral, Farnesol, Cinnamal.']",110.0,,,0,0,0,0,1,"['Vegan', 'Without Phthalates', 'Gluten Free']",Fragrance,Women,Perfume,1,29.0,29.0
P34908923,Killawatt Foil Freestyle Highlighter,6200,Fenty Beauty by Rihanna,104926,4.705,600.0,2 x 0.12 oz/ 3.5 g,Color,7daywknd/ Poolside,metallic orchid/ metallic violet,"['7daywknd:', 'Mica, Dimethicone, Polyglyceryl-2 Triisostearate, Synthetic Fluorphlogopite, Triethylhexanoin, Isododecane, Polyethylene, Magnesium Myristate, Phenoxyethanol, Silica, Trimethylsiloxysilicate, Tin Oxide, Water,  Aluminum Powder (Ci 77000), Titanium Dioxide (Ci 77891), Bismuth Oxychloride (Ci 77163), Carmine (Ci 74570), Iron Oxides (Ci 77499, Ci 77491).', 'Poolside:', 'Mica, Dimethicone, Isododecane, Polyglyceryl-2 Triisostearate, Triethylhexanoin, Polyethylene, Magnesium Myristate, Phenoxyethanol, Trimethylsiloxysilicate, Water, Titanium Dioxide (Ci 77891), Bismuth Oxychloride (Ci 77163), Carmine (Ci 74570), Ferric Ferrocyanide (Ci 77510).']",40.0,,,0,0,0,0,0,,Makeup,Face,Highlighter,4,40.0,40.0
P87788965,Gentle Makeup Remover Wipes,6332,MAKEUP BY MARIO,3877,3.0,20.0,25 wipes,Size,25 wipes,,"['Water, Benzyl Alcohol, Glycerin, Pyrus Malus (Apple) Fruit Extract, Caprylic/CapricTriglyceride, Caprylyl/Capric Glucoside, Potassium Sorbate, Sodium Benzoate,Aloe Barbadensis Leaf Extract, Chamomilla Recrutita (Matricaria) Flower Extract,Cucumis Sativus (Cucumber) Fruit Extract, Althaea Officinalis Root Extract, AvenaSativa (Oat) Kernel Extract, Sodium Lauroyl Sarcosinate, Phytic Acid, Lactic Acid,Sodium Citrate.']",15.0,,,0,0,0,0,1,,Makeup,Accessories,Makeup Removers,0,,
P481176,24hr Lash Care Kit,7064,Velour Lashes,2495,4.063,127.0,,,,,"['Pretty Big Deal Mascara:', 'Aqua, Acrylates/Ethylhexyl Acrylate Copolymer, Ci 77499,  Glycerin, Alcohol, Glyceryl Stearate Se, Dimethicone, Vp/Eicosene Copolymer, Copernicia Cerifera Wax, Butyrospermum Parkii Butter, Ricinus Communis Seed Oil, Stearic Acid, 1,2-Hexanediol, Acacia Senegal Gum, Acrylates Copolymer, Biotin, Biotinoyl Tripeptide-1, Caprylyl Glycol, Citric Acid, Disodium Carboxyethyl Siliconate, Ethylhexylglycerin, Hydroxyacetophenone, Laureth-21, Myristic Acid, Myristoyl Pentapeptide-17, Palmitic Acid, Panthenol, Sodium Hyaluronate, Sodium Phytate, Tocopherol, Tromethamine, Withania Somnifera Root Extract, Benzoic Acid, Phenoxyethanol, Sodium Benzoate, Sodium Dehydroacetate.', 'Long & Strong Lash Serum:', 'Water, Glycerin, Butylene Glycol, Panthenol, Sodium Citrate, Leuconostoc/Radish Root Ferment Filtrate, Polysorbate 20, Gluconolactone, Caprylyl Glycol, Propylene Glycol, Dextran, Sodium Benzoate, Panax Ginseng Root Extract, Vitis Vinifera (Grape) Seed Extract, Ethylhexylglycerin, Sodium Pca, Sodium Lactate, Chamomilla Recutita (Matricaria) Flower Extract, Tocopheryl Acetate, Triethanolamine, Yeast Extract, Arginine, Hydrolyzed Glycosaminoglycans, Aspartic Acid, Acetyl Tetrapeptide-3, Trifolium Pratense (Clover) Flower Extract, Hydroxyethylcellulose, 1,2 Hexanediol, Pca, Sodium Benzoate, Phenoxyethanol, Hexylene Glycol, Arctostaphylos Uva Ursi Leaf Extract, Magnesium Ascorbyl Phosphate, Alanine, Benzoic Acid, Calcium Gluconate, Glycerin, Myristoyl Hexapeptide-16, Myristoyl Pentapeptide-17, Octapeptide 2, Serine, Valine, Sodium Hyaluronate, Disodium Edta, Glycine Soja(Soybean) Oil, Isoleucine, Proline, Threonine, Sodium Metabisulfite, Hydrogenated Phosphatidylcholine, Histidine, Phenylalanine, Sodium Oleate, Glyoxal.']",30.0,36.0,,0,0,0,0,0,"['Vegan', 'Long-wearing', 'Lengthening', 'Without Parabens', 'Without Sulfates SLS & SLES', 'Cruelty-Free']",Makeup,Value & Gift Sets,,0,,
