Unnamed: 0,author_id,rating,is_recommended,helpfulness,total_feedback_count,total_neg_feedback_count,total_pos_feedback_count,submission_time,review_text,review_title,skin_tone,eye_color,skin_type,hair_color,product_id,product_name,brand_name,price_usd
594275,5206987927,5,1.0,1.0,10,0,10,2020-05-01,"This product is amazing. I love the lavender essential oil smell, especially right before bed because it totally relaxes you. It is an oily texture, however, it is fully absorbed by the morning, and my face just looks brighter and smoother by the next day.",Love this,fair,brown,combination,black,P445951,Midnight Recovery Concentrate Moisturizing Face Oil,Kiehl's Since 1851,30.0
311826,22180134900,4,1.0,,0,0,0,2021-08-31,"I was very excited to receive this product complimentary and I am really enjoying it! It’s light, refreshing, and leaves the skin plump and bright! Perfect for underneath makeup! It gets slightly tacky without being too sticky, and doesn’t have a heavy fragrance! Definitely recommend!",Love it!,light,green,normal,brown,P415771,The Essence Skincare Boosting Treatment,Tatcha,110.0
485200,22227672606,3,1.0,,0,0,0,2023-01-24,"I really like that this product comes separate in a powder and a liquid to extend the shelf life! Vitamin C as an active is known to go bad relatively quickly, so I think having it separated out is a great idea. This product feels really lightweight. I haven’t noticed a huge difference in my skin yet (as expected), but I’m excited to keep trying this!",,,brown,normal,black,P400259,C-Firma Fresh Vitamin-C Day Serum,Drunk Elephant,78.0
35047,9113419496,5,,1.0,1,0,1,2017-02-16,Was having major issues with some type of dermatitis on my face. Spent big bucks on other products which never helped and also burned really bad. Since using this product the dermatitis has cleared up. It also absorbs fast so you can apply makeup afterwards.,Great Stuff,,,normal,,P248407,Ultra Repair Cream Intense Hydration,First Aid Beauty,38.0
374110,2202276434,5,1.0,,0,0,0,2020-07-27,Love the smell of these products. It really wakes me up in the morning. The scrub exfoliates and brightens. It’s not abrasive or rough on your skin. Your skin looks brighter after one use. I would recommend,Brightens and Refreshes,fair,blue,combination,blonde,P456213,GOOPGLOW Microderm Instant Glow Exfoliator,goop,125.0
28288,2210074219,5,,,0,0,0,2013-07-10,"Loves this! I like to add a couple drops with other face products I’ll be using depending on what I’m doing at the time of the day. It being organic, PLUS(:",,,,,,P218700,100 percent Pure Argan Oil,Josie Maran,49.0
452863,22114009615,5,1.0,,0,0,0,2020-01-04,"This fresh lotus night cream really is a DREAM. It is thick, dreamy, and smells very fresh and clean without a lingering scent. The cream goes on smoothly without any residue. It is the perfect amount of thickness/creaminess that leaves you saying “ahhhhhh” after application",This really is a dream night cream,lightMedium,brown,normal,blonde,P440312,Lotus Anti-Aging Night Moisturizer,fresh,56.0
126803,11645877476,5,1.0,1.0,2,0,2,2021-05-25,Yess!! These are going to save you honestly from that angry pimple. There are others that are similar and work just as good but if you haven’t tried any and want to know what the hype is about buy them you’ll be amazed when you wake up in the morning!,"Angry pimple at night, ready pimple by morning!",lightMedium,brown,normal,brown,P421275,Salicylic Acid Acne Healing Dots,Peace Out,19.0
259056,2733411453,5,,,0,0,0,2012-03-01,I have very dry and chapped lips. I always bite it off and make it bleed. I got this small size from sephora as a birthday gift and felt in love with it! Now I don’t have dry lips anymore and my lipsticks go on very pretty. I just put in on at night and in the morning. Sometimes during the day if I feel like its drying out.,Very moisturizing,lightMedium,,dry,,P302103,Sugar Advanced Lip Balm Intense Hydration Treatment,fresh,28.0
184336,1315541530,5,1.0,,0,0,0,2020-07-26,"I started using this a little over a week ago and I love the way it feels on my skin. It’s thin and feels clean going on. It smells clean and fresh. I look forward to using it two times a day. I love that it has Niacinamide in it, as I’ve heard about its benefits for aging skin. It works great and i like that it’s clean/vegan/cruelty free.","So far, I love it!",fairLight,hazel,dry,brown,P460779,Skinlongevity Long Life Herb Anti-Aging Face Serum,bareMinerals,65.0
89124,1775382695,5,1.0,1.0,12,0,12,2020-02-21,"I love this stuff, I use it every night after cleansing— before i put on any moisturizer it has tightened my pores and reduces my acne greatly! I have dry/ combo skin and this works great for me.",Holy grail skincare!,fair,brown,combination,brown,P427417,Niacinamide 10% + Zinc 1% Oil Control Serum,The Ordinary,6.0
523397,5111654652,4,1.0,,0,0,0,2020-09-16,"I LOVE this product. First off, the packaging is beautiful and the spatula is great. The smell WOW, mouth watering but NOT overwhelming. This feels like a treat for your skin. It did such a great job removing my makeup AND leaving it supple, refreshed, and moisturized. This product is easy to use and a little goes a long way. One of my favorite products for makeup removal.","Fantastic, really.",fairLight,blue,combination,blonde,P460516,Papaya Sorbet Smoothing Enzyme Cleansing Balm & Makeup Remover,Glow Recipe,32.0
192426,11950294958,4,1.0,,0,0,0,2023-01-11,"I have very dry/sensitive skin, so I was looking forward to trying this out especially after reading the reviews from others with dry skin stating that it was an excellent moisturizer. After trying this out for almost 2 weeks, I would say for me personally that this moisturizer works well as a night cream, however during the day (even on my dry skin) it looks a bit too shiny/greasy for my own personal liking. I prefer a semi-matte look though, so if you’re someone who prefers a more dewy looks + has dry skin, this may be perfect for you. I can’t imagine how it would look on more oily skin types though (I’m guessing greasy, however I can’t fully comment on that). The fragrance is ok, although I would like it more if it was fragrance-free. All in all, I’d give this a 3/5 simply because I have other night creams I prefer more + this looks too dewy/shiny on my face during the day. I am giving it 4/5 on this review however because it makes an EXCELLENT hand/cuticle cream!!",Excellent As a Hand/Cuticle Cream!,,,,,P270594,Vitamin Enriched Face Base Priming Moisturizer,Bobbi Brown,66.0
248242,24792387296,4,1.0,1.0,1,0,1,2022-04-13,I really like the balm as a first step to remove makeup and dirt. It may be a little too greasy for some but it works great for my drier skin. But I would definitely use a double cleanse with this product,,fair,hazel,normal,auburn,P478030,Mini Oat Cleansing Balm,The INKEY List,5.99
570739,7491663351,5,1.0,,0,0,0,2018-08-14,Great product I have really seen and felt a big difference on my skin. It leaves my skin feeling hydrated and soft. This product was given to me by Influenster to try out and give my honest review.,Great Serum,mediumTan,brown,dry,black,P434545,Glow Cycle Retin-ALT Power Serum,OLEHENRIKSEN,60.0
391378,5024544198,5,1.0,0.800000011920929,5,1,4,2020-05-14,This product easily glides on and leaves my skin with the perfect glow.,Perfect Product,fair,brown,combination,auburn,P456218,Glowscreen Sunscreen SPF 40 PA+++ with Hyaluronic Acid + Niacinamide,Supergoop!,38.0
265782,1351691921,5,1.0,,0,0,0,2021-06-10,Luxe product! I love this essence! It soothes your soon after cleansing and absorbs easily. It makes your akin ready for serums and moisturizer. I love it!,Luxe product!,light,green,normal,brown,P426183,Mini Facial Treatment Essence (Pitera Essence),SK-II,99.0
232621,6951194458,2,0.0,0.2142859995365142,14,11,3,2022-03-14,For the night I love under make up I HATE it piles up and look weird like if my skin were peeling but it’s just the lotion under it looks terrible,no no no,lightMedium,brown,combination,brown,P441101,The Dewy Skin Cream Plumping & Hydrating Moisturizer,Tatcha,70.0
42996,2042343620,5,1.0,,0,0,0,2019-08-30,I used the Dr. Dennis Gross - Alpha Beta Extra Strength Daily Peel about 2x a week and I can see a small difference in how clear my skin it. It did lightened my dark spots and I can see my current pimples decreasing in size. My skin is brighter and I’m excited to continue this treatment to see if a long-term use can clear up my skin.,,lightMedium,hazel,combination,black,P269122,Alpha Beta Extra Strength Daily Peel Pads,Dr. Dennis Gross Skincare,92.0
244595,10021223698,2,0.0,,0,0,0,2023-02-25,"This cleanser is VERY thick. When I first tried to use it, I couldn’t squeeze anything out. I had to take a straw to push in the plug of oil settled at the top. With that being said, it does remove makeup exceptionally well and it smells nice! Kind of medicinal, but in a good way. I will continue to use it since it does cleanse of my makeup, but it’s a heavy product and I don’t recommend for oily skin people.",It’s okay…,light,hazel,combination,,P455364,Oat Cleansing Balm,The INKEY List,11.99
17907,1904098938,3,1.0,0.0,1,1,0,2019-06-04,So don’t get me wrong i really love this cleanser it is super soft and gentle. It kind of reminds me of the glossier milky jelly cleanser. The only thing is that it kind of has an odd scent. I can’t put my finger on it really but i don’t love it.,,light,brown,oily,brown,P7880,Soy Hydrating Gentle Face Cleanser,fresh,39.0
178752,27770582492,5,1.0,1.0,1,0,1,2021-03-14,Love this product.I brought this product a while back and it has lasted me for at least 3 to 4 months.I brought the 60ml and it has been a great add to my skin routine.I would apply it daily and could see that my skin has appeared more clearer and hydrated.,NEED TO HAVE IN YOUR FACIAL ROUTINE.,medium,brown,combination,black,P427419,Hyaluronic Acid 2% + B5 Hydrating Serum,The Ordinary,15.7
5615,6885714138,5,1.0,,0,0,0,2020-06-11,"I LOVE THIS PRODUCT! If there is one thing i recommend from Sephora, it would be this. I bought 2 extra ones because i never want to run out! I apply it every night before bed and wake up with the softest lips. I even use it as a regular chapstick. Works like charm and smells amazing!",10000% recommend!,medium,brown,combination,black,P420652,Lip Sleeping Mask Intense Hydration with Vitamin C,LANEIGE,24.0
523228,1379665740,5,1.0,1.0,1,0,1,2020-10-11,"This product is amazing! I’m not typically one to spend top dollar on cleansers; but, the idea of papaya enzymes in a cleansing balm was too enticing to pass up. I only use this on days I wear make-up and I do double cleanse but it works so well, it’s not really necessary. I am amazed at how bright and fresh my face looks after I use this. It’s also very hydrating but doesn’t feel sticky or heavy post rinse. The biggest payoff of this product is how it allows for me to miss a mask day here and there. I’m a skincare product junky and can honestly say I’ve never been so impressed by a cleansing product!!",Fresh and bright!,light,green,combination,red,P460516,Papaya Sorbet Smoothing Enzyme Cleansing Balm & Makeup Remover,Glow Recipe,32.0
173696,2344519872,5,1.0,,0,0,0,2020-08-16,"Excellent product - stays moist, very refreshing, wonderful fragrance!",My favorite facial wipes...,light,brown,combination,gray,P409800,Cleansing & Exfoliating Wipes,SEPHORA COLLECTION,3.0
134705,2096752231,5,,0.3333329856395721,3,2,1,2012-02-28,I LOVE THIS MASK! I CAN FEEL IT WORKING...SOME NIGHTS WHEN I GO TO SLEEP WITH MY MAKE UP ON :( I USE THIS MASK THE NEXT DAY AND I FEEL LIKE IT REPAIRS THE DAMAGE I JUST DID!! HAHA HIGHLY RECOMMEND!,REFRESHING,light,,oily,,P297524,Clear Improvement Active Charcoal Mask to Clear Pores,Origins,17.0
41501,1768283187,5,1.0,,0,0,0,2020-06-09,Alpha Beta Extra Strength Daily Peel by DR. Dennis Gross Skincare was great for my face. It really help nourish my face and provided a glowing effect on my face.,Great Daily Peel,mediumTan,green,dry,,P269122,Alpha Beta Extra Strength Daily Peel Pads,Dr. Dennis Gross Skincare,92.0
481631,28401890832,5,1.0,1.0,5,0,5,2021-01-30,"Great face wash, smells great, rinses cleanly, huge bottle. My fiance and I share it, so men love it too!",,fairLight,brown,dry,brown,P39274,Anti-Aging Cleansing Gel,Peter Thomas Roth,39.0
219405,1114965988,2,0.0,0.6666669845581055,6,2,4,2022-05-30,I love the texture and lightness but the product just doesn’t protect you from the sun well at all. There are much better products (at same price point!) out there that provide all day defense against sun damage. Made the mistake of taking this along as a trial during a weekend in California. Came home with mild sunburn on the face. I’ve had much longer sun exposure (up to 12 hours!) using other products (Lancôme and Dr. Brandt) and never had any redness in the face — and never had to reapply during the day!,better products out there for all day protection,light,brown,combination,black,P470255,Mini Unseen Sunscreen SPF 40 PA+++,Supergoop!,22.0
509187,7002261431,4,1.0,1.0,1,0,1,2020-01-06,"Lovely serum! I received this for Christmas from my husband after checking it out a few times but waiting for my last serum to run out. I was surprised at the texture and how it’s not oily at all. I put it on first, brush my teeth and it’s absorbed enough for me to apply my lotion. Just started using it so we will wait to see the long term effects and if it helps with my dull skin and small but visible lines.",,fair,blue,dry,brown,P442594,Ultra Glow Serum: Glow + Strengthen Vitamin C Serum,SEPHORA COLLECTION,20.0
243269,1386306943,5,,,0,0,0,2012-11-08,"This is like a professional spa visit in a bottle. NOT for folks with sensitive skin. My skin is smoother, softer, and pores seem clean...almost as if I had a facial with extraction. A bit drying/tight feeling post use so follow with a soothing moisturizer.",Delivers,,,,,P232915,ExfoliKate Intensive Pore Exfoliating Treatment,Kate Somerville,98.0
554903,23617942626,4,1.0,1.0,5,0,5,2022-01-25,"I seriously love this moisturizer! I recently started tretinoin for acne and my skin has been incredibly dry. Not only that, but because of my acne in the past, I have struggled to find a moisturizer that works for me. This stuff is gold!! I love the formula. It is definitley a good winter moisturizer for the dryer months - I have not used it during the warmer months. The only reason I give it 4 stars instead of 5 is because I find that I run out of products that come in a jar much faster than a tube. This 50ML moisturizer last me a little over a month using it morning and night.",,medium,brown,combination,brown,P463036,Honey Halo Ultra-Hydrating Ceramide Moisturizer,Farmacy,48.0
499679,6123792947,5,,1.0,2,0,2,2014-05-04,"I will never go without!!! The first time I used it (I cut in half thanks to other reviewers recommendation), I woke up the next day and was amazed at how luminous my skin looked! I would rather they just took the peach smell out but it’s no biggie.",,,,,,P114902,Goodbye Acne  Max Complexion Correction Pads,Peter Thomas Roth,48.0
196071,1552685023,5,1.0,1.0,7,0,7,2020-11-16,"A little on the pricy side but definitely worth it!! I saw a difference after just one use. My skin looked fresh, brighter, clearer and more even. Highly recommend!",wow!!!,light,brown,combination,brown,P392246,T.L.C. Framboos Glycolic Resurfacing Night Serum,Drunk Elephant,90.0
361709,1755931508,5,,0.9285709857940674,14,1,13,2016-08-11,I’ve been trying various serums/face oils over the past few months for my combo-dry/oily t-zone sensitive skin and I have to say this one is my favorite. It absorbs quicker than all the other face oils/serums I’ve used. the smell is bad but I’ve gotten used to it so I don’t notice it anymore. I just started a new birth control and woke up a few days ago with several cystic acne zits on my chin and they’ve been going down A LOT faster and I’m certain it’s because of this stuff.,Love,,,,,P410400,U.F.O. Salicylic Acid BHA Acne Treatment Face Oil,Sunday Riley,80.0
66183,1374682856,5,1.0,0.857142984867096,7,1,6,2018-08-30,"I have a hard time with cleansing balms since many have coconut oil, which breaks me out. So when I found this one I jumped at it. I have not been disappointed in the slightest! This cleansing balm is everything I hoped it would be! The smell is light and fresh and the sherbet green color doesnt hurt for the experience either. I use a pretty modest amount to get my makeup off and I never have any leftover makeup after I double cleanse. I have no desire to try another cleansing balm for the rest of my skincare addicted days!",Everything wonderful!,lightMedium,brown,combination,black,P450271,Green Clean Makeup Meltaway Cleansing Balm Limited Edition Jumbo,Farmacy,60.0
438869,5941573094,4,1.0,0.9113919734954834,79,7,72,2020-06-06,"I really enjoy using the product, but because of the price point it’s usually a “splurge” purchase. The smell is so luxurious, and the pump on the bottle is really nice. However, the biggest con to this product is how it applies. I struggle with managing to spread one pump over my entire face. It soaks in REALLY quick. So I have to speed to apply it everywhere. Like within 3 seconds of rubbing it in it disappears. It’s disappointing because since it’s so expensive, I hesitate to use more than one pump at a time. I suppose you could mix it in with a moisturizer. Even though it’s white- it doesn’t leave a cast. Definitely recommend this if you have purple area around your eyes like me. See the before and after pics!",Effective!,light,brown,combination,brown,P418346,C.E.O. 15% Vitamin C Brightening Serum,Sunday Riley,85.0
532376,5676790748,5,1.0,,0,0,0,2020-12-26,If you want Dewy skin then this is the product for you. This makes my skin look so good and makes my skin feel hydrated. I highly recommend this,Dewy skin,mediumTan,brown,combination,brown,P466155,The Dewy Serum Resurfacing and Plumping Treatment,Tatcha,89.0
208662,7703931482,5,1.0,0.857142984867096,7,1,6,2020-05-15,This stuff is amazing! I get the best results using my hands to pat it into my skin. It’s super moisturizing yet really light and smells delicious. I have normal/combination skin as well as sensitivity and hormonal acne. I use this in conjunction with the pineapple serum and banana moisturizer. My face has never looked better than it does right now. Highly recommend!,,lightMedium,hazel,normal,brown,P458219,Watermelon Glow PHA + BHA Pore-Tight Toner,Glow Recipe,34.0
289388,2025972520,4,1.0,,0,0,0,2019-12-13,"All around great cleanser. I have dry, sensitive skin but this left my skin feeling clean but not overly dried out, which is what many cleansers do. I don’t use too much makeup but this takes all of it off easily. I use every night before bed and follow it with drunk elephant creme. Comes in a large bottle that will last quite a while!",Calming Cleanser,fair,green,dry,blonde,P426836,Beste No. 9 Jelly Cleanser,Drunk Elephant,34.0
240134,5198154343,5,1.0,,0,0,0,2020-02-26,"First of all this product, it smells amazing and I love how it is gel over cream. I have very dry sensitive skin and found this product helps dramatically. I would highly recommend this to someone who’s skin is very sensitive and dry.",AMAZING,lightMedium,blue,combination,black,P456207,Greek Yoghurt Nourishing Probiotic Gel-Cream,KORRES,38.5
124115,6408678132,5,1.0,0.6000000238418579,5,2,3,2021-08-28,Amazing for physical exfoliation! It’s not too rough but you can still feel the powder when you use it. I don’t use it daily because I have sensitive skin but I love it for 2-3x a week.,,fair,hazel,dry,brown,P423688,Daily Microfoliant Exfoliator,Dermalogica,65.0
240006,6660171240,4,1.0,,0,0,0,2020-02-28,This product is a a good product. It moisturized my face except kinda burned when first applied,,light,hazel,combination,brown,P456207,Greek Yoghurt Nourishing Probiotic Gel-Cream,KORRES,38.5
589642,1505402569,5,1.0,,0,0,0,2018-02-28,I recieved this as a complimentary product from influenster to provide an honest review. I have been using this product for a month and it has been amazing. My super dry skin is so soft and firm and hydrated!. also it is not greasy.  it’s smells pretty fresh. it is not heavy. I have enjoyed it and will continue to buy.,,mediumTan,brown,dry,brown,P427397,Hydro Biotic Recovery Sleeping Mask,Dr. Brandt Skincare,54.0
507248,23932473220,4,1.0,,0,0,0,2019-10-04,"After using this product a few times over a week, my nose (where my pores look largest) looked clearer like there was less buildup inside after using",Pores clearer,light,hazel,dry,blonde,P447592,Alpha Beta Pore Perfecting & Refining Serum,Dr. Dennis Gross Skincare,68.0
446056,24772021164,4,1.0,1.0,1,0,1,2021-02-19,"I really enjoyed my Clinique Moisture Surge sample. I did not know but this company has been around since 1968 actually it was under the Estee Lauder brand. Needless to say this company has been around for a long time and they know what they are doing! As of now they have 22,000 new customers. This gel moisturizer is fragrance free no parabens is an oil-free refreshing gel cream that last 72 hours long! I enjoyed this but I will admit I did not see a big difference the only difference I did notice that my pores were smaller. And to me that’s a great thing so I will recommend this to everyone especially if you have large pores. This it’s really good for minimizing this problem. Saying this my sample was only .17 fluid ounces which in my opinion is not enough to really use it long enough to tell the difference. But I am sure that if I had used it for a long time I could have seen more of a difference. I will say that the lotion is very Cooling and has a calming effect to my skin. And I like the fact that it was not overly fragranced. The price point on this is very good! And I really do recommend this in fact I am thinking of ordering a larger size for myself! You can never go wrong with Clinique I love all of their products! I rate this at 3. And I say check it out give it a try you can order this online Through Sephora  or in-store also. Everyone that works at Sephora are awesome they are really knowledgeable and can help you choose exactly what you need for your skin care! Another little nugget if you want to check this out Clinique Moisture Surge actually hydrates 10 layers deep into your skin it helps your skin feel plump and  glowing! It also has hyaluronic acid and delivers 100 hours of hydration for your skin wow that is awesome!",New Clinique Moisture Surge,medium,blue,combination,blonde,P468351,Moisture Surge 100H Auto-Replenishing Hydrator Moisturizer,CLINIQUE,82.0
182107,7352700212,5,1.0,,0,0,0,2020-12-07,I received a sample size of the bare minerals Skinlongevity long life herb anti-aging serum and while it was difficult to formulate an opinion on the sample size I do plan on purchasing the product in the future because of the clean and effective ingredient list.,Clean beauty!,tan,brown,dry,brown,P460779,Skinlongevity Long Life Herb Anti-Aging Face Serum,bareMinerals,65.0
350744,23207278907,5,1.0,1.0,6,0,6,2020-07-09,This is really a great product for cleaning it all off at night. Gentle yet exfoliating seems to get rid of all of the impurities of the day.,Buying A Full-Sized!,light,green,combination,gray,P504615,Mini Deep Cleanse Gentle Exfoliating Cleanser,Tatcha,18.0
78862,9965592841,5,1.0,,0,0,0,2017-12-29,"The best cleanser I have used, especially in conjunction with the moisturizer. I know it’s pricey but it’s definitely worth the money. I have sensitive skin and this has helped reduced redness and I have had no break outs. I love this!",The. Best.,light,blue,combination,brown,P411387,Superfood Antioxidant Cleanser,Youth To The People,39.0
404684,8593424256,5,1.0,1.0,4,0,4,2020-11-08,"I have sensitive skin and the minimal ingredients and zero fragrance have caused no breakouts. I’ve been using this product in conjunction with the inkey list polyglutamic acid for about six months. Though I don’t want to mislead you into thinking this is an overnight miracle, I have seen improvements in the texture of my skin and it the tightness of my skin. It’s an amazing product and the price point is just phenomenal.",Wonderful!,medium,green,combination,brown,P443845,Hyaluronic Acid Hydrating Serum,The INKEY List,9.99
487100,7507377840,5,1.0,,0,0,0,2018-05-20,I’m obsessed with this serum! I see a difference in my skin tone after weeks of applying. Thanks to Influenster for giving me the opportunity to try this product!,,fairLight,brown,combination,brown,P379510,Advanced Génifique Radiance Boosting Face Serum,Lancôme,132.0
221191,1888145262,1,0.0,,0,0,0,2020-01-15,"This irritated my eyes and made it watery! I was extra careful not to put it near the eye area. Even so by midday, I am squinting and can barely open my eyes. I had to look up the ingredients list and realized I shouldn’t have used this sunscreen due to sensitive eyes.",Not for sensitive eyes,lightMedium,brown,oily,brown,P470255,Mini Unseen Sunscreen SPF 40 PA+++,Supergoop!,22.0
436391,21419405282,4,1.0,,0,0,0,2022-07-08,Recieved this as a free sample. This product glided on smooth and did not leave a film or greasy residue. I do think there was lifting especially for the bags under my eyes.,Estee lauder review,fair,blue,combination,brown,P500701,Advanced Night Repair Eye Gel-Cream,Estée Lauder,72.0
67689,23624478363,5,1.0,1.0,1,0,1,2021-06-06,"Very moisturizing without being heavy. This is good to pair with an OTC retinol or RX retinol. Unlike some creams that just sit ontop of the skin, this cream actually sinks in. I feel like it works!",Effective!,light,,combination,blonde,P427421,Protini Polypeptide Firming Refillable Moisturizer,Drunk Elephant,68.0
