Unnamed: 0,author_id,rating,is_recommended,helpfulness,total_feedback_count,total_neg_feedback_count,total_pos_feedback_count,submission_time,review_text,review_title,skin_tone,eye_color,skin_type,hair_color,product_id,product_name,brand_name,price_usd
540129,1922988006,5,1.0,,0,0,0,2019-08-19,"I have natural red pigment in my cheeks and this has been the only product I’ve tried (using it with the whole tiger grass line) that has helped reduce that redness. I love it! I use this cream at night and the gel cream in the morning and they are both perfect! They don’t clog my pores, they smell great (almost like lavender) and I’m actually seeing results. I would recommend this to anyone with dry, red toned skin, it does a great job! My skin feels moisturized and even all day when I use these products. I received this free in exchange for my open and honest review. All opinions are my own.",LOVE THIS STUFF,light,brown,dry,brown,P411539,Cicapair Tiger Grass Cream,Dr. Jart+,49.0
434893,31195362341,5,1.0,,0,0,0,2021-06-15,"Gifted by Rose, my skin is dry and need some extra moisturizer every time, when I tried this product, I automatically loved it because it lefts my skin feeling very hydrated and my skin feeling less dry than usual. It is very light weight and love how it has a light smell to it.",Great,light,brown,combination,black,P471237,Rose & Hyaluronic Acid Deep Hydration Moisturizer,fresh,46.0
338578,5553082774,4,1.0,,0,0,0,2020-10-22,I love how light this serum feels on my skin and I t doesn’t feel greasy.,Light!,lightMedium,brown,combination,brown,P461159,Estee Lauder Advanced Night Repair Synchronized Multi-Recovery Complex Serum,Estée Lauder,115.0
89727,23509337971,5,1.0,,0,0,0,2019-08-07,"I’ve had an acne scar that’s been on my face for SO long and it was so dark. after using this for 2 weeks, the scar is 80% gone. I recommend using this at night because it does dry your skin out a bit (obviously) but overall it works, just have to give it time!",,medium,,combination,,P427417,Niacinamide 10% + Zinc 1% Oil Control Serum,The Ordinary,6.0
158802,22889814866,5,1.0,,0,0,0,2019-04-09,My skin tends to be a little oily this time of year... this product helps with that and it has my skin feeling very soft.... I would highly recommend this product... it foams well and it doesn’t take a lot.. maybe a dime size amount for a great effect.. it works!!!,It works!!!!!,dark,brown,combination,black,P456412,Greek Yoghurt Foaming Cream Cleanser,KORRES,28.0
164864,2643290148,5,1.0,,0,0,0,2017-11-04,"This is an amazing moisturizer. It looks like a white cream that can be potentially heavy but when you apply it is like water on your skin. It spreads smoothly, and the skin absorbs it in no time. I apply only in the morning and my skin doesn’t dry or gets tight in the whole day. I was not happy about the price I payed thinking it wouldn’t last long but it comes with a small applicator; I don’t even scoop the cream, I just dip the applicator and dab the small amount stuck to it into my face (4 small dabs on the forehead, chin and cheeks) and it is enough. This is going to last me months! Also, no breakups so far and my skin breaks with everything! I will buy again.",So far best moisturizer I've ever tried,medium,brown,normal,black,P418218,The Water Cream Oil-Free Pore Minimizing Moisturizer,Tatcha,70.0
483845,2376540322,5,,1.0,4,0,4,2014-07-16,"I got this as a sample once, and I really liked it. I liked it so much I bought the big bottle. It smells really good and is something I look forward to using during my daily shower. I have some acne and rosacea, and it doesn’t irritate those. Also, my husband likes to use it.",Very Refreshing,,,combination,,P449599,Mini Anti-Aging Cleansing Gel,Peter Thomas Roth,12.0
169063,6310523866,5,1.0,,0,0,0,2017-10-11,"I have acne prone skin and I really love this moisturizer, it’s really hard finding a cream that won’t break me out or make my skin even more oily. Whenever I use this cream at the end of the day my face is not as oily as it is with other moisturizers. I don’t think it would work as good for people with dry skin though.",,,,,,P454794,Mini The Water Cream,Tatcha,22.0
51460,12041524161,5,1.0,,0,0,0,2019-08-15,"Love this moisturizer and use it every night. I really like that it is a gel-like formula because I have oily skin and it doesn’t feel greasy at all, just sinks into skin. Plus I love that it has no parabens. I keep buying it in the largest size possible!",Love the aqua bomb for before bed!!,light,,oily,,P394639,The True Cream Aqua Bomb,belif,38.0
555,31119756535,5,1.0,1.0,2,0,2,2022-11-23,litteraly love it. it smells so good and sweet!!! it’s like heaven in a container. it has a super smooth texture and is hydrating :),My favourite product💋💋,light,brown,normal,blonde,P420652,Lip Sleeping Mask Intense Hydration with Vitamin C,LANEIGE,24.0
205093,1322513108,3,,,0,0,0,2010-07-04,"Feels wonderfully refreshing. No idea what it is supposed to be doing, I just love the way it feels.",TexasMeg,light,,normal,,P481817,"Beauty Elixir Prep, Set, Glow Face Mist",Caudalie,49.0
322378,1373665464,4,1.0,,0,0,0,2021-08-24,"Was kindly gifted the Skinfix Barrier+ Triple Lipid-Peptide Cream is 95% naturally-derived, nutrient packed dense cream with high concentration of active ingredients such seaweed hyaluronate and lily root. Love the pump container, a small pump is more than enough for my combo skin. Definitely acts more of a night cream for my skin. I feel that this cream would be great for colder weather to keep my skin nourish, hydrate and plump. The texture of the cream appears thick but glides on like a gel cream. The product have no scent.",,fair,brown,dry,black,P479860,Mini Barrier+ Triple Lipid-Peptide Face Cream,Skinfix,20.0
36088,2349343476,5,,,0,0,0,2015-12-07,"I got this because I needed a facial moisturizer for the winter. My skin gets really dry and will sometimes have dry patches. This was shown to me, plus u had a sample from an online beauty subscription. This product is very moisturizing without being oily and you only need a little. This is my new favor cream for the winter5 stars",,,,,,P248407,Ultra Repair Cream Intense Hydration,First Aid Beauty,38.0
565378,8033018281,1,0.0,0.6363639831542969,11,4,7,2019-11-10,I really enjoy drunk elephant’s product but this one is a pass for me. I’m glad some people like this i wish i did but it definitely made my skin peel so bad to the point where my skin was peeling off none stop during the day. I had a photoshoot for a brand and the makeup artist had a hard time to make the makeup stay because everything was gliding off. It’s like if this is just too strong for me i guess but i didn’t like it. The smell is nice and the texture too though.,no no no,fair,brown,normal,brown,P439926,A-Passioni Retinol Cream,Drunk Elephant,74.0
516072,5813117711,2,0.0,0.5714290142059326,7,3,4,2021-08-25,"This would be my HG sunscreen, but the smell is so strong and makes me nauseous. The finish is great, it doesn’t make me breakout, and it leave little whitecast. That said...the smell on this NEVER GOES AWAY. I’ll put it on and 4 hours later it will still be all I can smell. It’s an herbaceous smell but something about it makes me nauseous. Sometimes it gets in my mouth, and I can’t get it out. I wish this came unscented because the price is great and I love the way it performs.",The smell...,fairLight,,dry,,P456392,Daily UV Defense Invisible Broad Spectrum SPF 36 Sunscreen,innisfree,16.0
349688,6094009786,5,1.0,,0,0,0,2018-08-28,I love this cleanser,,deep,brown,combination,black,P427536,The Deep Cleanse Gentle Exfoliating Cleanser,Tatcha,40.0
297717,6588680265,3,,,0,0,0,2015-04-03,It is a great product for after playing sports and sweating! I recommend cutting them in half for bigger bang for your buck. It isn’t necessary to use them all the time though.,,,,,,P278317,Facial Radiance Pads,First Aid Beauty,36.0
272575,5360800539,3,0.0,,0,0,0,2017-10-10,"I’m a young college student with oily, combo, sensitive skin. I think this product moisturizes really well and brightens up my skin. And as also it takes time for dark spots on your skin to go away. I don’t think this would be my go-to product to fade away dark spots. I personally think this product is extremely expensive for its hydration and brightening aspects. It did not clog my pores!* I’m reviewing the product as part of a contest, and don’t forget to check off the box that you received a free sample.",,lightMedium,brown,oily,black,P94421,Vinoperfect Radiance Dark Spot Serum Vitamin C Alternative,Caudalie,82.0
66944,5189164151,5,1.0,,0,0,0,2017-11-05,This is my favorite cleansing balm and have been using it daily for at least 6 months now. There’s no scent that I can discern. It melts away all my makeup. The formula is moisturizing without making me feel greasy. My skin never feels tight after using this. This is a stellar product!,my fave cleansing balm!,light,brown,combination,brown,P450271,Green Clean Makeup Meltaway Cleansing Balm Limited Edition Jumbo,Farmacy,60.0
109251,1505402718,5,1.0,1.0,8,0,8,2020-01-17,"as a very pink person, i’ve never found any color corrector to do much of anything until i tried this product. it works like a dream",,fair,blue,combination,blonde,P471546,Mini Cicapair Tiger Grass Color Correcting Treatment SPF 30,Dr. Jart+,21.0
535184,1406151983,5,,,0,0,0,2014-05-05,I use these wipes once a week and noticed an immediate improvement with the texture of my skin - so smooth.,Love it!,,,,,P377533,Alpha Beta Universal Daily Peel Pads,Dr. Dennis Gross Skincare,92.0
563851,23256952046,5,1.0,1.0,1,0,1,2019-08-08,I ENJOYED THIS PRODUCT SO MUCH. IT FELT SO GOOD TO APPLY AND KEPT MY SKIN MOISTURIZED ALL DAY LONG!  I WILL BE BUYING AGAIN,,deep,brown,combination,black,P446421,Clear Improvement Pore Clearing Moisturizer with Salicylic Acid,Origins,40.0
146076,10688134122,5,1.0,,0,0,0,2019-11-06,"Great for bags and dark circles under the eyes. Doesn’t leave my skin too oily, but instead hydrates and gives it a glow.",Great Product,mediumTan,brown,combination,brown,P480630,Mini Jet Lag Mask,Summer Fridays,26.0
399736,23186728196,5,1.0,,0,0,0,2021-12-28,I received a free sample of Clinique’s new Smart Clinical Repair in the mail last week. As soon as I began to use it I saw an immediate difference in my skin and I LOVE IT! It’s texture is light and very moisturizing. Taking care of my skin has always been important to me. Over time I’ve realized the importance of using products that support collagen especially under the eyes for long term healthier skin. I will continue to use Clinique Smart Clinical Repair.,Clinique Smart Clinical Eye Repair,lightMedium,brown,combination,auburn,P479734,Smart Clinical Repair Wrinkle Correcting Eye Cream,CLINIQUE,57.0
557325,7197213384,5,1.0,,0,0,0,2019-01-31,I received this product complimentary for testing purposes and let me tell you...WHAT A GREAT PROD! Upon first application after washing and tonight my face - it was immediately revived and appears really supple and hydrated! Oh and the mild scent made me feel as if I was in a spa getting a luxury facial! After wearing the prod nightly everyday for 3 weeks I keep noticing my skin improving and appearing more radiant! I would truly give this prod a 10/10! All around great stuff and every woman should include it in her skincare routine!,JUICY SKIN!!!!,deep,brown,dry,black,P439055,GENIUS Sleeping Collagen Moisturizer,Algenist,98.0
57440,20865879438,5,1.0,1.0,2,0,2,2020-04-21,"This is the best remover I have ever used ... it does not leave my face or eyes oily or have a film over top .. it removes all my makeup even my waterproof mascara and no break outs on my face ... whatever the ingredients are, the makeup just melts off, no scrubbing just a wipe or two and its gone ... definitely get this and you won’t be disappointed...",LOVE IT,light,hazel,combination,brown,P417238,Green Clean Makeup Removing Cleansing Balm,Farmacy,36.0
563115,27544917120,4,1.0,,0,0,0,2021-01-10,"Been using this for 2 weeks now, added it into my routine, using it every 2 days. I am stoked that OLEHENRIKSEN gave me this to try. I love how after you use the product you get that refreshed feeling and it smells soo good! It’s just like other exfoliators, except this one actually leaves your face nice and smooth without that drying effect.",Refreshed!,lightMedium,brown,combination,black,P466142,Lemonade Smoothing Scrub,OLEHENRIKSEN,35.0
529519,31168522732,5,1.0,0.0,1,1,0,2021-03-31,"This was gifted by Glow Recipe. I put some on the back of my hand that was very dry with visible dryness. This serum was such a nice, light, milky texture. It smoothed over my skin quickly and absorbed fully with no leftover residue. It visibly erased the dryness and left my skin so soft and hydrated and this lasted for hours which was amazing when typically even with moisturizers my skin is dry again several hours later.",,fair,blue,dry,blonde,P470529,Avocado Soothing Skin Barrier Serum with Ceramides,Glow Recipe,45.0
281931,2835329069,4,,,0,0,0,2013-11-14,They are so soft. I really like how soft they are. I only use them for toner and try are big enough to cut and they are also stretchy,so soft,,,,,P173726,Facial Cotton,Shiseido,13.0
515407,23066262330,5,1.0,1.0,2,0,2,2023-03-08,I never write reviews but this sunscreen is fantastic. So light and doesn’t clog my pores at all. The smell is not overpowering - highly recommend.,Best sunscreen,tan,brown,combination,black,P456392,Daily UV Defense Invisible Broad Spectrum SPF 36 Sunscreen,innisfree,16.0
319267,5483790555,2,0.0,0.1428570002317428,7,6,1,2021-04-08,"I found this cleanser has too much hydrating properties, and it doesn’t cleanse the skin very well. I feel Oily a few hours after usage. I’ll be returning this item.",not worth it.,lightMedium,brown,combination,black,P461537,The Rice Wash Skin-Softening Cleanser,Tatcha,40.0
252553,2285673683,5,1.0,,0,0,0,2018-01-07,Love this moisturizing eye cream! Feels like silk and hydrated my skin! I definitely recommend this.  I received this product complimentary for sampling purposes.,,medium,brown,oily,brown,P422905,Moisturizing Eye Bomb with Squalane,belif,48.0
229127,8807745457,5,1.0,,0,0,0,2019-06-09,"this thing works 10x than the mario one it leaves a strong smell that other people do notice but nothing too bad , i highly recommend",LIFE SAVER,lightMedium,brown,oily,brown,P232903,EradiKate Acne Treatment,Kate Somerville,28.0
349401,11096056683,5,1.0,0.0,1,1,0,2019-02-12,Love this! makes you face soft and feels so clean,,lightMedium,brown,dry,black,P427536,The Deep Cleanse Gentle Exfoliating Cleanser,Tatcha,40.0
283499,975027824,4,1.0,,0,0,0,2022-08-31,"This is a very luxurious cream that is not too heavy. It left my skin feeling smooth and silky. It has a very mild scent, nothing overpowering and seemed to not interfere with my other skincare products.",,lightMedium,brown,combination,black,P479839,Revitalizing Supreme+ Youth Power Creme Moisturizer,Estée Lauder,98.0
600477,26691842644,5,1.0,,0,0,0,2022-06-30,"Fresh gifted me their Sugar Lip Balm in Rose shade.. Lip balm is not only part of my skincare routine but part of my everyday life.. I have a dry lips, living in dry and hot state here in Arizona.. Im using lip balm 6-10 times a day to moisturized my lips.. But using this sugar lip balm by fresh I can use it in just few times a day coz my lips stays hydrated long enough than my old brand..  I also like that it comes in buildable shade so that I can hide the pale color of my lips.. My lips are not only hydrated but also softer, looks healthy and kissable..",Love this lip balm,lightMedium,brown,dry,black,P500777,Sugar Lip Balm Hydrating Treatment,fresh,25.0
581380,25388692520,4,1.0,1.0,1,0,1,2021-08-24,"This Guerlain Abeille Royale Advanced Youth Watery Oil is pretty impressive. It is SO beautifully bottled, with these small golden honey capsules in it. It seems to plump my skin and tighten it up. I do think it takes more than the 3-4 drops it mentions, I used 6’-8 and pat all around before rubbing it in gently. It doesn’t feel “oily“, but it does have a little stickiness to it if you aren’t putting anything else on after it. The scent is nice, BUT a little more perfume-y than I would think it would be. It doesn’t last long enough to be annoying though!  Overall I am so thankful #influenster sent me this to review and I have seen it improve my skin’s firmness, I will continue using it.","Beautiful bottled, doesn't feel like an oil",light,hazel,combination,brown,P476513,Mini Abeille Royale Advanced Youth Watery Oil,GUERLAIN,55.0
17066,2640398670,5,1.0,1.0,2,0,2,2020-05-01,Love the texture. Does not strip away my oils for that ’squeaky’ clean. My skin feels so nice afterwards.,,fair,brown,combination,black,P7880,Soy Hydrating Gentle Face Cleanser,fresh,39.0
391918,6252411204,5,1.0,1.0,1,0,1,2020-08-26,"I purchased the Trendmood x Tatcha Takeover box and let me tell you, Im glad I did!! I received this product in the box and boy have I been missing out. It is so light and refreshing and doesn’t make my skin feel weighted down.",Tatcha Meets Trendmood,deep,brown,combination,black,P399623,Luminous Dewy Skin Mist,Tatcha,49.0
478636,9170142190,2,1.0,0.9230769872665404,13,1,12,2020-04-23,"I chose this product as a sample since I read a lot of good stuff about it and when I read the ingredient list I was pleased by at. DISCLAIMER: I do have very sensitive skin. The first time I applied it to my skin it did great things. I waited three days to put it on a second time (I always do this with new products since it takes around that time for the skin to get used to it.) The morning after the second application, my skin texture was irritated and there was a small chemical burn on my skin. My skin usually has a weird texture and is irritated if I use something too strong but the chemical is new. Needless to say if you have sensitive skin I wouldn’t recommend, unless if you wanna try it out to see for yourself. If you are looking for a soft AHA serum, the Honeymoon glow from Farmacy is good. It does have a stronger % of AHA but I find it to be more delicate on the skin.",BE CAREFUL IF YOU HAVE SENSITIVE SKIN,medium,brown,dry,brown,P439058,Violet-C Brightening Serum 20% Vitamin C + 10% AHA,Tatcha,89.0
276125,13056746354,5,1.0,,0,0,0,2019-07-12,"The price is RIGHT! My skin feels silky smooth, hydrated and looks bright after I use this. My skin soaks this baby up and loves it. It’s a big bottle and will last a long time. I love it!",VERY HAPPY,deep,brown,dry,brown,P427406,Glycolic Acid 7% Exfoliating Toning Solution,The Ordinary,13.0
128962,5929993536,4,1.0,0.0,1,1,0,2019-05-24,"These acne healing dots do have visible results, though a pimple won’t magically disappear overnight. Upon application, I noticed reduced pimple size and redness. Since there are only 20, I recommend using them on the most obvious pimples first.",Somewhat effective,lightMedium,brown,normal,brown,P421275,Salicylic Acid Acne Healing Dots,Peace Out,19.0
298892,7592171935,2,0.0,1.0,6,0,6,2020-08-21,"This serum was sold to me as something that would help hydrate my skin. After I use a face wash and a mild toner, I use one small pump on still damp skin and massage all over my face. I leave it on for about 10 minutes to soak in before I moisturize.This serum does not soak into my skin well, with or without toner. It feels like it leaves a slightly sticky surface on my skin. Additionally, 1 hour after I apply and into the next morning it actually makes my skin tight, making fine lines even more visible, and also makes me shinier. It looks horrible. It doesn’t feel hydrated, or look hydrated.I have switched to using it every 2nd or 3rd night, so the tight and shinynes has gone down, but I honesly don’t think it’s doing anything that its suppose to for my skin. I reresearched the ingredients to make sure the sales person didn’t mess up, and it looks like it should be doing what it advertises. Maybe the pineapple ceramide is forming a layer on top of my skin before even penetrating it, which is why lines are showing up more. I dont know, super dissapointing and $$$.","Made my skin tight, shiny, with more lines",light,,combination,,P406712,B-Hydra Intensive Hydration Serum with Hyaluronic Acid,Drunk Elephant,49.0
323123,25707047797,4,1.0,,0,0,0,2020-10-26,"This was gifted by Skinfix, but all opinions are my own. This is a great thick moisturizer that is great for those with sensitive dry or mature skin. I have oily skin and it was a little too thick on my skin, however, I am looking forward to using it more in the winter when it’s usually drier. I love that it didn’t cause any reactions on my skin and that there are lipid peptides in it so that it helps to prevent wrinkles and any signs of aging!!",,medium,brown,combination,black,P479860,Mini Barrier+ Triple Lipid-Peptide Face Cream,Skinfix,20.0
186704,6392963102,5,1.0,,0,0,0,2019-11-13,Love it! Keeps my lips nice and hydrated!! Not too glossy,,tan,brown,combination,black,P443563,Lip Glowy Balm,LANEIGE,18.0
427299,7219593634,5,1.0,,0,0,0,2019-08-10,The best oil cleanser I’ve ever used. Doesn’t leave residue and spreads very nicely. Also it is very gentle on the eyes.,,light,green,combination,brown,P392235,The Camellia Oil 2-in-1 Makeup Remover & Cleanser,Tatcha,50.0
90682,1777622491,5,1.0,,0,0,0,2018-01-18,I have been using this for about 5 days now. I apply it after cleansing AM and PM all over my chin and jaw area and dab the remainder on my forehead. At night I apply the azaelic acid suspension over that. Then I finish with Tarte’s Maracuja oil to seal in moisture. I have persistent hormonal acne and closed comedones all over my chin and it has already helped so much! Those closed bumps are disappearing and the texture of my skin is feeling so much softer. I will definitely be repurchasing!,Busts up deeply clogged pores!,light,hazel,combination,brown,P427417,Niacinamide 10% + Zinc 1% Oil Control Serum,The Ordinary,6.0
10487,10811688987,5,1.0,,0,0,0,2019-05-07,"Best lip mask ever!!! I have fuller lips that tend to dry up a lot. After using this lip mask, I wake up with fresh juicy lips! No over powering scent. Kind of a mild cherry chapstick scent. Instant smoothness at application.",Simply the best!,lightMedium,blue,combination,blonde,P420652,Lip Sleeping Mask Intense Hydration with Vitamin C,LANEIGE,24.0
150396,5829047153,5,1.0,,0,0,0,2018-01-12,really recommend this make up remover.  I have combination skin and it works beautifully. A little goes a long way with this product so it’ll definitely last you a while. Feels amazing on the skin and eyes and makes make up removal so satisfying.,,fair,hazel,combination,brown,P126301,Take The Day Off Cleansing Balm Makeup Remover,CLINIQUE,38.0
17189,7646741091,4,1.0,1.0,1,0,1,2020-04-10,the best cleanser!! not a huge fan of the smell but when a product works this good it’s easy to overlook!,,light,brown,dry,brown,P7880,Soy Hydrating Gentle Face Cleanser,fresh,39.0
381366,2173121190,5,1.0,1.0,3,0,3,2023-02-02,"I cannot be without this moisturizer, it’s been there for my dry and irritated tretinoin skin, and now for my dry and flaky accutane skin! It’s so soothing and leaves my skin happy!",Holy Grail,,,,,P433887,Squalane + Omega Repair Deep Hydration Moisturizer,Biossance,60.0
511091,8934770852,3,0.0,,0,0,0,2022-01-11,Pretty ordinary oil for me. It didn’t do anything significantly different but it doesn’t create any problems either.,,medium,brown,dry,black,P416563,Squalane + Vitamin C Rose Firming Oil,Biossance,74.0
373195,7241702110,5,1.0,,0,0,0,2021-05-10,My skin was so soft from using this!!  It made my skin not overly dried out or overly exfoliated.  The exfoliant is so “micro” that it gets the right amount of dead skin without being harmful.  It feels like a very luxurious and expensive product!  I would totally recommend this product!,,fair,blue,oily,brown,P456213,GOOPGLOW Microderm Instant Glow Exfoliator,goop,125.0
427693,1893911125,5,1.0,0.5,2,1,1,2018-06-26,Seriously shocking how easily makeup and eyeliner comes right off with a small dap of this oil! It’s AMAZING and makes your skin feel and look AMAZING...so completely addicting!!!,AMazingly Addicting,mediumTan,brown,normal,brown,P392235,The Camellia Oil 2-in-1 Makeup Remover & Cleanser,Tatcha,50.0
577555,6802338632,5,1.0,,0,0,0,2021-01-09,"After a a decade or so of searching, this lip mask is the only product that can keep my lips hydrated with only two applications per day, AM and PM. It also rescues lips quickly after a windy winter hike or other harshly drying activities. Bless you for this Tatcha.",Dry Lip Rescue,fair,blue,normal,brown,P453225,The Kissu Lip Mask,Tatcha,29.0
573822,23056867274,5,1.0,,0,0,0,2019-05-06,"I did receive this product for free to try. I will not be receiving this product again so my opinion is based off of my experience. First off a little goes a long waaaay!!!  I have combination skin so I think this product was great for me, the hydration was perfect because I  didn’t have an oily face after, which is a big deal breaker for me. It also leaves your face smelling AMAZING. Day 1 .My face after the application was glowing, but in the morning I felt my skin was the same as every other day. Week3: Skin again is glowing after application smells AMAZING, in the morning my skin looks and feels great, dry patches have minimizes Now the price I’m not to happy about, yes I love the product but I’m not sure yet that I’ll be willing to cough up $50 .",Love the product not the price.,medium,brown,combination,black,P442858,Rose Deep Hydration Sleeping Mask,fresh,29.0
