Unnamed: 0,author_id,rating,is_recommended,helpfulness,total_feedback_count,total_neg_feedback_count,total_pos_feedback_count,submission_time,review_text,review_title,skin_tone,eye_color,skin_type,hair_color,product_id,product_name,brand_name,price_usd
341895,5558449608,4,1.0,,0,0,0,2020-09-05,"I woke up with face felt rejuvenated and fresh after one use!  I received this for free to try, but I’ll definitely will be purchasing down the line!",Powerful punch,mediumTan,brown,combination,brown,P461160,Mini Advanced Night Repair Synchronized Multi-Recovery Complex,Estée Lauder,19.0
335312,1539092084,4,,,0,0,0,2013-11-19,I received a sample size with the Tarte 500pt kit. I have to admit I was excited about everything but this at first. Oil on my face? I had flashbacks of what I dealt with in high school...not pretty. Then I read the recent articles about how some oils are actually good for your face...maracuja being one of them. Hmmm...I gave it a go since my skin IS a bit different from my teen years. I experienced no reaction & the best thing is that it made my face feel moisturized without feeling greasy. I use this at night after my regular face-washing regimen as I have a different regimen for day (I use BB cream then and prefer not to use anything else with it). I have nothing else to report other than the this & I’ve used it for about a month. So I gave it 4 stars instead of 5. Plus it doesn’t have the best smell.,Oil on my face? YES PLEASE!,,,combination,,P376726,Maracuja Oil,tarte,48.0
32310,1426132106,3,,,0,0,0,2010-02-18,Did not notice a difference in skin or hair....,OK,,,,,P218700,100 percent Pure Argan Oil,Josie Maran,49.0
197774,1374902531,5,1.0,,0,0,0,2018-03-13,Love this as a night serum to smooth the texture of my skin. Wake up with skinceeling so soft,Love,lightMedium,blue,combination,blonde,P392246,T.L.C. Framboos Glycolic Resurfacing Night Serum,Drunk Elephant,90.0
273576,1341771017,5,,,0,0,0,2010-05-20,"I came back to the vinoperfect serum after a year of trying to find a less expensive replacement, but nothing is as effective as this product. I had a little but of discoloration from breakouts on my chin that I was afraid would not go way. The marks were from blemishes that popped up 7 months before I started using the serum again. I can honestly say that these marks have faded almost entirely after 2 months of using the serum 1 time a day. Less break outs in general, and improved tone and texture.","Great product, even if it's a little pricey",fair,,normal,,P94421,Vinoperfect Radiance Dark Spot Serum Vitamin C Alternative,Caudalie,82.0
385601,23157372821,3,1.0,0.5,4,2,2,2022-03-21,"Its definitely does not irritate the skin and helps soothe, so a night time product would be good. However, I have combo skin so I feel like during the day it doesn’t sit well under makeup.",,lightMedium,brown,combination,black,P463371,Mini Adaptogen Deep Moisture Cream with Ashwagandha + Reishi,Youth To The People,18.0
432175,10004138804,2,,,0,0,0,2017-04-09,I have very dry skin and the Sephora sales rep suggested that I get this product. While it feels very nice going on it does not keep my skin soft and hydrated. I have yet to try this product in the summer when my skin isn’t has thirsty so I am hoping it’ll work better then but I do not have very high hopes.,It's okay,,,dry,,P415701,Water Drench Hyaluronic Acid Moisturizer,Peter Thomas Roth,54.0
371774,5928490325,5,1.0,1.0,3,0,3,2021-04-03,"I use this as my highlighter after i complete my whole face. It is sticky, but it achieves the best glow. Smells GREAT! If you’re looking to spoil yourself and look bomb, get this!",SUCH GLOW,light,hazel,oily,brown,P466123,Watermelon Glow Niacinamide Dew Drops,Glow Recipe,35.0
601471,7374201988,5,1.0,,0,0,0,2022-04-30,Algenist Triple Algae Eye Renewal Balm with Multi-Peptide Is Amazing! This is a perfect everyday eye cream ! It melts into the skin fast so I like that about an eye cream I received this complimentary from Algenist,Nice,fair,brown,normal,black,P467602,Triple Algae Eye Renewal Balm Eye Cream,Algenist,68.0
13745,6639531811,5,1.0,,0,0,0,2018-04-29,"If you’re considering whether or not you should get this.. you should get this. It has replaced all of my Glossier balm dot coms and I don’t only use it at night, but during the day as well. It feels super silky on your lips, doesn’t taste bad and isn’t sticky! Any kind of dryness or texture I have on my lips is GONE by the time this balm wears off-and that takes hours if you’re not eating/drinking or rubbing your lips together. It has become a holy grail to me and I will never stop recommending it and buying it!",IF YOU'RE LOOKING FOR A SIGN- THIS IS IT.,medium,brown,combination,black,P420652,Lip Sleeping Mask Intense Hydration with Vitamin C,LANEIGE,24.0
559066,9572761281,5,1.0,,0,0,0,2022-03-07,"Love this! Wouldn’t recommend for makeup days but perfect for clean skin, no makeup days! Haven’t had any pilling like some people on here have mentioned.",,fairLight,Grey,normal,blonde,P481989,Watermelon Glow Niacinamide Sunscreen SPF 50,Glow Recipe,35.0
438438,2116782136,5,1.0,0.5,8,4,4,2022-01-30,I love this product. It makes my skin feel good. It feels smooth and not sticky like other products. It doesn’t irritate. It also has a pleasant/neutral scent.,Great serum worth the money,lightMedium,hazel,normal,brown,P418346,C.E.O. 15% Vitamin C Brightening Serum,Sunday Riley,85.0
65734,1774715250,3,0.0,,0,0,0,2018-12-14,"Smells great and leaves my skin feeling lovely, however it doesn’t seem to work with my mascara and every time I try to use it on my eye makeup, my eyesight ends up blurry for a prolonged amount of time. I will be returning this product for something more gentle around my eyes.",,light,brown,combination,brown,P450271,Green Clean Makeup Meltaway Cleansing Balm Limited Edition Jumbo,Farmacy,60.0
145581,1297518508,1,0.0,,0,0,0,2019-12-31,Literally just thick creamNot a mask so why are you called a mask?Overall useless and overrated,not a real mask,medium,brown,combination,black,P480630,Mini Jet Lag Mask,Summer Fridays,26.0
191777,1873515280,4,,,0,0,0,2009-12-23,"The formual is still as good as the original, but I guess I just love the mint that much more.",Not as great as the original,,,,,P12573,Intense Therapy Lip Balm SPF 25,Jack Black,10.0
588444,1009476897,5,1.0,,0,0,0,2022-05-25,"Love this product! I normally do not wear sunscreen unless going to the beach, though I know better. It is lightweight, moisturizing, but not greasy or shiny, and smells nice. It doesn’t smell a ike your typical sunscreen that I hate toSmell on my face, let alone daily when I am not at the beach (who wants to smell that in the winter). I can only say it’s expensive so now I will have to add another expensive product to my list.. but you get what you pay for I guess",,light,green,combination,brown,P482742,Urban Environment Fresh-Moisture Sunscreen Broad-Spectrum SPF 42,Shiseido,38.0
22682,1537330693,5,,0.8333330154418945,6,1,5,2013-08-13,"I have been using the same anti-aging face cleanser for years (by Aloette), but my skin has been a little lackluster lately. After consulting with one of Sephora’s skincare experts, I decided on this. It is amazing. A little bit goes a long way. It cleans all of the day’s dirt AND makeup off-- without making my skin feel dry. BONUS: I have SUPER sensitive skin and have NO problems using this product. Love it!",Fan-freaking-tastic,,,normal,,P7880,Soy Hydrating Gentle Face Cleanser,fresh,39.0
565038,1577364772,2,1.0,0.375,16,10,6,2020-07-21,It’s probably not fair to leave a review for a product that needs months to see results.  I started out using this twice a day every day and noticed nary a tingle.  It does not smell bad nor is it sticky (both deal breakers for me).  Either I have the skin of a rhino or this isn’t very strong.  No problems with packaging as others have reviewed.  Will probably go back to DE’s TLC Framboos Glycolic Resurfacing Night Serum.  THAT gave me wonderful results after the first night.,No irritation,light,blue,combination,brown,P439926,A-Passioni Retinol Cream,Drunk Elephant,74.0
19367,6927653176,4,1.0,,0,0,0,2017-12-21,"I first got this as a free sample sometime ago, but I actually enjoy the cleanse and it’s not too harsh on my skin. My face feels really clean after using. I have purchased the full size and do recommend this as a regular everyday cleanser.",My Go-To,lightMedium,brown,normal,brown,P7880,Soy Hydrating Gentle Face Cleanser,fresh,39.0
305250,24226103706,5,1.0,,0,0,0,2019-11-07,"This product brings miracles to your skin. After one week of use, my skin is hydrated , glowing and no breakouts. I will recommend it for sensitive skin a",A must buy,fair,brown,dry,blonde,P421996,Ultra Facial Moisturizing Cream with Squalane,Kiehl's Since 1851,78.0
306672,33607876646,5,1.0,,0,0,0,2022-02-02,I really really like it so much it hydrate my flaky skin very well and it dont smell at all which is really good for skin. i would recomment this to all of my friend to try it and get fast result by using it,love the formula,light,brown,combination,black,P422510,Mini Ultra Facial Moisturizing Cream with Squalane,Kiehl's Since 1851,24.0
125427,10991517702,5,1.0,,0,0,0,2019-10-18,"I’ve found some amazing skincare products this year, but this one takes the cake as the one product that actually changed my skin.  My dry skin feels smooth and soft, and looks SO clear.  Foundation glides on smoothly and looks so much better!  My teenage son just started using it as well, and his oily, acne-prone skin is already looking better!",New Holy Grail!,light,brown,normal,brown,P423688,Daily Microfoliant Exfoliator,Dermalogica,65.0
219754,8119489553,5,1.0,0.5714290142059326,7,3,4,2021-11-22,"For an Indian skin tone, particularly prone to hyperpigmentation, I am always looking for a sunscreen/primer to seamlessly go under or over my make-up without leaving an annoying white film. This product is perfect! It feels soft and supple and it protects my skin.",Beauty is sun-protection,medium,brown,combination,brown,P470255,Mini Unseen Sunscreen SPF 40 PA+++,Supergoop!,22.0
425876,5370275526,4,1.0,,0,0,0,2019-11-16,I’m typically dry and have sensitive skin but this moisturizer hydrates my skin very well. It absorbs well bit only gave 4 stars because it’s a thin liquid consistency and took some getting used to in applying it to my face.,,lightMedium,brown,dry,black,P446930,Cream Skin Toner & Moisturizer,LANEIGE,33.0
135209,2080988662,5,1.0,1.0,6,0,6,2021-07-09,"My holy grail. My go-to, my right hand.I have gone through several moisturizers that I loved but always something missing. I can’t even BELIF this exists, it is so so good. My skin stays feeling moisturized after I put it on, whereas most dry up a tad bit after a few hours.",,fairLight,blue,oily,blonde,P394624,The True Cream Moisturizing Bomb,belif,38.0
417081,1154743750,5,1.0,1.0,1,0,1,2020-09-12,"First off ➡️I was not compensated for this post; however, I am creating this post as part of a contest. have been using this wonderful serum for about a week now and I really like it love the consistency of the serum, how it absorbs into my skin. The smell is lovely it’s very light with a fresh clean scent. A little goes a long way I just use two maybe three pumps of the serum morning and night! I received this fabulous serum complimentary from @influenster for testing purposes!",Fabulous Serum,light,blue,normal,brown,P462699,Plum Plump Hyaluronic Acid Serum,Glow Recipe,45.0
121524,11498165617,3,0.0,,0,0,0,2022-08-29,"There is a lot of product in the packets, which is nice, but feels as though they could have multiple uses from one packet (according to the amount listed for use on the directions.) Which I think is great to not skimp, but feels a bit wasteful and unnecessary. I find other exfoliants to be a bit easier to use and control amounts, as well as sometimes gentler. The product works and does well, but I have found other options that I found to be better for my skin and more affordable as well. I received thiscomplimentary from Dermalogica Sampling",Gets the job done but not much else,fair,green,combination,brown,P423688,Daily Microfoliant Exfoliator,Dermalogica,65.0
248031,27079095164,1,0.0,0.0,3,3,0,2022-07-03,Terrible! It felt so slimy on my skin and it was so thick that it could barely get out of the tube. When I finally squeezed some out it felt like I was spreading butter on my skin. Would not recommend.,,light,hazel,combination,brown,P478030,Mini Oat Cleansing Balm,The INKEY List,5.99
66213,2042419786,5,1.0,,0,0,0,2018-08-22,"I received this in my Play Box and I fell in love with it. I love the clean smell, feel, and how it truly melts all my makeup away. So easy to massage one product into my skin, including eyes, and wipe away everything. My skin is so clean afterwards that when I clean my face with a cotton square and toner, there’s no dirt or makeup on the cotton. You only need a tiny bit for your whole face, so it’s cost effective also. I’m so glad I discovered this product.",Melts away all my makeup,lightMedium,brown,dry,brown,P450271,Green Clean Makeup Meltaway Cleansing Balm Limited Edition Jumbo,Farmacy,60.0
462010,6316723105,5,1.0,0.75,4,1,3,2021-03-26,"I love this moisturizer. If you have dry skin this moisturizer is for you. It’s a pretty thick cream but it doesn’t clock your pores. I also found it that this moisturizer goes well before makeup, it gives a perfect foundation for you to apply product. The only thing I wish it came in a bigger tube and it wasn’t as pricey.",,tan,brown,dry,black,P453253,Vegan Milk Moisturizer,MILK MAKEUP,38.0
204878,1831202362,5,,,0,0,0,2011-05-17,"ELIXIR doesn’t fully describe this skin-loving mist. it is magical in the way it uplifts the mood and freshens the skin. my skin can be reactive to the pollen or heat of the day and this micro mist miracle will instantly cool my face and neck. i use it after cleansing my face, before applying serum or moisturizer at night; also before moisturizer and primer under my makeup during the day. sometimes i use it over my makeup (minerals) if my skin looks or feels dry. the small size is purse-friendly and gives immediate gratification during the day to freshen my makeup... no need to remove foundation or even look in a mirror. LOVE THIS PRODUCT",FRESH FRAGRANCE is best,,,combination,,P481817,"Beauty Elixir Prep, Set, Glow Face Mist",Caudalie,49.0
64456,2641941850,5,1.0,0.5,2,1,1,2019-09-03,"Best makeup removing product! It removes all makeup in seconds and leaves your skin feeling great (i have very sensitive skin), also doesn’t bother my eyes when removing eye makeup. This is my forever favorite now.",Awesome makeup remover,light,brown,combination,blonde,P450271,Green Clean Makeup Meltaway Cleansing Balm Limited Edition Jumbo,Farmacy,60.0
224786,1054717412,5,1.0,1.0,1,0,1,2019-08-20,"A friend bought this and we used it while watching TV, and wow! My skin was super smooth and I like the results so much more than pricier products I own.So I had to buy my own bottle and it’s amazing price.",Better than high end products,fair,hazel,dry,red,P442563,AHA 30% + BHA 2% Exfoliating Peeling Solution,The Ordinary,9.5
426063,11506770861,5,1.0,,0,0,0,2019-09-20,Great product that’s super easy to use! The texture is a really nice milky consistency without being too runny. Great to use on its own in the summer without a moisturiser and layered with a face cream now that’s cooler outside.,Two Steps in One!,lightMedium,brown,dry,black,P446930,Cream Skin Toner & Moisturizer,LANEIGE,33.0
175752,1501500010,5,1.0,,0,0,0,2018-07-01,Loves these wipes! Exfoliating side isn’t too rough and wipes away stubborn eye liner,love it!,deep,brown,oily,black,P409800,Cleansing & Exfoliating Wipes,SEPHORA COLLECTION,3.0
596858,8100997379,2,0.0,0.8235290050506592,34,6,28,2020-01-22,This collagen might be great and work wonderfully if you’re stupid-rich and don’t mind having to spend $115 about every 3 weeks. That’s how long the tube lasts. Seriously. I’m not convinced it really did anything anyway.,Very.....meh.,light,green,combination,red,P421277,GENIUS Liquid Collagen Serum,Algenist,115.0
286121,8976763130,5,1.0,,0,0,0,2022-09-07,"Living in Florida where the sun is always out 😁  I often forget to apply sunblock meaning, I have an area where my skin/face that gets very dry and tight, then the pealing begins ( this is on my nose) when I receive this I was a little skeptical, but it came just in time because my nose was feeling tight and ready for it’s next peel session. Well after one full use ( a morning & nighttime Application) I honestly could feel that the skin on my nose was not as tight and after 2 more days my face felt softer and moisturized I didn’t have any breakouts and what I liked the most was when I sweat it didn’t run into my eyes like other moisturizers have done.",Will definitely purchase,medium,hazel,combination,black,P481084,Mini Revitalizing Supreme+ Youth Power Creme Moisturizer,Estée Lauder,64.0
587741,1175568284,5,,,0,0,0,2010-09-29,This is definitely my go to scrub! No matter what scrub I’ll venture out to try I always come back to this one (I’ve only tried 2 scrubs in the 15 years I’ve used this product). The exfoliation is intense. I like to mix it with a little bit of water so it’s a little bit more gentle. Awesome for oily and stronger skins. If your skin is thinner this may be too much exfoliation for you. Plus the menthol makes my skin feel so fresh and clean after I use it. Love love love this!,I've Used This For Years!,tan,,oily,,P122718,Exfoliating Face Scrub,CLINIQUE,26.0
396663,5151461670,5,,1.0,2,0,2,2014-12-04,"I love Josie Maran products period but this one is one of my top 3 favorites. I have been using this over a year now and just now bought my second bottle. I love how it cleanses and hydrates my skin. I apply it with my face dry then wash with water and to make sure my makeup is completely off I wash with Purity after it. I have not had not one breakout from using this. Before I found this, I kept feeling like some of my makeup was lingering after I washed my face and this was recommended to me and I am so happy I tried it. It is a must have for my nightly routine. It also helps to take off waterproof eye makeup...I again still use a makeup remover after it but I it helps me to not feel like I am rubbing my eyelashes off. Great stuff. Give it a try.",Really like this stuff,,,,,P283501,Argan Cleansing Oil,Josie Maran,36.0
353695,5469575794,5,1.0,1.0,8,0,8,2020-07-30,Love love love this product! I purchased this product from a recommendation of a Sephora staff member. I have sensitive skin and usually wake up to scaly skin with little white blemishes on a red nose. Not anymore! It’s only been a week but I can’t say enough about how fabulous this product is. My skin is nourished and healthy looking in the morning :) The redness has diminished substantially and I haven’t had any blemishes. ❤️,Favourite product!,light,brown,dry,brown,P440307,Superberry Hydrate + Glow Dream Night Mask with Vitamin C,Youth To The People,52.0
475297,7166425730,5,1.0,,0,0,0,2022-02-04,"Have repurchased countless times, doesn’t break me out and helps get rid of dry patches and over all tightness. Not for super acne prone skin I would say, but it’s a staple for me. And so affordable",GOAT oil,light,hazel,combination,brown,P427415,100% Organic Cold-Pressed Rose Hip Seed Oil,The Ordinary,10.9
171440,5929684364,4,,1.0,3,0,3,2014-03-29,"This moisturizing gel is lightweight and absorbs very quickly; however after 1 month of use, I haven’t been able to notice any dramatic differences in my skin and it lacks any added sunscreen. It moisturizes well enough, but I will likely search for something different when this bottle runs out.",Works well,,,,,P122900,Dramatically Different Moisturizing Gel,CLINIQUE,32.5
443591,9976682617,5,1.0,,0,0,0,2019-01-13,"such an amazing product got this in a sample size from a gift set and it was amazing lasts you a month or so , use it every morning every night and my skin feels so soft and glowing! i 100% recommend this , i also have very sensitive skin and it helped calm down the redness around my face ! go ahead and try it out :)",perfect for sensitive skin !,light,brown,oily,black,P405599,SEA drink of H2O hydrating boost moisturizer,tarte,39.0
319678,5611608549,5,1.0,,0,0,0,2020-09-20,I love this cleanser. Leaves your skin shining and clean as a whistle!,Love it,lightMedium,green,combination,blonde,P461537,The Rice Wash Skin-Softening Cleanser,Tatcha,40.0
226990,30752294702,5,1.0,1.0,1,0,1,2022-02-06,I received a sample free from Influenster in exchange for an honest review. The smell was mild and not overwhelming. It went on smoothly and wasn’t oily or sticky. My skin felt hydrated and soft afterwards. I would consider purchasing this product.,,fair,green,combination,brown,P480612,Santorini Grape Poreless Skin Cream,KORRES,38.5
275860,1469760327,5,1.0,1.0,2,0,2,2019-10-28,"This works amazingly! I used the whole bottle. It took me about 3 months. I use it at night before my serums and wake to beautiful, radiant, clear skin.",,rich,brown,oily,black,P427406,Glycolic Acid 7% Exfoliating Toning Solution,The Ordinary,13.0
278262,7910999218,5,1.0,0.8181819915771484,11,2,9,2020-07-02,"This stuff is awesome. I mix some into my face serum and body lotion, and it gives a perfect, streak-free golden glow. I love that it’s not a separate product that I have to put on, and it doesn’t make my face greasy or clog pores. It’s one of my favorite products I’ve found in a long time! I got a trial size and after using it just once purchased a full size. What an awesome idea this is.",obsessed,light,green,combination,auburn,P431180,Self Tanning Bronzing Face Drops,Isle of Paradise,32.0
326922,6053710182,5,1.0,,0,0,0,2020-10-09,"I like that it doesn’t dehydrate my skin at all. It actually helps moisturize my skin which is very important for me.  I also really like how clean that it makes my face.  I really like the texture of the product, it almost seems like its exfoliating my skin but not in a harsh way.",Best face wash I've ever tried,light,blue,dry,brown,P504595,Mini Rice Wash Skin-Softening Cleanser,Tatcha,18.0
170896,7585300406,5,,1.0,2,0,2,2016-01-03,"i love this product as it it goes on and soaks into the skin really really easily, it took about 3 days for me to really notice the difference in my skin, would deffinatly use this again.",LOVE LOVE LOVE,,,dry,,P122900,Dramatically Different Moisturizing Gel,CLINIQUE,32.5
516371,7378665885,5,1.0,1.0,1,0,1,2020-11-13,"I received this sunscreen complimentary from Innisfree in exchange for my honest review. I absolutely love this sunscreen! I am very picky when it comes to sunscreen, most are really greasy and end up breaking me out, not this one! This one is non greasy, and goes on very smoothly. This one doesn’t smell too strong either. I love how simple the packaging is as well. Also, at the price point that it is I would definitely keep using this one!!",Love this sunscreen!,light,brown,combination,brown,P456392,Daily UV Defense Invisible Broad Spectrum SPF 36 Sunscreen,innisfree,16.0
9659,10297031144,1,0.0,,0,0,0,2019-06-13,"Been using this for over a month on a nightly basis and my lips are still dry and cracked, don’t waste your money on this.",Doesn't make a difference,fair,blue,oily,blonde,P420652,Lip Sleeping Mask Intense Hydration with Vitamin C,LANEIGE,24.0
386909,6296315537,5,1.0,1.0,2,0,2,2018-09-05,"I’m blown away by how good this moisturizer is. It hydrates, moisturizes, and, for me at least, even helps keep breakouts away. I have insanely problematic skin from medication (dry, dehydrated, acne-prone), and this stuff is the only cream I can use during the day since it completely soaks into my skin while still leaving me moisturized all day long. It’s also gnetle and soothing. My face looks less irritated immediately after use. A  Youth to the People.",Insanely Good,fair,blue,dry,brown,P463371,Mini Adaptogen Deep Moisture Cream with Ashwagandha + Reishi,Youth To The People,18.0
53832,2509523854,5,,,0,0,0,2016-11-17,"I have combination skin where my cheeks get dry, but my t-zone gets oily. I have been searching for the “it“ moisturizer for my skin as my past products never really kept my cheeks moisturized. They always felt dry. After researching Korean products, I found Belif Aqua Bomb as a great moisturizer. When you open the jar, it looks like this super goopy gel. When you apply it all over your face, it feels like this watery cooling gel and it absorbs so quickly. It reminded me of the products that an esthetician put on my face during a facial, it was amazing. My face has never felt any suppler and soft after this moisturizer. Though, I’ve only used it for a day, I can already feel and see an improvement on my skin, especially my cheeks.",complete lifechanger,,,combination,,P394639,The True Cream Aqua Bomb,belif,38.0
326297,9169943298,5,1.0,0.5,2,1,1,2022-05-02,"My go to cleanser, I love the texture. Starts off grainy and turns into a gentle foam that leaves your skin feeling fresh and clean",,lightMedium,brown,combination,blonde,P504595,Mini Rice Wash Skin-Softening Cleanser,Tatcha,18.0
360792,2163881326,2,0.0,0.9411759972572328,17,1,16,2017-12-25,"It has great ingredients, but it made my skin way worse. I used it for a few weeks to try to push through the purging but I just can’t do it anymore.",Disappointing,mediumTan,brown,combination,brown,P410400,U.F.O. Salicylic Acid BHA Acne Treatment Face Oil,Sunday Riley,80.0
181787,2135374262,5,1.0,,0,0,0,2020-12-23,I used SKINLONGEVITY LONG LIFE HERB SERUM and it was so clean and light on my skin I enjoyed this product.,,mediumTan,blue,combination,brown,P460779,Skinlongevity Long Life Herb Anti-Aging Face Serum,bareMinerals,65.0
